title,authors,abstract,pdf_url,source_url,id,year,conference
Revisiting Character-level Adversarial Attacks for Language Models,"Elias Abad Rocamora, Yongtao Wu, Fanghui Liu, Grigorios Chrysos, Volkan Cevher",N/A (摘要需访问详情页),https://raw.githubusercontent.com/mlresearch/v235/main/assets/abad-rocamora24a/abad-rocamora24a.pdf,https://proceedings.mlr.press/v235/abad-rocamora24a.html,abad-rocamora24a,2024,ICML
Adaptively Perturbed Mirror Descent for Learning in Games,"Kenshi Abe, Kaito Ariu, Mitsuki Sakamoto, Atsushi Iwasaki",N/A (摘要需访问详情页),https://raw.githubusercontent.com/mlresearch/v235/main/assets/abe24a/abe24a.pdf,https://proceedings.mlr.press/v235/abe24a.html,abe24a,2024,ICML
InferCept: Efficient Intercept Support for Augmented Large Language Model Inference,"Reyna Abhyankar, Zijian He, Vikranth Srivatsa, Hao Zhang, Yiying Zhang",N/A (摘要需访问详情页),https://raw.githubusercontent.com/mlresearch/v235/main/assets/abhyankar24a/abhyankar24a.pdf,https://proceedings.mlr.press/v235/abhyankar24a.html,abhyankar24a,2024,ICML
Balancing Feature Similarity and Label Variability for Optimal Size-Aware One-shot Subset Selection,"Abhinab Acharya, Dayou Yu, Qi Yu, Xumin Liu",N/A (摘要需访问详情页),https://raw.githubusercontent.com/mlresearch/v235/main/assets/acharya24a/acharya24a.pdf,https://proceedings.mlr.press/v235/acharya24a.html,acharya24a,2024,ICML
Bayesian Uncertainty for Gradient Aggregation in Multi-Task Learning,"Idan Achituve, Idit Diamant, Arnon Netzer, Gal Chechik, Ethan Fetaya",N/A (摘要需访问详情页),https://raw.githubusercontent.com/mlresearch/v235/main/assets/achituve24a/achituve24a.pdf,https://proceedings.mlr.press/v235/achituve24a.html,achituve24a,2024,ICML
AttnLRP: Attention-Aware Layer-Wise Relevance Propagation for Transformers,"Reduan Achtibat, Sayed Mohammad Vakilzadeh Hatefi, Maximilian Dreyer, Aakriti Jain, Thomas Wiegand, Sebastian Lapuschkin, Wojciech Samek",N/A (摘要需访问详情页),https://raw.githubusercontent.com/mlresearch/v235/main/assets/achtibat24a/achtibat24a.pdf,https://proceedings.mlr.press/v235/achtibat24a.html,achtibat24a,2024,ICML
A Unified Framework for Learning with Nonlinear Model Classes from Arbitrary Linear Samples,"Ben Adcock, Juan M. Cardenas, Nick Dexter",N/A (摘要需访问详情页),https://raw.githubusercontent.com/mlresearch/v235/main/assets/adcock24a/adcock24a.pdf,https://proceedings.mlr.press/v235/adcock24a.html,adcock24a,2024,ICML
FrameQuant: Flexible Low-Bit Quantization for Transformers,"Harshavardhan Adepu, Zhanpeng Zeng, Li Zhang, Vikas Singh",N/A (摘要需访问详情页),https://raw.githubusercontent.com/mlresearch/v235/main/assets/adepu24a/adepu24a.pdf,https://proceedings.mlr.press/v235/adepu24a.html,adepu24a,2024,ICML
BeigeMaps: Behavioral Eigenmaps for Reinforcement Learning from Images,"Sandesh Adhikary, Anqi Li, Byron Boots",N/A (摘要需访问详情页),https://raw.githubusercontent.com/mlresearch/v235/main/assets/adhikary24a/adhikary24a.pdf,https://proceedings.mlr.press/v235/adhikary24a.html,adhikary24a,2024,ICML
Discovering Bias in Latent Space: An Unsupervised Debiasing Approach,"Dyah Adila, Shuai Zhang, Boran Han, Bernie Wang",N/A (摘要需访问详情页),https://raw.githubusercontent.com/mlresearch/v235/main/assets/adila24a/adila24a.pdf,https://proceedings.mlr.press/v235/adila24a.html,adila24a,2024,ICML
Optimal Coresets for Low-Dimensional Geometric Median,"Peyman Afshani, Chris Schwiegelshohn",N/A (摘要需访问详情页),https://raw.githubusercontent.com/mlresearch/v235/main/assets/afshani24a/afshani24a.pdf,https://proceedings.mlr.press/v235/afshani24a.html,afshani24a,2024,ICML
REST: Efficient and Accelerated EEG Seizure Analysis through Residual State Updates,"Arshia Afzal, Grigorios Chrysos, Volkan Cevher, Mahsa Shoaran",N/A (摘要需访问详情页),https://raw.githubusercontent.com/mlresearch/v235/main/assets/afzal24a/afzal24a.pdf,https://proceedings.mlr.press/v235/afzal24a.html,afzal24a,2024,ICML
CHAI: Clustered Head Attention for Efficient LLM Inference,"Saurabh Agarwal, Bilge Acun, Basil Hosmer, Mostafa Elhoushi, Yejin Lee, Shivaram Venkataraman, Dimitris Papailiopoulos, Carole-Jean Wu",N/A (摘要需访问详情页),https://raw.githubusercontent.com/mlresearch/v235/main/assets/agarwal24a/agarwal24a.pdf,https://proceedings.mlr.press/v235/agarwal24a.html,agarwal24a,2024,ICML
Learning to Play Atari in a World of Tokens,"Pranav Agarwal, Sheldon Andrews, Samira Ebrahimi Kahou",N/A (摘要需访问详情页),https://raw.githubusercontent.com/mlresearch/v235/main/assets/agarwal24b/agarwal24b.pdf,https://proceedings.mlr.press/v235/agarwal24b.html,agarwal24b,2024,ICML
Probabilistic Generating Circuits - Demystified,"Sanyam Agarwal, Markus Bläser",N/A (摘要需访问详情页),https://raw.githubusercontent.com/mlresearch/v235/main/assets/agarwal24c/agarwal24c.pdf,https://proceedings.mlr.press/v235/agarwal24c.html,agarwal24c,2024,ICML
Improved Differentially Private and Lazy Online Convex Optimization: Lower Regret without Smoothness Requirements,"Naman Agarwal, Satyen Kale, Karan Singh, Abhradeep Guha Thakurta",N/A (摘要需访问详情页),https://raw.githubusercontent.com/mlresearch/v235/main/assets/agarwal24d/agarwal24d.pdf,https://proceedings.mlr.press/v235/agarwal24d.html,agarwal24d,2024,ICML
The Non-linear $F$-Design and Applications to Interactive Learning,"Alekh Agarwal, Jian Qian, Alexander Rakhlin, Tong Zhang",N/A (摘要需访问详情页),https://raw.githubusercontent.com/mlresearch/v235/main/assets/agarwal24e/agarwal24e.pdf,https://proceedings.mlr.press/v235/agarwal24e.html,agarwal24e,2024,ICML
ACPO: A Policy Optimization Algorithm for Average MDPs with Constraints,"Akhil Agnihotri, Rahul Jain, Haipeng Luo",N/A (摘要需访问详情页),https://raw.githubusercontent.com/mlresearch/v235/main/assets/agnihotri24a/agnihotri24a.pdf,https://proceedings.mlr.press/v235/agnihotri24a.html,agnihotri24a,2024,ICML
CosPGD: an efficient white-box adversarial attack for pixel-wise prediction tasks,"Shashank Agnihotri, Steffen Jung, Margret Keuper",N/A (摘要需访问详情页),https://raw.githubusercontent.com/mlresearch/v235/main/assets/agnihotri24b/agnihotri24b.pdf,https://proceedings.mlr.press/v235/agnihotri24b.html,agnihotri24b,2024,ICML
LeaPformer: Enabling Linear Transformers for Autoregressive and Simultaneous Tasks via Learned Proportions,"Victor Agostinelli Iii, Sanghyun Hong, Lizhong Chen",N/A (摘要需访问详情页),https://raw.githubusercontent.com/mlresearch/v235/main/assets/agostinelli-iii24a/agostinelli-iii24a.pdf,https://proceedings.mlr.press/v235/agostinelli-iii24a.html,agostinelli-iii24a,2024,ICML
Policy Evaluation for Variance in Average Reward Reinforcement Learning,"Shubhada Agrawal, Prashanth L A, Siva Theja Maguluri",N/A (摘要需访问详情页),https://raw.githubusercontent.com/mlresearch/v235/main/assets/agrawal24a/agrawal24a.pdf,https://proceedings.mlr.press/v235/agrawal24a.html,agrawal24a,2024,ICML
Distinguishing the Knowable from the Unknowable with Language Models,"Gustaf Ahdritz, Tian Qin, Nikhil Vyas, Boaz Barak, Benjamin L. Edelman",N/A (摘要需访问详情页),https://raw.githubusercontent.com/mlresearch/v235/main/assets/ahdritz24a/ahdritz24a.pdf,https://proceedings.mlr.press/v235/ahdritz24a.html,ahdritz24a,2024,ICML
Unmasking Vulnerabilities: Cardinality Sketches under Adaptive Inputs,"Sara Ahmadian, Edith Cohen",N/A (摘要需访问详情页),https://raw.githubusercontent.com/mlresearch/v235/main/assets/ahmadian24a/ahmadian24a.pdf,https://proceedings.mlr.press/v235/ahmadian24a.html,ahmadian24a,2024,ICML
OptiMUS: Scalable Optimization Modeling with (MI)LP Solvers and Large Language Models,"Ali Ahmaditeshnizi, Wenzhi Gao, Madeleine Udell",N/A (摘要需访问详情页),https://raw.githubusercontent.com/mlresearch/v235/main/assets/ahmaditeshnizi24a/ahmaditeshnizi24a.pdf,https://proceedings.mlr.press/v235/ahmaditeshnizi24a.html,ahmaditeshnizi24a,2024,ICML
How to Escape Sharp Minima with Random Perturbations,"Kwangjun Ahn, Ali Jadbabaie, Suvrit Sra",N/A (摘要需访问详情页),https://raw.githubusercontent.com/mlresearch/v235/main/assets/ahn24a/ahn24a.pdf,https://proceedings.mlr.press/v235/ahn24a.html,ahn24a,2024,ICML
Understanding Adam Optimizer via Online Learning of Updates: Adam is FTRL in Disguise,"Kwangjun Ahn, Zhiyu Zhang, Yunbum Kook, Yan Dai",N/A (摘要需访问详情页),https://raw.githubusercontent.com/mlresearch/v235/main/assets/ahn24b/ahn24b.pdf,https://proceedings.mlr.press/v235/ahn24b.html,ahn24b,2024,ICML
Not all distributional shifts are equal: Fine-grained robust conformal inference,"Jiahao Ai, Zhimei Ren",N/A (摘要需访问详情页),https://raw.githubusercontent.com/mlresearch/v235/main/assets/ai24a/ai24a.pdf,https://proceedings.mlr.press/v235/ai24a.html,ai24a,2024,ICML
Triple Changes Estimator for Targeted Policies,"Sina Akbari, Negar Kiyavash",N/A (摘要需访问详情页),https://raw.githubusercontent.com/mlresearch/v235/main/assets/akbari24a/akbari24a.pdf,https://proceedings.mlr.press/v235/akbari24a.html,akbari24a,2024,ICML
Improving Computational Complexity in Statistical Models with Local Curvature Information,"Pedram Akbarian, Tongzheng Ren, Jiacheng Zhuo, Sujay Sanghavi, Nhat Ho",N/A (摘要需访问详情页),https://raw.githubusercontent.com/mlresearch/v235/main/assets/akbarian24a/akbarian24a.pdf,https://proceedings.mlr.press/v235/akbarian24a.html,akbarian24a,2024,ICML
Learning Mixtures of Gaussian Processes through Random Projection,"Emmanuel Akeweje, Mimi Zhang",N/A (摘要需访问详情页),https://raw.githubusercontent.com/mlresearch/v235/main/assets/akeweje24a/akeweje24a.pdf,https://proceedings.mlr.press/v235/akeweje24a.html,akeweje24a,2024,ICML
Encodings for Prediction-based Neural Architecture Search,"Yash Akhauri, Mohamed S Abdelfattah",N/A (摘要需访问详情页),https://raw.githubusercontent.com/mlresearch/v235/main/assets/akhauri24a/akhauri24a.pdf,https://proceedings.mlr.press/v235/akhauri24a.html,akhauri24a,2024,ICML
Iterated Denoising Energy Matching for Sampling from Boltzmann Densities,"Tara Akhound-Sadegh, Jarrid Rector-Brooks, Joey Bose, Sarthak Mittal, Pablo Lemos, Cheng-Hao Liu, Marcin Sendera, Siamak Ravanbakhsh, Gauthier Gidel, Yoshua Bengio, Nikolay Malkin, Alexander Tong",N/A (摘要需访问详情页),https://raw.githubusercontent.com/mlresearch/v235/main/assets/akhound-sadegh24a/akhound-sadegh24a.pdf,https://proceedings.mlr.press/v235/akhound-sadegh24a.html,akhound-sadegh24a,2024,ICML
In-Context Language Learning: Architectures and Algorithms,"Ekin Akyürek, Bailin Wang, Yoon Kim, Jacob Andreas",N/A (摘要需访问详情页),https://raw.githubusercontent.com/mlresearch/v235/main/assets/akyurek24a/akyurek24a.pdf,https://proceedings.mlr.press/v235/akyurek24a.html,akyurek24a,2024,ICML
Nonlinear Filtering with Brenier Optimal Transport Maps,"Mohammad Al-Jarrah, Niyizhen Jin, Bamdad Hosseini, Amirhossein Taghvaei",N/A (摘要需访问详情页),https://raw.githubusercontent.com/mlresearch/v235/main/assets/al-jarrah24a/al-jarrah24a.pdf,https://proceedings.mlr.press/v235/al-jarrah24a.html,al-jarrah24a,2024,ICML
Revisiting Inexact Fixed-Point Iterations for Min-Max Problems: Stochasticity and Structured Nonconvexity,"Ahmet Alacaoglu, Donghwan Kim, Stephen Wright",N/A (摘要需访问详情页),https://raw.githubusercontent.com/mlresearch/v235/main/assets/alacaoglu24a/alacaoglu24a.pdf,https://proceedings.mlr.press/v235/alacaoglu24a.html,alacaoglu24a,2024,ICML
Gaussian Processes on Cellular Complexes,"Mathieu Alain, So Takao, Brooks Paige, Marc Peter Deisenroth",N/A (摘要需访问详情页),https://raw.githubusercontent.com/mlresearch/v235/main/assets/alain24a/alain24a.pdf,https://proceedings.mlr.press/v235/alain24a.html,alain24a,2024,ICML
Remembering to Be Fair: Non-Markovian Fairness in Sequential Decision Making,"Parand A. Alamdari, Toryn Q. Klassen, Elliot Creager, Sheila A. Mcilraith",N/A (摘要需访问详情页),https://raw.githubusercontent.com/mlresearch/v235/main/assets/alamdari24a/alamdari24a.pdf,https://proceedings.mlr.press/v235/alamdari24a.html,alamdari24a,2024,ICML
Stochastic Interpolants with Data-Dependent Couplings,"Michael Samuel Albergo, Mark Goldstein, Nicholas Matthew Boffi, Rajesh Ranganath, Eric Vanden-Eijnden",N/A (摘要需访问详情页),https://raw.githubusercontent.com/mlresearch/v235/main/assets/albergo24a/albergo24a.pdf,https://proceedings.mlr.press/v235/albergo24a.html,albergo24a,2024,ICML
Evaluating Model Bias Requires Characterizing its Mistakes,"Isabela Albuquerque, Jessica Schrouff, David Warde-Farley, Ali Taylan Cemgil, Sven Gowal, Olivia Wiles",N/A (摘要需访问详情页),https://raw.githubusercontent.com/mlresearch/v235/main/assets/albuquerque24a/albuquerque24a.pdf,https://proceedings.mlr.press/v235/albuquerque24a.html,albuquerque24a,2024,ICML
Energy-Efficient Gaussian Processes Using Low-Precision Arithmetic,"Nicolas Alder, Ralf Herbrich",N/A (摘要需访问详情页),https://raw.githubusercontent.com/mlresearch/v235/main/assets/alder24a/alder24a.pdf,https://proceedings.mlr.press/v235/alder24a.html,alder24a,2024,ICML
Evaluation of Test-Time Adaptation Under Computational Time Constraints,"Motasem Alfarra, Hani Itani, Alejandro Pardo, Shyma Yaser Alhuwaider, Merey Ramazanova, Juan Camilo Perez, Zhipeng Cai, Matthias Müller, Bernard Ghanem",N/A (摘要需访问详情页),https://raw.githubusercontent.com/mlresearch/v235/main/assets/alfarra24a/alfarra24a.pdf,https://proceedings.mlr.press/v235/alfarra24a.html,alfarra24a,2024,ICML
On the Weight Dynamics of Deep Normalized Networks,"Christian H.X. Ali Mehmeti-Göpel, Michael Wand",N/A (摘要需访问详情页),https://raw.githubusercontent.com/mlresearch/v235/main/assets/ali-mehmeti-gopel24a/ali-mehmeti-gopel24a.pdf,https://proceedings.mlr.press/v235/ali-mehmeti-gopel24a.html,ali-mehmeti-gopel24a,2024,ICML
No Dimensional Sampling Coresets for Classification,"Meysam Alishahi, Jeff M. Phillips",N/A (摘要需访问详情页),https://raw.githubusercontent.com/mlresearch/v235/main/assets/alishahi24a/alishahi24a.pdf,https://proceedings.mlr.press/v235/alishahi24a.html,alishahi24a,2024,ICML
Unsupervised Evaluation of Code LLMs with Round-Trip Correctness,"Miltiadis Allamanis, Sheena Panthaplackel, Pengcheng Yin",N/A (摘要需访问详情页),https://raw.githubusercontent.com/mlresearch/v235/main/assets/allamanis24a/allamanis24a.pdf,https://proceedings.mlr.press/v235/allamanis24a.html,allamanis24a,2024,ICML
"Physics of Language Models: Part 3.1, Knowledge Storage and Extraction","Zeyuan Allen-Zhu, Yuanzhi Li",N/A (摘要需访问详情页),https://raw.githubusercontent.com/mlresearch/v235/main/assets/allen-zhu24a/allen-zhu24a.pdf,https://proceedings.mlr.press/v235/allen-zhu24a.html,allen-zhu24a,2024,ICML
Byzantine-Robust Federated Learning: Impact of Client Subsampling and Local Updates,"Youssef Allouah, Sadegh Farhadkhani, Rachid Guerraoui, Nirupam Gupta, Rafael Pinot, Geovani Rizk, Sasha Voitovych",N/A (摘要需访问详情页),https://raw.githubusercontent.com/mlresearch/v235/main/assets/allouah24a/allouah24a.pdf,https://proceedings.mlr.press/v235/allouah24a.html,allouah24a,2024,ICML
The Privacy Power of Correlated Noise in Decentralized Learning,"Youssef Allouah, Anastasia Koloskova, Aymane El Firdoussi, Martin Jaggi, Rachid Guerraoui",N/A (摘要需访问详情页),https://raw.githubusercontent.com/mlresearch/v235/main/assets/allouah24b/allouah24b.pdf,https://proceedings.mlr.press/v235/allouah24b.html,allouah24b,2024,ICML
Predicting Dose-Response Curves with Deep Neural Networks,"Pedro Alonso Campana, Paul Prasse, Tobias Scheffer",N/A (摘要需访问详情页),https://raw.githubusercontent.com/mlresearch/v235/main/assets/alonso-campana24a/alonso-campana24a.pdf,https://proceedings.mlr.press/v235/alonso-campana24a.html,alonso-campana24a,2024,ICML
Robust and Conjugate Gaussian Process Regression,"Matias Altamirano, Francois-Xavier Briol, Jeremias Knoblauch",N/A (摘要需访问详情页),https://raw.githubusercontent.com/mlresearch/v235/main/assets/altamirano24a/altamirano24a.pdf,https://proceedings.mlr.press/v235/altamirano24a.html,altamirano24a,2024,ICML
Beyond the Norms: Detecting Prediction Errors in Regression Models,"Andres Altieri, Marco Romanelli, Georg Pichler, Florence Alberge, Pablo Piantanida",N/A (摘要需访问详情页),https://raw.githubusercontent.com/mlresearch/v235/main/assets/altieri24a/altieri24a.pdf,https://proceedings.mlr.press/v235/altieri24a.html,altieri24a,2024,ICML
Position: Stop Making Unscientific AGI Performance Claims,"Patrick Altmeyer, Andrew M. Demetriou, Antony Bartlett, Cynthia C. S. Liem",N/A (摘要需访问详情页),https://raw.githubusercontent.com/mlresearch/v235/main/assets/altmeyer24a/altmeyer24a.pdf,https://proceedings.mlr.press/v235/altmeyer24a.html,altmeyer24a,2024,ICML
Hyperbolic Optimizer as a Dynamical System,"Nico Alvarado, Hans Lobel",N/A (摘要需访问详情页),https://raw.githubusercontent.com/mlresearch/v235/main/assets/alvarado24a/alvarado24a.pdf,https://proceedings.mlr.press/v235/alvarado24a.html,alvarado24a,2024,ICML
Stationarity without mean reversion in improper Gaussian processes,Luca Ambrogioni,N/A (摘要需访问详情页),https://raw.githubusercontent.com/mlresearch/v235/main/assets/ambrogioni24a/ambrogioni24a.pdf,https://proceedings.mlr.press/v235/ambrogioni24a.html,ambrogioni24a,2024,ICML
Robust Graph Matching when Nodes are Corrupt,"Taha Ameen, Bruce Hajek",N/A (摘要需访问详情页),https://raw.githubusercontent.com/mlresearch/v235/main/assets/ameen24a/ameen24a.pdf,https://proceedings.mlr.press/v235/ameen24a.html,ameen24a,2024,ICML
Fast Algorithms for Hypergraph PageRank with Applications to Semi-Supervised Learning,"Konstantinos Ameranis, Adela Frances Depavia, Lorenzo Orecchia, Erasmo Tani",N/A (摘要需访问详情页),https://raw.githubusercontent.com/mlresearch/v235/main/assets/ameranis24a/ameranis24a.pdf,https://proceedings.mlr.press/v235/ameranis24a.html,ameranis24a,2024,ICML
Scalable and Flexible Causal Discovery with an Efficient Test for Adjacency,"Alan Nawzad Amin, Andrew Gordon Wilson",N/A (摘要需访问详情页),https://raw.githubusercontent.com/mlresearch/v235/main/assets/amin24a/amin24a.pdf,https://proceedings.mlr.press/v235/amin24a.html,amin24a,2024,ICML
Generalization Error of Graph Neural Networks in the Mean-field Regime,"Gholamali Aminian, Yixuan He, Gesine Reinert, Lukasz Szpruch, Samuel N. Cohen",N/A (摘要需访问详情页),https://raw.githubusercontent.com/mlresearch/v235/main/assets/aminian24a/aminian24a.pdf,https://proceedings.mlr.press/v235/aminian24a.html,aminian24a,2024,ICML
Scalable Online Exploration via Coverability,"Philip Amortila, Dylan J Foster, Akshay Krishnamurthy",N/A (摘要需访问详情页),https://raw.githubusercontent.com/mlresearch/v235/main/assets/amortila24a/amortila24a.pdf,https://proceedings.mlr.press/v235/amortila24a.html,amortila24a,2024,ICML
WAVES: Benchmarking the Robustness of Image Watermarks,"Bang An, Mucong Ding, Tahseen Rabbani, Aakriti Agrawal, Yuancheng Xu, Chenghao Deng, Sicheng Zhu, Abdirisak Mohamed, Yuxin Wen, Tom Goldstein, Furong Huang",N/A (摘要需访问详情页),https://raw.githubusercontent.com/mlresearch/v235/main/assets/an24a/an24a.pdf,https://proceedings.mlr.press/v235/an24a.html,an24a,2024,ICML
Training-Free Long-Context Scaling of Large Language Models,"Chenxin An, Fei Huang, Jun Zhang, Shansan Gong, Xipeng Qiu, Chang Zhou, Lingpeng Kong",N/A (摘要需访问详情页),https://raw.githubusercontent.com/mlresearch/v235/main/assets/an24b/an24b.pdf,https://proceedings.mlr.press/v235/an24b.html,an24b,2024,ICML
Navigating Scaling Laws: Compute Optimality in Adaptive Model Training,"Sotiris Anagnostidis, Gregor Bachmann, Imanol Schlag, Thomas Hofmann",N/A (摘要需访问详情页),https://raw.githubusercontent.com/mlresearch/v235/main/assets/anagnostidis24a/anagnostidis24a.pdf,https://proceedings.mlr.press/v235/anagnostidis24a.html,anagnostidis24a,2024,ICML
Adaptive Hierarchical Certification for Segmentation using Randomized Smoothing,"Alaa Anani, Tobias Lorenz, Bernt Schiele, Mario Fritz",N/A (摘要需访问详情页),https://raw.githubusercontent.com/mlresearch/v235/main/assets/anani24a/anani24a.pdf,https://proceedings.mlr.press/v235/anani24a.html,anani24a,2024,ICML
Adaptive Observation Cost Control for Variational Quantum Eigensolvers,"Christopher J. Anders, Kim Andrea Nicoli, Bingting Wu, Naima Elosegui, Samuele Pedrielli, Lena Funcke, Karl Jansen, Stefan Kühn, Shinichi Nakajima",N/A (摘要需访问详情页),https://raw.githubusercontent.com/mlresearch/v235/main/assets/anders24a/anders24a.pdf,https://proceedings.mlr.press/v235/anders24a.html,anders24a,2024,ICML
"Fast, Scalable, Warm-Start Semidefinite Programming with Spectral Bundling and Sketching","Rico Angell, Andrew Mccallum",N/A (摘要需访问详情页),https://raw.githubusercontent.com/mlresearch/v235/main/assets/angell24a/angell24a.pdf,https://proceedings.mlr.press/v235/angell24a.html,angell24a,2024,ICML
Online conformal prediction with decaying step sizes,"Anastasios Nikolas Angelopoulos, Rina Barber, Stephen Bates",N/A (摘要需访问详情页),https://raw.githubusercontent.com/mlresearch/v235/main/assets/angelopoulos24a/angelopoulos24a.pdf,https://proceedings.mlr.press/v235/angelopoulos24a.html,angelopoulos24a,2024,ICML
A Rate-Distortion View of Uncertainty Quantification,"Ifigeneia Apostolopoulou, Benjamin Eysenbach, Frank Nielsen, Artur Dubrawski",N/A (摘要需访问详情页),https://raw.githubusercontent.com/mlresearch/v235/main/assets/apostolopoulou24a/apostolopoulou24a.pdf,https://proceedings.mlr.press/v235/apostolopoulou24a.html,apostolopoulou24a,2024,ICML
Practical Performance Guarantees for Pipelined DNN Inference,"Aaron Archer, Matthew Fahrbach, Kuikui Liu, Prakash Prabhu",N/A (摘要需访问详情页),https://raw.githubusercontent.com/mlresearch/v235/main/assets/archer24a/archer24a.pdf,https://proceedings.mlr.press/v235/archer24a.html,archer24a,2024,ICML
Unsupervised Concept Discovery Mitigates Spurious Correlations,"Md Rifat Arefin, Yan Zhang, Aristide Baratin, Francesco Locatello, Irina Rish, Dianbo Liu, Kenji Kawaguchi",N/A (摘要需访问详情页),https://raw.githubusercontent.com/mlresearch/v235/main/assets/arefin24a/arefin24a.pdf,https://proceedings.mlr.press/v235/arefin24a.html,arefin24a,2024,ICML
Accelerating Legacy Numerical Solvers by Non-intrusive Gradient-based Meta-solving,"Sohei Arisaka, Qianxiao Li",N/A (摘要需访问详情页),https://raw.githubusercontent.com/mlresearch/v235/main/assets/arisaka24a/arisaka24a.pdf,https://proceedings.mlr.press/v235/arisaka24a.html,arisaka24a,2024,ICML
Causal Action Influence Aware Counterfactual Data Augmentation,"Núria Armengol Urpı́, Marco Bagatella, Marin Vlastelica, Georg Martius",N/A (摘要需访问详情页),https://raw.githubusercontent.com/mlresearch/v235/main/assets/armengol-urpi-24a/armengol-urpi-24a.pdf,https://proceedings.mlr.press/v235/armengol-urpi-24a.html,armengol-urpi-24a,2024,ICML
Online Learning and Information Exponents: The Importance of Batch size & Time/Complexity Tradeoffs,"Luca Arnaboldi, Yatin Dandi, Florent Krzakala, Bruno Loureiro, Luca Pesce, Ludovic Stephan",N/A (摘要需访问详情页),https://raw.githubusercontent.com/mlresearch/v235/main/assets/arnaboldi24a/arnaboldi24a.pdf,https://proceedings.mlr.press/v235/arnaboldi24a.html,arnaboldi24a,2024,ICML
Simple linear attention language models balance the recall-throughput tradeoff,"Simran Arora, Sabri Eyuboglu, Michael Zhang, Aman Timalsina, Silas Alberti, James Zou, Atri Rudra, Christopher Re",N/A (摘要需访问详情页),https://raw.githubusercontent.com/mlresearch/v235/main/assets/arora24a/arora24a.pdf,https://proceedings.mlr.press/v235/arora24a.html,arora24a,2024,ICML
Inferring Change Points in High-Dimensional Linear Regression via Approximate Message Passing,"Gabriel Arpino, Xiaoqi Liu, Ramji Venkataramanan",N/A (摘要需访问详情页),https://raw.githubusercontent.com/mlresearch/v235/main/assets/arpino24a/arpino24a.pdf,https://proceedings.mlr.press/v235/arpino24a.html,arpino24a,2024,ICML
An amortized approach to non-linear mixed-effects modeling based on neural posterior estimation,"Jonas Arruda, Yannik Schälte, Clemens Peiter, Olga Teplytska, Ulrich Jaehde, Jan Hasenauer",N/A (摘要需访问详情页),https://raw.githubusercontent.com/mlresearch/v235/main/assets/arruda24a/arruda24a.pdf,https://proceedings.mlr.press/v235/arruda24a.html,arruda24a,2024,ICML
Learning the Target Network in Function Space,"Kavosh Asadi, Yao Liu, Shoham Sabach, Ming Yin, Rasool Fakoor",N/A (摘要需访问详情页),https://raw.githubusercontent.com/mlresearch/v235/main/assets/asadi24a/asadi24a.pdf,https://proceedings.mlr.press/v235/asadi24a.html,asadi24a,2024,ICML
Translation Equivariant Transformer Neural Processes,"Matthew Ashman, Cristiana Diaconu, Junhyuck Kim, Lakee Sivaraya, Stratis Markou, James Requeima, Wessel P Bruinsma, Richard E. Turner",N/A (摘要需访问详情页),https://raw.githubusercontent.com/mlresearch/v235/main/assets/ashman24a/ashman24a.pdf,https://proceedings.mlr.press/v235/ashman24a.html,ashman24a,2024,ICML
Private Vector Mean Estimation in the Shuffle Model: Optimal Rates Require Many Messages,"Hilal Asi, Vitaly Feldman, Jelani Nelson, Huy Nguyen, Kunal Talwar, Samson Zhou",N/A (摘要需访问详情页),https://raw.githubusercontent.com/mlresearch/v235/main/assets/asi24a/asi24a.pdf,https://proceedings.mlr.press/v235/asi24a.html,asi24a,2024,ICML
