title,authors,abstract,pdf_url,source_url,id,year,conference
PPFLOW: Target-Aware Peptide Design with Torsional Flow Matching,"Haitao Lin, Odin Zhang, Huifeng Zhao, Dejun Jiang, Lirong Wu, Zicheng Liu, Yufei Huang, Stan Z. Li",N/A (摘要需访问详情页),https://raw.githubusercontent.com/mlresearch/v235/main/assets/lin24z/lin24z.pdf,https://proceedings.mlr.press/v235/lin24z.html,lin24z,2024,ICML
Lie Neurons: Adjoint-Equivariant Neural Networks for Semisimple Lie Algebras,"Tzu-Yuan Lin, Minghan Zhu, Maani Ghaffari",N/A (摘要需访问详情页),https://raw.githubusercontent.com/mlresearch/v235/main/assets/lin24aa/lin24aa.pdf,https://proceedings.mlr.press/v235/lin24aa.html,lin24aa,2024,ICML
Plug-in Performative Optimization,"Licong Lin, Tijana Zrnic",N/A (摘要需访问详情页),https://raw.githubusercontent.com/mlresearch/v235/main/assets/lin24ab/lin24ab.pdf,https://proceedings.mlr.press/v235/lin24ab.html,lin24ab,2024,ICML
Position: A Call to Action for a Human-Centered AutoML Paradigm,"Marius Lindauer, Florian Karl, Anne Klier, Julia Moosbauer, Alexander Tornede, Andreas C Mueller, Frank Hutter, Matthias Feurer, Bernd Bischl",N/A (摘要需访问详情页),https://raw.githubusercontent.com/mlresearch/v235/main/assets/lindauer24a/lindauer24a.pdf,https://proceedings.mlr.press/v235/lindauer24a.html,lindauer24a,2024,ICML
Deep Equilibrium Models are Almost Equivalent to Not-so-deep Explicit Models for High-dimensional Gaussian Mixtures,"Zenan Ling, Longbo Li, Zhanbo Feng, Yixuan Zhang, Feng Zhou, Robert C Qiu, Zhenyu Liao",N/A (摘要需访问详情页),https://raw.githubusercontent.com/mlresearch/v235/main/assets/ling24a/ling24a.pdf,https://proceedings.mlr.press/v235/ling24a.html,ling24a,2024,ICML
Beyond Regular Grids: Fourier-Based Neural Operators on Arbitrary Domains,"Levi E. Lingsch, Mike Yan Michelis, Emmanuel De Bezenac, Sirani M. Perera, Robert K. Katzschmann, Siddhartha Mishra",N/A (摘要需访问详情页),https://raw.githubusercontent.com/mlresearch/v235/main/assets/lingsch24a/lingsch24a.pdf,https://proceedings.mlr.press/v235/lingsch24a.html,lingsch24a,2024,ICML
Scaling Tractable Probabilistic Circuits: A Systems Perspective,"Anji Liu, Kareem Ahmed, Guy Van Den Broeck",N/A (摘要需访问详情页),https://raw.githubusercontent.com/mlresearch/v235/main/assets/liu24a/liu24a.pdf,https://proceedings.mlr.press/v235/liu24a.html,liu24a,2024,ICML
"Causal Bandits: The Pareto Optimal Frontier of Adaptivity, a Reduction to Linear Bandits, and Limitations around Unknown Marginals","Ziyi Liu, Idan Attias, Daniel M. Roy",N/A (摘要需访问详情页),https://raw.githubusercontent.com/mlresearch/v235/main/assets/liu24b/liu24b.pdf,https://proceedings.mlr.press/v235/liu24b.html,liu24b,2024,ICML
Orthogonal Bootstrap: Efficient Simulation of Input Uncertainty,"Kaizhao Liu, Jose Blanchet, Lexing Ying, Yiping Lu",N/A (摘要需访问详情页),https://raw.githubusercontent.com/mlresearch/v235/main/assets/liu24c/liu24c.pdf,https://proceedings.mlr.press/v235/liu24c.html,liu24c,2024,ICML
Graph Distillation with Eigenbasis Matching,"Yang Liu, Deyu Bo, Chuan Shi",N/A (摘要需访问详情页),https://raw.githubusercontent.com/mlresearch/v235/main/assets/liu24d/liu24d.pdf,https://proceedings.mlr.press/v235/liu24d.html,liu24d,2024,ICML
Adaptive Text Watermark for Large Language Models,"Yepeng Liu, Yuheng Bu",N/A (摘要需访问详情页),https://raw.githubusercontent.com/mlresearch/v235/main/assets/liu24e/liu24e.pdf,https://proceedings.mlr.press/v235/liu24e.html,liu24e,2024,ICML
Enhancing Adversarial Robustness in SNNs with Sparse Gradients,"Yujia Liu, Tong Bu, Jianhao Ding, Zecheng Hao, Tiejun Huang, Zhaofei Yu",N/A (摘要需访问详情页),https://raw.githubusercontent.com/mlresearch/v235/main/assets/liu24f/liu24f.pdf,https://proceedings.mlr.press/v235/liu24f.html,liu24f,2024,ICML
ReLU Network with Width $d+\mathcalO(1)$ Can Achieve Optimal Approximation Rate,"Chenghao Liu, Minghua Chen",N/A (摘要需访问详情页),https://raw.githubusercontent.com/mlresearch/v235/main/assets/liu24g/liu24g.pdf,https://proceedings.mlr.press/v235/liu24g.html,liu24g,2024,ICML
Graph Adversarial Diffusion Convolution,"Songtao Liu, Jinghui Chen, Tianfan Fu, Lu Lin, Marinka Zitnik, Dinghao Wu",N/A (摘要需访问详情页),https://raw.githubusercontent.com/mlresearch/v235/main/assets/liu24h/liu24h.pdf,https://proceedings.mlr.press/v235/liu24h.html,liu24h,2024,ICML
Decentralized Convex Finite-Sum Optimization with Better Dependence on Condition Numbers,"Yuxing Liu, Lesi Chen, Luo Luo",N/A (摘要需访问详情页),https://raw.githubusercontent.com/mlresearch/v235/main/assets/liu24i/liu24i.pdf,https://proceedings.mlr.press/v235/liu24i.html,liu24i,2024,ICML
Zeroth-Order Methods for Constrained Nonconvex Nonsmooth Stochastic Optimization,"Zhuanghua Liu, Cheng Chen, Luo Luo, Bryan Kian Hsiang Low",N/A (摘要需访问详情页),https://raw.githubusercontent.com/mlresearch/v235/main/assets/liu24j/liu24j.pdf,https://proceedings.mlr.press/v235/liu24j.html,liu24j,2024,ICML
Unifying Image Processing as Visual Prompting Question Answering,"Yihao Liu, Xiangyu Chen, Xianzheng Ma, Xintao Wang, Jiantao Zhou, Yu Qiao, Chao Dong",N/A (摘要需访问详情页),https://raw.githubusercontent.com/mlresearch/v235/main/assets/liu24k/liu24k.pdf,https://proceedings.mlr.press/v235/liu24k.html,liu24k,2024,ICML
ESNet: Evolution and Succession Network for High-Resolution Salient Object Detection,"Hongyu Liu, Runmin Cong, Hua Li, Qianqian Xu, Qingming Huang, Wei Zhang",N/A (摘要需访问详情页),https://raw.githubusercontent.com/mlresearch/v235/main/assets/liu24l/liu24l.pdf,https://proceedings.mlr.press/v235/liu24l.html,liu24l,2024,ICML
The Pitfalls and Promise of Conformal Inference Under Adversarial Attacks,"Ziquan Liu, Yufei Cui, Yan Yan, Yi Xu, Xiangyang Ji, Xue Liu, Antoni B. Chan",N/A (摘要需访问详情页),https://raw.githubusercontent.com/mlresearch/v235/main/assets/liu24m/liu24m.pdf,https://proceedings.mlr.press/v235/liu24m.html,liu24m,2024,ICML
Preference Optimization for Molecule Synthesis with Conditional Residual Energy-based Models,"Songtao Liu, Hanjun Dai, Yue Zhao, Peng Liu",N/A (摘要需访问详情页),https://raw.githubusercontent.com/mlresearch/v235/main/assets/liu24n/liu24n.pdf,https://proceedings.mlr.press/v235/liu24n.html,liu24n,2024,ICML
PEARL: Zero-shot Cross-task Preference Alignment and Robust Reward Learning for Robotic Manipulation,"Runze Liu, Yali Du, Fengshuo Bai, Jiafei Lyu, Xiu Li",N/A (摘要需访问详情页),https://raw.githubusercontent.com/mlresearch/v235/main/assets/liu24o/liu24o.pdf,https://proceedings.mlr.press/v235/liu24o.html,liu24o,2024,ICML
Harnessing the Power of Neural Operators with Automatically Encoded Conservation Laws,"Ning Liu, Yiming Fan, Xianyi Zeng, Milan Klöwer, Lu Zhang, Yue Yu",N/A (摘要需访问详情页),https://raw.githubusercontent.com/mlresearch/v235/main/assets/liu24p/liu24p.pdf,https://proceedings.mlr.press/v235/liu24p.html,liu24p,2024,ICML
Mitigating Privacy Risk in Membership Inference by Convex-Concave Loss,"Zhenlong Liu, Lei Feng, Huiping Zhuang, Xiaofeng Cao, Hongxin Wei",N/A (摘要需访问详情页),https://raw.githubusercontent.com/mlresearch/v235/main/assets/liu24q/liu24q.pdf,https://proceedings.mlr.press/v235/liu24q.html,liu24q,2024,ICML
Decoding-time Realignment of Language Models,"Tianlin Liu, Shangmin Guo, Leonardo Bianco, Daniele Calandriello, Quentin Berthet, Felipe Llinares-López, Jessica Hoffmann, Lucas Dixon, Michal Valko, Mathieu Blondel",N/A (摘要需访问详情页),https://raw.githubusercontent.com/mlresearch/v235/main/assets/liu24r/liu24r.pdf,https://proceedings.mlr.press/v235/liu24r.html,liu24r,2024,ICML
DIDI: Diffusion-Guided Diversity for Offline Behavioral Generation,"Jinxin Liu, Xinghong Guo, Zifeng Zhuang, Donglin Wang",N/A (摘要需访问详情页),https://raw.githubusercontent.com/mlresearch/v235/main/assets/liu24s/liu24s.pdf,https://proceedings.mlr.press/v235/liu24s.html,liu24s,2024,ICML
Bidirectional Reciprocative Information Communication for Few-Shot Semantic Segmentation,"Yuanwei Liu, Junwei Han, Xiwen Yao, Salman Khan, Hisham Cholakkal, Rao Muhammad Anwer, Nian Liu, Fahad Shahbaz Khan",N/A (摘要需访问详情页),https://raw.githubusercontent.com/mlresearch/v235/main/assets/liu24t/liu24t.pdf,https://proceedings.mlr.press/v235/liu24t.html,liu24t,2024,ICML
Unlock the Cognitive Generalization of Deep Reinforcement Learning via Granular Ball Representation,"Jiashun Liu, Jianye Hao, Yi Ma, Shuyin Xia",N/A (摘要需访问详情页),https://raw.githubusercontent.com/mlresearch/v235/main/assets/liu24u/liu24u.pdf,https://proceedings.mlr.press/v235/liu24u.html,liu24u,2024,ICML
PAPM: A Physics-aware Proxy Model for Process Systems,"Pengwei Liu, Zhongkai Hao, Xingyu Ren, Hangjie Yuan, Jiayang Ren, Dong Ni",N/A (摘要需访问详情页),https://raw.githubusercontent.com/mlresearch/v235/main/assets/liu24v/liu24v.pdf,https://proceedings.mlr.press/v235/liu24v.html,liu24v,2024,ICML
ELTA: An Enhancer against Long-Tail for Aesthetics-oriented Models,"Limin Liu, Shuai He, Anlong Ming, Rui Xie, Huadong Ma",N/A (摘要需访问详情页),https://raw.githubusercontent.com/mlresearch/v235/main/assets/liu24w/liu24w.pdf,https://proceedings.mlr.press/v235/liu24w.html,liu24w,2024,ICML
On the Feasibility of Single-Pass Full-Capacity Learning in Linear Threshold Neurons with Binary Input Vectors,"Ruipeng Liu, Borui He, Naveed Tahir, Garrett Ethan Katz",N/A (摘要需访问详情页),https://raw.githubusercontent.com/mlresearch/v235/main/assets/liu24x/liu24x.pdf,https://proceedings.mlr.press/v235/liu24x.html,liu24x,2024,ICML
Online Speculative Decoding,"Xiaoxuan Liu, Lanxiang Hu, Peter Bailis, Alvin Cheung, Zhijie Deng, Ion Stoica, Hao Zhang",N/A (摘要需访问详情页),https://raw.githubusercontent.com/mlresearch/v235/main/assets/liu24y/liu24y.pdf,https://proceedings.mlr.press/v235/liu24y.html,liu24y,2024,ICML
Tuning-free Estimation and Inference of Cumulative Distribution Function under Local Differential Privacy,"Yi Liu, Qirui Hu, Linglong Kong",N/A (摘要需访问详情页),https://raw.githubusercontent.com/mlresearch/v235/main/assets/liu24z/liu24z.pdf,https://proceedings.mlr.press/v235/liu24z.html,liu24z,2024,ICML
Referee Can Play: An Alternative Approach to Conditional Generation via Model Inversion,"Xuantong Liu, Tianyang Hu, Wenjia Wang, Kenji Kawaguchi, Yuan Yao",N/A (摘要需访问详情页),https://raw.githubusercontent.com/mlresearch/v235/main/assets/liu24aa/liu24aa.pdf,https://proceedings.mlr.press/v235/liu24aa.html,liu24aa,2024,ICML
"Reason for Future, Act for Now: A Principled Architecture for Autonomous LLM Agents","Zhihan Liu, Hao Hu, Shenao Zhang, Hongyi Guo, Shuqi Ke, Boyi Liu, Zhaoran Wang",N/A (摘要需访问详情页),https://raw.githubusercontent.com/mlresearch/v235/main/assets/liu24ab/liu24ab.pdf,https://proceedings.mlr.press/v235/liu24ab.html,liu24ab,2024,ICML
Weakly-Supervised Residual Evidential Learning for Multi-Instance Uncertainty Estimation,"Pei Liu, Luping Ji",N/A (摘要需访问详情页),https://raw.githubusercontent.com/mlresearch/v235/main/assets/liu24ac/liu24ac.pdf,https://proceedings.mlr.press/v235/liu24ac.html,liu24ac,2024,ICML
StyDeSty: Min-Max Stylization and Destylization for Single Domain Generalization,"Songhua Liu, Xin Jin, Xingyi Yang, Jingwen Ye, Xinchao Wang",N/A (摘要需访问详情页),https://raw.githubusercontent.com/mlresearch/v235/main/assets/liu24ad/liu24ad.pdf,https://proceedings.mlr.press/v235/liu24ad.html,liu24ad,2024,ICML
Time-Series Forecasting for Out-of-Distribution Generalization Using Invariant Learning,"Haoxin Liu, Harshavardhan Kamarthi, Lingkai Kong, Zhiyuan Zhao, Chao Zhang, B. Aditya Prakash",N/A (摘要需访问详情页),https://raw.githubusercontent.com/mlresearch/v235/main/assets/liu24ae/liu24ae.pdf,https://proceedings.mlr.press/v235/liu24ae.html,liu24ae,2024,ICML
Stereo Risk: A Continuous Modeling Approach to Stereo Matching,"Ce Liu, Suryansh Kumar, Shuhang Gu, Radu Timofte, Yao Yao, Luc Van Gool",N/A (摘要需访问详情页),https://raw.githubusercontent.com/mlresearch/v235/main/assets/liu24af/liu24af.pdf,https://proceedings.mlr.press/v235/liu24af.html,liu24af,2024,ICML
Multi-Source Conformal Inference Under Distribution Shift,"Yi Liu, Alexander Levis, Sharon-Lise Normand, Larry Han",N/A (摘要需访问详情页),https://raw.githubusercontent.com/mlresearch/v235/main/assets/liu24ag/liu24ag.pdf,https://proceedings.mlr.press/v235/liu24ag.html,liu24ag,2024,ICML
From Generalization Analysis to Optimization Designs for State Space Models,"Fusheng Liu, Qianxiao Li",N/A (摘要需访问详情页),https://raw.githubusercontent.com/mlresearch/v235/main/assets/liu24ah/liu24ah.pdf,https://proceedings.mlr.press/v235/liu24ah.html,liu24ah,2024,ICML
Adaptive Advantage-Guided Policy Regularization for Offline Reinforcement Learning,"Tenglong Liu, Yang Li, Yixing Lan, Hao Gao, Wei Pan, Xin Xu",N/A (摘要需访问详情页),https://raw.githubusercontent.com/mlresearch/v235/main/assets/liu24ai/liu24ai.pdf,https://proceedings.mlr.press/v235/liu24ai.html,liu24ai,2024,ICML
Two-timescale Derivative Free Optimization for Performative Prediction with Markovian Data,"Haitong Liu, Qiang Li, Hoi To Wai",N/A (摘要需访问详情页),https://raw.githubusercontent.com/mlresearch/v235/main/assets/liu24aj/liu24aj.pdf,https://proceedings.mlr.press/v235/liu24aj.html,liu24aj,2024,ICML
Short-Long Convolutions Help Hardware-Efficient Linear Attention to Focus on Long Sequences,"Zicheng Liu, Siyuan Li, Li Wang, Zedong Wang, Yunfan Liu, Stan Z. Li",N/A (摘要需访问详情页),https://raw.githubusercontent.com/mlresearch/v235/main/assets/liu24ak/liu24ak.pdf,https://proceedings.mlr.press/v235/liu24ak.html,liu24ak,2024,ICML
Differentiable Combinatorial Scheduling at Scale,"Mingju Liu, Yingjie Li, Jiaqi Yin, Zhiru Zhang, Cunxi Yu",N/A (摘要需访问详情页),https://raw.githubusercontent.com/mlresearch/v235/main/assets/liu24al/liu24al.pdf,https://proceedings.mlr.press/v235/liu24al.html,liu24al,2024,ICML
Characterizing ResNet’s Universal Approximation Capability,"Chenghao Liu, Enming Liang, Minghua Chen",N/A (摘要需访问详情页),https://raw.githubusercontent.com/mlresearch/v235/main/assets/liu24am/liu24am.pdf,https://proceedings.mlr.press/v235/liu24am.html,liu24am,2024,ICML
Convergence of Online Learning Algorithm for a Mixture of Multiple Linear Regressions,"Yujing Liu, Zhixin Liu, Lei Guo",N/A (摘要需访问详情页),https://raw.githubusercontent.com/mlresearch/v235/main/assets/liu24an/liu24an.pdf,https://proceedings.mlr.press/v235/liu24an.html,liu24an,2024,ICML
Energy-Guided Diffusion Sampling for Offline-to-Online Reinforcement Learning,"Xu-Hui Liu, Tian-Shuo Liu, Shengyi Jiang, Ruifeng Chen, Zhilong Zhang, Xinwei Chen, Yang Yu",N/A (摘要需访问详情页),https://raw.githubusercontent.com/mlresearch/v235/main/assets/liu24ao/liu24ao.pdf,https://proceedings.mlr.press/v235/liu24ao.html,liu24ao,2024,ICML
Moreau Envelope for Nonconvex Bi-Level Optimization: A Single-Loop and Hessian-Free Solution Strategy,"Risheng Liu, Zhu Liu, Wei Yao, Shangzhi Zeng, Jin Zhang",N/A (摘要需访问详情页),https://raw.githubusercontent.com/mlresearch/v235/main/assets/liu24ap/liu24ap.pdf,https://proceedings.mlr.press/v235/liu24ap.html,liu24ap,2024,ICML
Position: Foundation Agents as the Paradigm Shift for Decision Making,"Xiaoqian Liu, Xingzhou Lou, Jianbin Jiao, Junge Zhang",N/A (摘要需访问详情页),https://raw.githubusercontent.com/mlresearch/v235/main/assets/liu24aq/liu24aq.pdf,https://proceedings.mlr.press/v235/liu24aq.html,liu24aq,2024,ICML
Learning with Partial-Label and Unlabeled Data: A Uniform Treatment for Supervision Redundancy and Insufficiency,"Yangfan Liu, Jiaqi Lv, Xin Geng, Ning Xu",N/A (摘要需访问详情页),https://raw.githubusercontent.com/mlresearch/v235/main/assets/liu24ar/liu24ar.pdf,https://proceedings.mlr.press/v235/liu24ar.html,liu24ar,2024,ICML
Revisiting Context Aggregation for Image Matting,"Qinglin Liu, Xiaoqian Lv, Quanling Meng, Zonglin Li, Xiangyuan Lan, Shuo Yang, Shengping Zhang, Liqiang Nie",N/A (摘要需访问详情页),https://raw.githubusercontent.com/mlresearch/v235/main/assets/liu24as/liu24as.pdf,https://proceedings.mlr.press/v235/liu24as.html,liu24as,2024,ICML
Amortized Equation Discovery in Hybrid Dynamical Systems,"Yongtuo Liu, Sara Magliacane, Miltiadis Kofinas, Stratis Gavves",N/A (摘要需访问详情页),https://raw.githubusercontent.com/mlresearch/v235/main/assets/liu24at/liu24at.pdf,https://proceedings.mlr.press/v235/liu24at.html,liu24at,2024,ICML
KnowFormer: Revisiting Transformers for Knowledge Graph Reasoning,"Junnan Liu, Qianren Mao, Weifeng Jiang, Jianxin Li",N/A (摘要需访问详情页),https://raw.githubusercontent.com/mlresearch/v235/main/assets/liu24au/liu24au.pdf,https://proceedings.mlr.press/v235/liu24au.html,liu24au,2024,ICML
Floating Anchor Diffusion Model for Multi-motif Scaffolding,"Ke Liu, Weian Mao, Shuaike Shen, Xiaoran Jiao, Zheng Sun, Hao Chen, Chunhua Shen",N/A (摘要需访问详情页),https://raw.githubusercontent.com/mlresearch/v235/main/assets/liu24av/liu24av.pdf,https://proceedings.mlr.press/v235/liu24av.html,liu24av,2024,ICML
Deep Functional Factor Models: Forecasting High-Dimensional Functional Time Series via Bayesian Nonparametric Factorization,"Yirui Liu, Xinghao Qiao, Yulong Pei, Liying Wang",N/A (摘要需访问详情页),https://raw.githubusercontent.com/mlresearch/v235/main/assets/liu24aw/liu24aw.pdf,https://proceedings.mlr.press/v235/liu24aw.html,liu24aw,2024,ICML
Fast Decision Boundary based Out-of-Distribution Detector,"Litian Liu, Yao Qin",N/A (摘要需访问详情页),https://raw.githubusercontent.com/mlresearch/v235/main/assets/liu24ax/liu24ax.pdf,https://proceedings.mlr.press/v235/liu24ax.html,liu24ax,2024,ICML
Class-Imbalanced Graph Learning without Class Rebalancing,"Zhining Liu, Ruizhong Qiu, Zhichen Zeng, Hyunsik Yoo, David Zhou, Zhe Xu, Yada Zhu, Kommy Weldemariam, Jingrui He, Hanghang Tong",N/A (摘要需访问详情页),https://raw.githubusercontent.com/mlresearch/v235/main/assets/liu24ay/liu24ay.pdf,https://proceedings.mlr.press/v235/liu24ay.html,liu24ay,2024,ICML
Generative Marginalization Models,"Sulin Liu, Peter Ramadge, Ryan P Adams",N/A (摘要需访问详情页),https://raw.githubusercontent.com/mlresearch/v235/main/assets/liu24az/liu24az.pdf,https://proceedings.mlr.press/v235/liu24az.html,liu24az,2024,ICML
Federated Representation Learning in the Under-Parameterized Regime,"Renpu Liu, Cong Shen, Jing Yang",N/A (摘要需访问详情页),https://raw.githubusercontent.com/mlresearch/v235/main/assets/liu24ba/liu24ba.pdf,https://proceedings.mlr.press/v235/liu24ba.html,liu24ba,2024,ICML
How do Large Language Models Navigate Conflicts between Honesty and Helpfulness?,"Ryan Liu, Theodore Sumers, Ishita Dasgupta, Thomas L. Griffiths",N/A (摘要需访问详情页),https://raw.githubusercontent.com/mlresearch/v235/main/assets/liu24bb/liu24bb.pdf,https://proceedings.mlr.press/v235/liu24bb.html,liu24bb,2024,ICML
Causal Discovery via Conditional Independence Testing with Proxy Variables,"Mingzhou Liu, Xinwei Sun, Yu Qiao, Yizhou Wang",N/A (摘要需访问详情页),https://raw.githubusercontent.com/mlresearch/v235/main/assets/liu24bc/liu24bc.pdf,https://proceedings.mlr.press/v235/liu24bc.html,liu24bc,2024,ICML
Perfect Alignment May be Poisonous to Graph Contrastive Learning,"Jingyu Liu, Huayi Tang, Yong Liu",N/A (摘要需访问详情页),https://raw.githubusercontent.com/mlresearch/v235/main/assets/liu24bd/liu24bd.pdf,https://proceedings.mlr.press/v235/liu24bd.html,liu24bd,2024,ICML
Entropy-Reinforced Planning with Large Language Models for Drug Discovery,"Xuefeng Liu, Chih-Chan Tien, Peng Ding, Songhao Jiang, Rick L. Stevens",N/A (摘要需访问详情页),https://raw.githubusercontent.com/mlresearch/v235/main/assets/liu24be/liu24be.pdf,https://proceedings.mlr.press/v235/liu24be.html,liu24be,2024,ICML
New Sample Complexity Bounds for Sample Average Approximation in Heavy-Tailed Stochastic Programming,"Hongcheng Liu, Jindong Tong",N/A (摘要需访问详情页),https://raw.githubusercontent.com/mlresearch/v235/main/assets/liu24bf/liu24bf.pdf,https://proceedings.mlr.press/v235/liu24bf.html,liu24bf,2024,ICML
Zero-Shot ECG Classification with Multimodal Learning and Test-time Clinical Knowledge Enhancement,"Che Liu, Zhongwei Wan, Cheng Ouyang, Anand Shah, Wenjia Bai, Rossella Arcucci",N/A (摘要需访问详情页),https://raw.githubusercontent.com/mlresearch/v235/main/assets/liu24bg/liu24bg.pdf,https://proceedings.mlr.press/v235/liu24bg.html,liu24bg,2024,ICML
"Unified Generation, Reconstruction, and Representation: Generalized Diffusion with Adaptive Latent Encoding-Decoding","Guangyi Liu, Yu Wang, Zeyu Feng, Qiyu Wu, Liping Tang, Yuan Gao, Zhen Li, Shuguang Cui, Julian Mcauley, Zichao Yang, Eric P. Xing, Zhiting Hu",N/A (摘要需访问详情页),https://raw.githubusercontent.com/mlresearch/v235/main/assets/liu24bh/liu24bh.pdf,https://proceedings.mlr.press/v235/liu24bh.html,liu24bh,2024,ICML
Differentiable Model Scaling using Differentiable Topk,"Kai Liu, Ruohui Wang, Jianfei Gao, Kai Chen",N/A (摘要需访问详情页),https://raw.githubusercontent.com/mlresearch/v235/main/assets/liu24bi/liu24bi.pdf,https://proceedings.mlr.press/v235/liu24bi.html,liu24bi,2024,ICML
Symmetric Matrix Completion with ReLU Sampling,"Huikang Liu, Peng Wang, Longxiu Huang, Qing Qu, Laura Balzano",N/A (摘要需访问详情页),https://raw.githubusercontent.com/mlresearch/v235/main/assets/liu24bj/liu24bj.pdf,https://proceedings.mlr.press/v235/liu24bj.html,liu24bj,2024,ICML
DNA-SE: Towards Deep Neural-Nets Assisted Semiparametric Estimation,"Qinshuo Liu, Zixin Wang, Xi’An Li, Xinyao Ji, Lei Zhang, Lin Liu, Zhonghua Liu",N/A (摘要需访问详情页),https://raw.githubusercontent.com/mlresearch/v235/main/assets/liu24bk/liu24bk.pdf,https://proceedings.mlr.press/v235/liu24bk.html,liu24bk,2024,ICML
TimeX++: Learning Time-Series Explanations with Information Bottleneck,"Zichuan Liu, Tianchun Wang, Jimeng Shi, Xu Zheng, Zhuomin Chen, Lei Song, Wenqian Dong, Jayantha Obeysekera, Farhad Shirani, Dongsheng Luo",N/A (摘要需访问详情页),https://raw.githubusercontent.com/mlresearch/v235/main/assets/liu24bl/liu24bl.pdf,https://proceedings.mlr.press/v235/liu24bl.html,liu24bl,2024,ICML
LIDAO: Towards Limited Interventions for Debiasing (Large) Language Models,"Tianci Liu, Haoyu Wang, Shiyang Wang, Yu Cheng, Jing Gao",N/A (摘要需访问详情页),https://raw.githubusercontent.com/mlresearch/v235/main/assets/liu24bm/liu24bm.pdf,https://proceedings.mlr.press/v235/liu24bm.html,liu24bm,2024,ICML
DoRA: Weight-Decomposed Low-Rank Adaptation,"Shih-Yang Liu, Chien-Yi Wang, Hongxu Yin, Pavlo Molchanov, Yu-Chiang Frank Wang, Kwang-Ting Cheng, Min-Hung Chen",N/A (摘要需访问详情页),https://raw.githubusercontent.com/mlresearch/v235/main/assets/liu24bn/liu24bn.pdf,https://proceedings.mlr.press/v235/liu24bn.html,liu24bn,2024,ICML
High-Probability Bound for Non-Smooth Non-Convex Stochastic Optimization with Heavy Tails,"Langqi Liu, Yibo Wang, Lijun Zhang",N/A (摘要需访问详情页),https://raw.githubusercontent.com/mlresearch/v235/main/assets/liu24bo/liu24bo.pdf,https://proceedings.mlr.press/v235/liu24bo.html,liu24bo,2024,ICML
Combinatorial Multivariant Multi-Armed Bandits with Applications to Episodic Reinforcement Learning and Beyond,"Xutong Liu, Siwei Wang, Jinhang Zuo, Han Zhong, Xuchuang Wang, Zhiyong Wang, Shuai Li, Mohammad Hajiesmaili, John C.S. Lui, Wei Chen",N/A (摘要需访问详情页),https://raw.githubusercontent.com/mlresearch/v235/main/assets/liu24bp/liu24bp.pdf,https://proceedings.mlr.press/v235/liu24bp.html,liu24bp,2024,ICML
Language-Driven Cross-Modal Classifier for Zero-Shot Multi-Label Image Recognition,"Yicheng Liu, Jie Wen, Chengliang Liu, Xiaozhao Fang, Zuoyong Li, Yong Xu, Zheng Zhang",N/A (摘要需访问详情页),https://raw.githubusercontent.com/mlresearch/v235/main/assets/liu24bq/liu24bq.pdf,https://proceedings.mlr.press/v235/liu24bq.html,liu24bq,2024,ICML
Geometry-Calibrated DRO: Combating Over-Pessimism with Free Energy Implications,"Jiashuo Liu, Jiayun Wu, Tianyu Wang, Hao Zou, Bo Li, Peng Cui",N/A (摘要需访问详情页),https://raw.githubusercontent.com/mlresearch/v235/main/assets/liu24br/liu24br.pdf,https://proceedings.mlr.press/v235/liu24br.html,liu24br,2024,ICML
Evolution of Heuristics: Towards Efficient Automatic Algorithm Design Using Large Language Model,"Fei Liu, Tong Xialiang, Mingxuan Yuan, Xi Lin, Fu Luo, Zhenkun Wang, Zhichao Lu, Qingfu Zhang",N/A (摘要需访问详情页),https://raw.githubusercontent.com/mlresearch/v235/main/assets/liu24bs/liu24bs.pdf,https://proceedings.mlr.press/v235/liu24bs.html,liu24bs,2024,ICML
Correlation-Induced Label Prior for Semi-Supervised Multi-Label Learning,"Biao Liu, Ning Xu, Xiangyu Fang, Xin Geng",N/A (摘要需访问详情页),https://raw.githubusercontent.com/mlresearch/v235/main/assets/liu24bt/liu24bt.pdf,https://proceedings.mlr.press/v235/liu24bt.html,liu24bt,2024,ICML
Causality Based Front-door Defense Against Backdoor Attack on Language Models,"Yiran Liu, Xiaoang Xu, Zhiyi Hou, Yang Yu",N/A (摘要需访问详情页),https://raw.githubusercontent.com/mlresearch/v235/main/assets/liu24bu/liu24bu.pdf,https://proceedings.mlr.press/v235/liu24bu.html,liu24bu,2024,ICML
