title,authors,abstract,pdf_url,source_url,id,year,conference
No Double Descent in Principal Component Regression: A High-Dimensional Analysis,"Daniel Gedon, Antonio H. Ribeiro, Thomas B. Schön",N/A (摘要需访问详情页),https://raw.githubusercontent.com/mlresearch/v235/main/assets/gedon24a/gedon24a.pdf,https://proceedings.mlr.press/v235/gedon24a.html,gedon24a,2024,ICML
Don’t trust your eyes: on the (un)reliability of feature visualizations,"Robert Geirhos, Roland S. Zimmermann, Blair Bilodeau, Wieland Brendel, Been Kim",N/A (摘要需访问详情页),https://raw.githubusercontent.com/mlresearch/v235/main/assets/geirhos24a/geirhos24a.pdf,https://proceedings.mlr.press/v235/geirhos24a.html,geirhos24a,2024,ICML
"Learning with 3D rotations, a hitchhiker’s guide to SO(3)","Andreas René Geist, Jonas Frey, Mikel Zhobro, Anna Levina, Georg Martius",N/A (摘要需访问详情页),https://raw.githubusercontent.com/mlresearch/v235/main/assets/geist24a/geist24a.pdf,https://proceedings.mlr.press/v235/geist24a.html,geist24a,2024,ICML
Graph-Triggered Rising Bandits,"Gianmarco Genalti, Marco Mussi, Nicola Gatti, Marcello Restelli, Matteo Castiglioni, Alberto Maria Metelli",N/A (摘要需访问详情页),https://raw.githubusercontent.com/mlresearch/v235/main/assets/genalti24a/genalti24a.pdf,https://proceedings.mlr.press/v235/genalti24a.html,genalti24a,2024,ICML
Improving Adversarial Energy-Based Model via Diffusion Process,"Cong Geng, Tian Han, Peng-Tao Jiang, Hao Zhang, Jinwei Chen, Søren Hauberg, Bo Li",N/A (摘要需访问详情页),https://raw.githubusercontent.com/mlresearch/v235/main/assets/geng24a/geng24a.pdf,https://proceedings.mlr.press/v235/geng24a.html,geng24a,2024,ICML
Reinforcement Learning within Tree Search for Fast Macro Placement,"Zijie Geng, Jie Wang, Ziyan Liu, Siyuan Xu, Zhentao Tang, Mingxuan Yuan, Jianye Hao, Yongdong Zhang, Feng Wu",N/A (摘要需访问详情页),https://raw.githubusercontent.com/mlresearch/v235/main/assets/geng24b/geng24b.pdf,https://proceedings.mlr.press/v235/geng24b.html,geng24b,2024,ICML
Adaptive Horizon Actor-Critic for Policy Learning in Contact-Rich Differentiable Simulation,"Ignat Georgiev, Krishnan Srinivasan, Jie Xu, Eric Heiden, Animesh Garg",N/A (摘要需访问详情页),https://raw.githubusercontent.com/mlresearch/v235/main/assets/georgiev24a/georgiev24a.pdf,https://proceedings.mlr.press/v235/georgiev24a.html,georgiev24a,2024,ICML
Emergent Equivariance in Deep Ensembles,"Jan E Gerken, Pan Kessel",N/A (摘要需访问详情页),https://raw.githubusercontent.com/mlresearch/v235/main/assets/gerken24a/gerken24a.pdf,https://proceedings.mlr.press/v235/gerken24a.html,gerken24a,2024,ICML
Patchscopes: A Unifying Framework for Inspecting Hidden Representations of Language Models,"Asma Ghandeharioun, Avi Caciularu, Adam Pearce, Lucas Dixon, Mor Geva",N/A (摘要需访问详情页),https://raw.githubusercontent.com/mlresearch/v235/main/assets/ghandeharioun24a/ghandeharioun24a.pdf,https://proceedings.mlr.press/v235/ghandeharioun24a.html,ghandeharioun24a,2024,ICML
Individualized Privacy Accounting via Subsampling with Applications in Combinatorial Optimization,"Badih Ghazi, Pritish Kamath, Ravi Kumar, Pasin Manurangsi, Adam Sealfon",N/A (摘要需访问详情页),https://raw.githubusercontent.com/mlresearch/v235/main/assets/ghazi24a/ghazi24a.pdf,https://proceedings.mlr.press/v235/ghazi24a.html,ghazi24a,2024,ICML
State-Constrained Zero-Sum Differential Games with One-Sided Information,"Mukesh Ghimire, Lei Zhang, Zhe Xu, Yi Ren",N/A (摘要需访问详情页),https://raw.githubusercontent.com/mlresearch/v235/main/assets/ghimire24a/ghimire24a.pdf,https://proceedings.mlr.press/v235/ghimire24a.html,ghimire24a,2024,ICML
Understanding Finetuning for Factual Knowledge Extraction,"Gaurav Rohit Ghosal, Tatsunori Hashimoto, Aditi Raghunathan",N/A (摘要需访问详情页),https://raw.githubusercontent.com/mlresearch/v235/main/assets/ghosal24a/ghosal24a.pdf,https://proceedings.mlr.press/v235/ghosal24a.html,ghosal24a,2024,ICML
A Closer Look at the Limitations of Instruction Tuning,"Sreyan Ghosh, Chandra Kiran Reddy Evuru, Sonal Kumar, Ramaneswaran S, Deepali Aneja, Zeyu Jin, Ramani Duraiswami, Dinesh Manocha",N/A (摘要需访问详情页),https://raw.githubusercontent.com/mlresearch/v235/main/assets/ghosh24a/ghosh24a.pdf,https://proceedings.mlr.press/v235/ghosh24a.html,ghosh24a,2024,ICML
Agnostic Learning of Mixed Linear Regressions with EM and AM Algorithms,"Avishek Ghosh, Arya Mazumdar",N/A (摘要需访问详情页),https://raw.githubusercontent.com/mlresearch/v235/main/assets/ghosh24b/ghosh24b.pdf,https://proceedings.mlr.press/v235/ghosh24b.html,ghosh24b,2024,ICML
Optimal Eye Surgeon: Finding image priors through sparse generators at initialization,"Avrajit Ghosh, Xitong Zhang, Kenneth K. Sun, Qing Qu, Saiprasad Ravishankar, Rongrong Wang",N/A (摘要需访问详情页),https://raw.githubusercontent.com/mlresearch/v235/main/assets/ghosh24c/ghosh24c.pdf,https://proceedings.mlr.press/v235/ghosh24c.html,ghosh24c,2024,ICML
Self-Correcting Self-Consuming Loops for Generative Model Training,"Nate Gillman, Michael Freeman, Daksh Aggarwal, Chia-Hong Hsu, Calvin Luo, Yonglong Tian, Chen Sun",N/A (摘要需访问详情页),https://raw.githubusercontent.com/mlresearch/v235/main/assets/gillman24a/gillman24a.pdf,https://proceedings.mlr.press/v235/gillman24a.html,gillman24a,2024,ICML
Kernel-Based Evaluation of Conditional Biological Sequence Models,"Pierre Glaser, Steffanie Paul, Alissa M Hummer, Charlotte Deane, Debora Susan Marks, Alan Nawzad Amin",N/A (摘要需访问详情页),https://raw.githubusercontent.com/mlresearch/v235/main/assets/glaser24a/glaser24a.pdf,https://proceedings.mlr.press/v235/glaser24a.html,glaser24a,2024,ICML
Better & Faster Large Language Models via Multi-token Prediction,"Fabian Gloeckle, Badr Youbi Idrissi, Baptiste Roziere, David Lopez-Paz, Gabriel Synnaeve",N/A (摘要需访问详情页),https://raw.githubusercontent.com/mlresearch/v235/main/assets/gloeckle24a/gloeckle24a.pdf,https://proceedings.mlr.press/v235/gloeckle24a.html,gloeckle24a,2024,ICML
All-in-one simulation-based inference,"Manuel Gloeckler, Michael Deistler, Christian Dietrich Weilbach, Frank Wood, Jakob H. Macke",N/A (摘要需访问详情页),https://raw.githubusercontent.com/mlresearch/v235/main/assets/gloeckler24a/gloeckler24a.pdf,https://proceedings.mlr.press/v235/gloeckler24a.html,gloeckler24a,2024,ICML
Position: Fundamental Limitations of LLM Censorship Necessitate New Approaches,"David Glukhov, Ilia Shumailov, Yarin Gal, Nicolas Papernot, Vardan Papyan",N/A (摘要需访问详情页),https://raw.githubusercontent.com/mlresearch/v235/main/assets/glukhov24a/glukhov24a.pdf,https://proceedings.mlr.press/v235/glukhov24a.html,glukhov24a,2024,ICML
"Position: The No Free Lunch Theorem, Kolmogorov Complexity, and the Role of Inductive Biases in Machine Learning","Micah Goldblum, Marc Anton Finzi, Keefer Rowan, Andrew Gordon Wilson",N/A (摘要需访问详情页),https://raw.githubusercontent.com/mlresearch/v235/main/assets/goldblum24a/goldblum24a.pdf,https://proceedings.mlr.press/v235/goldblum24a.html,goldblum24a,2024,ICML
CasCast: Skillful High-resolution Precipitation Nowcasting via Cascaded Modelling,"Junchao Gong, Lei Bai, Peng Ye, Wanghan Xu, Na Liu, Jianhua Dai, Xiaokang Yang, Wanli Ouyang",N/A (摘要需访问详情页),https://raw.githubusercontent.com/mlresearch/v235/main/assets/gong24a/gong24a.pdf,https://proceedings.mlr.press/v235/gong24a.html,gong24a,2024,ICML
Does Label Smoothing Help Deep Partial Label Learning?,"Xiuwen Gong, Nitin Bisht, Guandong Xu",N/A (摘要需访问详情页),https://raw.githubusercontent.com/mlresearch/v235/main/assets/gong24b/gong24b.pdf,https://proceedings.mlr.press/v235/gong24b.html,gong24b,2024,ICML
AST-T5: Structure-Aware Pretraining for Code Generation and Understanding,"Linyuan Gong, Mostafa Elhoushi, Alvin Cheung",N/A (摘要需访问详情页),https://raw.githubusercontent.com/mlresearch/v235/main/assets/gong24c/gong24c.pdf,https://proceedings.mlr.press/v235/gong24c.html,gong24c,2024,ICML
A Nearly Optimal Single Loop Algorithm for Stochastic Bilevel Optimization under Unbounded Smoothness,"Xiaochuan Gong, Jie Hao, Mingrui Liu",N/A (摘要需访问详情页),https://raw.githubusercontent.com/mlresearch/v235/main/assets/gong24d/gong24d.pdf,https://proceedings.mlr.press/v235/gong24d.html,gong24d,2024,ICML
Evolution-Inspired Loss Functions for Protein Representation Learning,"Chengyue Gong, Adam Klivans, James Madigan Loy, Tianlong Chen, Qiang Liu, Daniel Jesus Diaz",N/A (摘要需访问详情页),https://raw.githubusercontent.com/mlresearch/v235/main/assets/gong24e/gong24e.pdf,https://proceedings.mlr.press/v235/gong24e.html,gong24e,2024,ICML
Evaluation of LLMs on Syntax-Aware Code Fill-in-the-Middle Tasks,"Linyuan Gong, Sida Wang, Mostafa Elhoushi, Alvin Cheung",N/A (摘要需访问详情页),https://raw.githubusercontent.com/mlresearch/v235/main/assets/gong24f/gong24f.pdf,https://proceedings.mlr.press/v235/gong24f.html,gong24f,2024,ICML
E$^2$GAN: Efficient Training of Efficient GANs for Image-to-Image Translation,"Yifan Gong, Zheng Zhan, Qing Jin, Yanyu Li, Yerlan Idelbayev, Xian Liu, Andrey Zharkov, Kfir Aberman, Sergey Tulyakov, Yanzhi Wang, Jian Ren",N/A (摘要需访问详情页),https://raw.githubusercontent.com/mlresearch/v235/main/assets/gong24g/gong24g.pdf,https://proceedings.mlr.press/v235/gong24g.html,gong24g,2024,ICML
High-Probability Convergence for Composite and Distributed Stochastic Minimization and Variational Inequalities with Heavy-Tailed Noise,"Eduard Gorbunov, Abdurakhmon Sadiev, Marina Danilova, Samuel Horváth, Gauthier Gidel, Pavel Dvurechensky, Alexander Gasnikov, Peter Richtárik",N/A (摘要需访问详情页),https://raw.githubusercontent.com/mlresearch/v235/main/assets/gorbunov24a/gorbunov24a.pdf,https://proceedings.mlr.press/v235/gorbunov24a.html,gorbunov24a,2024,ICML
Out-of-Domain Generalization in Dynamical Systems Reconstruction,"Niclas Alexander Göring, Florian Hess, Manuel Brenner, Zahra Monfared, Daniel Durstewitz",N/A (摘要需访问详情页),https://raw.githubusercontent.com/mlresearch/v235/main/assets/goring24a/goring24a.pdf,https://proceedings.mlr.press/v235/goring24a.html,goring24a,2024,ICML
MOMENT: A Family of Open Time-series Foundation Models,"Mononito Goswami, Konrad Szafer, Arjun Choudhry, Yifu Cai, Shuo Li, Artur Dubrawski",N/A (摘要需访问详情页),https://raw.githubusercontent.com/mlresearch/v235/main/assets/goswami24a/goswami24a.pdf,https://proceedings.mlr.press/v235/goswami24a.html,goswami24a,2024,ICML
Weighted distance nearest neighbor condensing,"Lee-Ad Gottlieb, Timor Sharabi, Roi Weiss",N/A (摘要需访问详情页),https://raw.githubusercontent.com/mlresearch/v235/main/assets/gottlieb24a/gottlieb24a.pdf,https://proceedings.mlr.press/v235/gottlieb24a.html,gottlieb24a,2024,ICML
Test-Time Degradation Adaptation for Open-Set Image Restoration,"Yuanbiao Gou, Haiyu Zhao, Boyun Li, Xinyan Xiao, Xi Peng",N/A (摘要需访问详情页),https://raw.githubusercontent.com/mlresearch/v235/main/assets/gou24a/gou24a.pdf,https://proceedings.mlr.press/v235/gou24a.html,gou24a,2024,ICML
Learning Universal Predictors,"Jordi Grau-Moya, Tim Genewein, Marcus Hutter, Laurent Orseau, Gregoire Deletang, Elliot Catt, Anian Ruoss, Li Kevin Wenliang, Christopher Mattern, Matthew Aitchison, Joel Veness",N/A (摘要需访问详情页),https://raw.githubusercontent.com/mlresearch/v235/main/assets/grau-moya24a/grau-moya24a.pdf,https://proceedings.mlr.press/v235/grau-moya24a.html,grau-moya24a,2024,ICML
Long Range Propagation on Continuous-Time Dynamic Graphs,"Alessio Gravina, Giulio Lovisotto, Claudio Gallicchio, Davide Bacciu, Claas Grohnfeldt",N/A (摘要需访问详情页),https://raw.githubusercontent.com/mlresearch/v235/main/assets/gravina24a/gravina24a.pdf,https://proceedings.mlr.press/v235/gravina24a.html,gravina24a,2024,ICML
The Expressive Power of Path-Based Graph Neural Networks,"Caterina Graziani, Tamara Drucks, Fabian Jogl, Monica Bianchini, Franco Scarselli, Thomas Gärtner",N/A (摘要需访问详情页),https://raw.githubusercontent.com/mlresearch/v235/main/assets/graziani24a/graziani24a.pdf,https://proceedings.mlr.press/v235/graziani24a.html,graziani24a,2024,ICML
Nonsmooth Implicit Differentiation: Deterministic and Stochastic Convergence Rates,"Riccardo Grazzi, Massimiliano Pontil, Saverio Salzo",N/A (摘要需访问详情页),https://raw.githubusercontent.com/mlresearch/v235/main/assets/grazzi24a/grazzi24a.pdf,https://proceedings.mlr.press/v235/grazzi24a.html,grazzi24a,2024,ICML
Fine-grained Classes and How to Find Them,"Matej Grcic, Artyom Gadetsky, Maria Brbic",N/A (摘要需访问详情页),https://raw.githubusercontent.com/mlresearch/v235/main/assets/grcic24a/grcic24a.pdf,https://proceedings.mlr.press/v235/grcic24a.html,grcic24a,2024,ICML
AI Control: Improving Safety Despite Intentional Subversion,"Ryan Greenblatt, Buck Shlegeris, Kshitij Sachan, Fabien Roger",N/A (摘要需访问详情页),https://raw.githubusercontent.com/mlresearch/v235/main/assets/greenblatt24a/greenblatt24a.pdf,https://proceedings.mlr.press/v235/greenblatt24a.html,greenblatt24a,2024,ICML
Stochastic Localization via Iterative Posterior Sampling,"Louis Grenioux, Maxence Noble, Marylou Gabrié, Alain Oliviero Durmus",N/A (摘要需访问详情页),https://raw.githubusercontent.com/mlresearch/v235/main/assets/grenioux24a/grenioux24a.pdf,https://proceedings.mlr.press/v235/grenioux24a.html,grenioux24a,2024,ICML
A Bayesian Approach to Online Planning,"Nir Greshler, David Ben Eli, Carmel Rabinovitz, Gabi Guetta, Liran Gispan, Guy Zohar, Aviv Tamar",N/A (摘要需访问详情页),https://raw.githubusercontent.com/mlresearch/v235/main/assets/greshler24a/greshler24a.pdf,https://proceedings.mlr.press/v235/greshler24a.html,greshler24a,2024,ICML
Scaling Down Deep Learning with MNIST-1D,"Samuel James Greydanus, Dmitry Kobak",N/A (摘要需访问详情页),https://raw.githubusercontent.com/mlresearch/v235/main/assets/greydanus24a/greydanus24a.pdf,https://proceedings.mlr.press/v235/greydanus24a.html,greydanus24a,2024,ICML
Quality-Diversity Actor-Critic: Learning High-Performing and Diverse Behaviors via Value and Successor Features Critics,"Luca Grillotti, Maxence Faldor, Borja G. León, Antoine Cully",N/A (摘要需访问详情页),https://raw.githubusercontent.com/mlresearch/v235/main/assets/grillotti24a/grillotti24a.pdf,https://proceedings.mlr.press/v235/grillotti24a.html,grillotti24a,2024,ICML
A Bias-Variance-Covariance Decomposition of Kernel Scores for Generative Models,"Sebastian Gregor Gruber, Florian Buettner",N/A (摘要需访问详情页),https://raw.githubusercontent.com/mlresearch/v235/main/assets/gruber24a/gruber24a.pdf,https://proceedings.mlr.press/v235/gruber24a.html,gruber24a,2024,ICML
Overcoming Saturation in Density Ratio Estimation by Iterated Regularization,"Lukas Gruber, Markus Holzleitner, Johannes Lehner, Sepp Hochreiter, Werner Zellinger",N/A (摘要需访问详情页),https://raw.githubusercontent.com/mlresearch/v235/main/assets/gruber24b/gruber24b.pdf,https://proceedings.mlr.press/v235/gruber24b.html,gruber24b,2024,ICML
On the Calibration of Human Pose Estimation,"Kerui Gu, Rongyu Chen, Xuanlong Yu, Angela Yao",N/A (摘要需访问详情页),https://raw.githubusercontent.com/mlresearch/v235/main/assets/gu24a/gu24a.pdf,https://proceedings.mlr.press/v235/gu24a.html,gu24a,2024,ICML
EDISON: Enhanced Dictionary-Induced Tensorized Incomplete Multi-View Clustering with Gaussian Error Rank Minimization,"Zhibin Gu, Zhendong Li, Songhe Feng",N/A (摘要需访问详情页),https://raw.githubusercontent.com/mlresearch/v235/main/assets/gu24b/gu24b.pdf,https://proceedings.mlr.press/v235/gu24b.html,gu24b,2024,ICML
"CRUXEval: A Benchmark for Code Reasoning, Understanding and Execution","Alex Gu, Baptiste Roziere, Hugh James Leather, Armando Solar-Lezama, Gabriel Synnaeve, Sida Wang",N/A (摘要需访问详情页),https://raw.githubusercontent.com/mlresearch/v235/main/assets/gu24c/gu24c.pdf,https://proceedings.mlr.press/v235/gu24c.html,gu24c,2024,ICML
Data-free Distillation of Diffusion Models with Bootstrapping,"Jiatao Gu, Chen Wang, Shuangfei Zhai, Yizhe Zhang, Lingjie Liu, Joshua M. Susskind",N/A (摘要需访问详情页),https://raw.githubusercontent.com/mlresearch/v235/main/assets/gu24d/gu24d.pdf,https://proceedings.mlr.press/v235/gu24d.html,gu24d,2024,ICML
Agent Smith: A Single Image Can Jailbreak One Million Multimodal LLM Agents Exponentially Fast,"Xiangming Gu, Xiaosen Zheng, Tianyu Pang, Chao Du, Qian Liu, Ye Wang, Jing Jiang, Min Lin",N/A (摘要需访问详情页),https://raw.githubusercontent.com/mlresearch/v235/main/assets/gu24e/gu24e.pdf,https://proceedings.mlr.press/v235/gu24e.html,gu24e,2024,ICML
Predictive Performance Comparison of Decision Policies Under Confounding,"Luke Guerdan, Amanda Lee Coston, Ken Holstein, Steven Wu",N/A (摘要需访问详情页),https://raw.githubusercontent.com/mlresearch/v235/main/assets/guerdan24a/guerdan24a.pdf,https://proceedings.mlr.press/v235/guerdan24a.html,guerdan24a,2024,ICML
On the Diminishing Returns of Width for Continual Learning,"Etash Kumar Guha, Vihan Lakshman",N/A (摘要需访问详情页),https://raw.githubusercontent.com/mlresearch/v235/main/assets/guha24a/guha24a.pdf,https://proceedings.mlr.press/v235/guha24a.html,guha24a,2024,ICML
Vector Quantization Pretraining for EEG Time Series with Random Projection and Phase Alignment,"Haokun Gui, Xiucheng Li, Xinyang Chen",N/A (摘要需访问详情页),https://raw.githubusercontent.com/mlresearch/v235/main/assets/gui24a/gui24a.pdf,https://proceedings.mlr.press/v235/gui24a.html,gui24a,2024,ICML
No Wrong Turns: The Simple Geometry Of Neural Networks Optimization Paths,"Charles Guille-Escuret, Hiroki Naganuma, Kilian Fatras, Ioannis Mitliagkas",N/A (摘要需访问详情页),https://raw.githubusercontent.com/mlresearch/v235/main/assets/guille-escuret24a/guille-escuret24a.pdf,https://proceedings.mlr.press/v235/guille-escuret24a.html,guille-escuret24a,2024,ICML
Automated Evaluation of Retrieval-Augmented Language Models with Task-Specific Exam Generation,"Gauthier Guinet, Behrooz Omidvar-Tehrani, Anoop Deoras, Laurent Callot",N/A (摘要需访问详情页),https://raw.githubusercontent.com/mlresearch/v235/main/assets/guinet24a/guinet24a.pdf,https://proceedings.mlr.press/v235/guinet24a.html,guinet24a,2024,ICML
SLAB: Efficient Transformers with Simplified Linear Attention and Progressive Re-parameterized Batch Normalization,"Jialong Guo, Xinghao Chen, Yehui Tang, Yunhe Wang",N/A (摘要需访问详情页),https://raw.githubusercontent.com/mlresearch/v235/main/assets/guo24a/guo24a.pdf,https://proceedings.mlr.press/v235/guo24a.html,guo24a,2024,ICML
DS-Agent: Automated Data Science by Empowering Large Language Models with Case-Based Reasoning,"Siyuan Guo, Cheng Deng, Ying Wen, Hechang Chen, Yi Chang, Jun Wang",N/A (摘要需访问详情页),https://raw.githubusercontent.com/mlresearch/v235/main/assets/guo24b/guo24b.pdf,https://proceedings.mlr.press/v235/guo24b.html,guo24b,2024,ICML
Collaborative Heterogeneous Causal Inference Beyond Meta-analysis,"Tianyu Guo, Sai Praneeth Karimireddy, Michael Jordan",N/A (摘要需访问详情页),https://raw.githubusercontent.com/mlresearch/v235/main/assets/guo24c/guo24c.pdf,https://proceedings.mlr.press/v235/guo24c.html,guo24c,2024,ICML
ACM-MILP: Adaptive Constraint Modification via Grouping and Selection for Hardness-Preserving MILP Instance Generation,"Ziao Guo, Yang Li, Chang Liu, Wenli Ouyang, Junchi Yan",N/A (摘要需访问详情页),https://raw.githubusercontent.com/mlresearch/v235/main/assets/guo24d/guo24d.pdf,https://proceedings.mlr.press/v235/guo24d.html,guo24d,2024,ICML
On the Embedding Collapse when Scaling up Recommendation Models,"Xingzhuo Guo, Junwei Pan, Ximei Wang, Baixu Chen, Jie Jiang, Mingsheng Long",N/A (摘要需访问详情页),https://raw.githubusercontent.com/mlresearch/v235/main/assets/guo24e/guo24e.pdf,https://proceedings.mlr.press/v235/guo24e.html,guo24e,2024,ICML
FedRC: Tackling Diverse Distribution Shifts Challenge in Federated Learning by Robust Clustering,"Yongxin Guo, Xiaoying Tang, Tao Lin",N/A (摘要需访问详情页),https://raw.githubusercontent.com/mlresearch/v235/main/assets/guo24f/guo24f.pdf,https://proceedings.mlr.press/v235/guo24f.html,guo24f,2024,ICML
Compressing Large Language Models by Joint Sparsification and Quantization,"Jinyang Guo, Jianyu Wu, Zining Wang, Jiaheng Liu, Ge Yang, Yifu Ding, Ruihao Gong, Haotong Qin, Xianglong Liu",N/A (摘要需访问详情页),https://raw.githubusercontent.com/mlresearch/v235/main/assets/guo24g/guo24g.pdf,https://proceedings.mlr.press/v235/guo24g.html,guo24g,2024,ICML
Automated Loss function Search for Class-imbalanced Node Classification,"Xinyu Guo, Kai Wu, Xiaoyu Zhang, Jing Liu",N/A (摘要需访问详情页),https://raw.githubusercontent.com/mlresearch/v235/main/assets/guo24h/guo24h.pdf,https://proceedings.mlr.press/v235/guo24h.html,guo24h,2024,ICML
COLD-Attack: Jailbreaking LLMs with Stealthiness and Controllability,"Xingang Guo, Fangxu Yu, Huan Zhang, Lianhui Qin, Bin Hu",N/A (摘要需访问详情页),https://raw.githubusercontent.com/mlresearch/v235/main/assets/guo24i/guo24i.pdf,https://proceedings.mlr.press/v235/guo24i.html,guo24i,2024,ICML
Temporal Logic Specification-Conditioned Decision Transformer for Offline Safe Reinforcement Learning,"Zijian Guo, Weichao Zhou, Wenchao Li",N/A (摘要需访问详情页),https://raw.githubusercontent.com/mlresearch/v235/main/assets/guo24j/guo24j.pdf,https://proceedings.mlr.press/v235/guo24j.html,guo24j,2024,ICML
Diffusion Posterior Sampling is Computationally Intractable,"Shivam Gupta, Ajil Jalal, Aditya Parulekar, Eric Price, Zhiyang Xun",N/A (摘要需访问详情页),https://raw.githubusercontent.com/mlresearch/v235/main/assets/gupta24a/gupta24a.pdf,https://proceedings.mlr.press/v235/gupta24a.html,gupta24a,2024,ICML
xT: Nested Tokenization for Larger Context in Large Images,"Ritwik Gupta, Shufan Li, Tyler Zhu, Jitendra Malik, Trevor Darrell, Karttikeya Mangalam",N/A (摘要需访问详情页),https://raw.githubusercontent.com/mlresearch/v235/main/assets/gupta24b/gupta24b.pdf,https://proceedings.mlr.press/v235/gupta24b.html,gupta24b,2024,ICML
GistScore: Learning Better Representations for In-Context Example Selection with Gist Bottlenecks,"Shivanshu Gupta, Clemens Rosenbaum, Ethan R. Elenberg",N/A (摘要需访问详情页),https://raw.githubusercontent.com/mlresearch/v235/main/assets/gupta24c/gupta24c.pdf,https://proceedings.mlr.press/v235/gupta24c.html,gupta24c,2024,ICML
Light and Optimal Schrödinger Bridge Matching,"Nikita Gushchin, Sergei Kholkin, Evgeny Burnaev, Alexander Korotin",N/A (摘要需访问详情页),https://raw.githubusercontent.com/mlresearch/v235/main/assets/gushchin24a/gushchin24a.pdf,https://proceedings.mlr.press/v235/gushchin24a.html,gushchin24a,2024,ICML
Robust Yet Efficient Conformal Prediction Sets,"Soroush H. Zargarbashi, Mohammad Sadegh Akhondzadeh, Aleksandar Bojchevski",N/A (摘要需访问详情页),https://raw.githubusercontent.com/mlresearch/v235/main/assets/h-zargarbashi24a/h-zargarbashi24a.pdf,https://proceedings.mlr.press/v235/h-zargarbashi24a.html,h-zargarbashi24a,2024,ICML
Optimally Improving Cooperative Learning in a Social Setting,"Shahrzad Haddadan, Cheng Xin, Jie Gao",N/A (摘要需访问详情页),https://raw.githubusercontent.com/mlresearch/v235/main/assets/haddadan24a/haddadan24a.pdf,https://proceedings.mlr.press/v235/haddadan24a.html,haddadan24a,2024,ICML
Vectorized Conditional Neural Fields: A Framework for Solving Time-dependent Parametric Partial Differential Equations,"Jan Hagnberger, Marimuthu Kalimuthu, Daniel Musekamp, Mathias Niepert",N/A (摘要需访问详情页),https://raw.githubusercontent.com/mlresearch/v235/main/assets/hagnberger24a/hagnberger24a.pdf,https://proceedings.mlr.press/v235/hagnberger24a.html,hagnberger24a,2024,ICML
Isometric Representation Learning for Disentangled Latent Space of Diffusion Models,"Jaehoon Hahm, Junho Lee, Sunghyun Kim, Joonseok Lee",N/A (摘要需访问详情页),https://raw.githubusercontent.com/mlresearch/v235/main/assets/hahm24a/hahm24a.pdf,https://proceedings.mlr.press/v235/hahm24a.html,hahm24a,2024,ICML
Pursuing Overall Welfare in Federated Learning through Sequential Decision Making,"Seok-Ju Hahn, Gi-Soo Kim, Junghye Lee",N/A (摘要需访问详情页),https://raw.githubusercontent.com/mlresearch/v235/main/assets/hahn24a/hahn24a.pdf,https://proceedings.mlr.press/v235/hahn24a.html,hahn24a,2024,ICML
Incorporating probabilistic domain knowledge into deep multiple instance learning,"Ghadi S. Al Hajj, Aliaksandr Hubin, Chakravarthi Kanduri, Milena Pavlovic, Knut Dagestad Rand, Michael Widrich, Anne Schistad Solberg, Victor Greiff, Johan Pensar, Günter Klambauer, Geir Kjetil Sandve",N/A (摘要需访问详情页),https://raw.githubusercontent.com/mlresearch/v235/main/assets/hajj24a/hajj24a.pdf,https://proceedings.mlr.press/v235/hajj24a.html,hajj24a,2024,ICML
Covert Malicious Finetuning: Challenges in Safeguarding LLM Adaptation,"Danny Halawi, Alexander Wei, Eric Wallace, Tony Tong Wang, Nika Haghtalab, Jacob Steinhardt",N/A (摘要需访问详情页),https://raw.githubusercontent.com/mlresearch/v235/main/assets/halawi24a/halawi24a.pdf,https://proceedings.mlr.press/v235/halawi24a.html,halawi24a,2024,ICML
