title,authors,abstract,pdf_url,source_url,id,year,conference
Self-cognitive Denoising in the Presence of Multiple Noisy Label Sources,"Yi-Xuan Sun, Ya-Lin Zhang, Bin Han, Longfei Li, Jun Zhou",N/A (摘要需访问详情页),https://raw.githubusercontent.com/mlresearch/v235/main/assets/sun24o/sun24o.pdf,https://proceedings.mlr.press/v235/sun24o.html,sun24o,2024,ICML
BBox-Adapter: Lightweight Adapting for Black-Box Large Language Models,"Haotian Sun, Yuchen Zhuang, Wei Wei, Chao Zhang, Bo Dai",N/A (摘要需访问详情页),https://raw.githubusercontent.com/mlresearch/v235/main/assets/sun24p/sun24p.pdf,https://proceedings.mlr.press/v235/sun24p.html,sun24p,2024,ICML
On a Combinatorial Problem Arising in Machine Teaching,"Joakim Sunde, Brigt Håvardstun, Jan Kratochvı́l, Jan Arne Telle",N/A (摘要需访问详情页),https://raw.githubusercontent.com/mlresearch/v235/main/assets/sunde24a/sunde24a.pdf,https://proceedings.mlr.press/v235/sunde24a.html,sunde24a,2024,ICML
Interpretable Deep Clustering for Tabular Data,"Jonathan Svirsky, Ofir Lindenbaum",N/A (摘要需访问详情页),https://raw.githubusercontent.com/mlresearch/v235/main/assets/svirsky24a/svirsky24a.pdf,https://proceedings.mlr.press/v235/svirsky24a.html,svirsky24a,2024,ICML
Reinforcement Learning from Reachability Specifications: PAC Guarantees with Expected Conditional Distance,"Jakub Svoboda, Suguman Bansal, Krishnendu Chatterjee",N/A (摘要需访问详情页),https://raw.githubusercontent.com/mlresearch/v235/main/assets/svoboda24a/svoboda24a.pdf,https://proceedings.mlr.press/v235/svoboda24a.html,svoboda24a,2024,ICML
A Minimaximalist Approach to Reinforcement Learning from Human Feedback,"Gokul Swamy, Christoph Dann, Rahul Kidambi, Steven Wu, Alekh Agarwal",N/A (摘要需访问详情页),https://raw.githubusercontent.com/mlresearch/v235/main/assets/swamy24a/swamy24a.pdf,https://proceedings.mlr.press/v235/swamy24a.html,swamy24a,2024,ICML
Fast Sampling-Based Sketches for Tensors,"William Joseph Swartworth, David Woodruff",N/A (摘要需访问详情页),https://raw.githubusercontent.com/mlresearch/v235/main/assets/swartworth24a/swartworth24a.pdf,https://proceedings.mlr.press/v235/swartworth24a.html,swartworth24a,2024,ICML
Sample Complexity Bounds for Estimating Probability Divergences under Invariances,"Behrooz Tahmasebi, Stefanie Jegelka",N/A (摘要需访问详情页),https://raw.githubusercontent.com/mlresearch/v235/main/assets/tahmasebi24a/tahmasebi24a.pdf,https://proceedings.mlr.press/v235/tahmasebi24a.html,tahmasebi24a,2024,ICML
A Universal Class of Sharpness-Aware Minimization Algorithms,"Behrooz Tahmasebi, Ashkan Soleymani, Dara Bahri, Stefanie Jegelka, Patrick Jaillet",N/A (摘要需访问详情页),https://raw.githubusercontent.com/mlresearch/v235/main/assets/tahmasebi24b/tahmasebi24b.pdf,https://proceedings.mlr.press/v235/tahmasebi24b.html,tahmasebi24b,2024,ICML
"Preference Fine-Tuning of LLMs Should Leverage Suboptimal, On-Policy Data","Fahim Tajwar, Anikait Singh, Archit Sharma, Rafael Rafailov, Jeff Schneider, Tengyang Xie, Stefano Ermon, Chelsea Finn, Aviral Kumar",N/A (摘要需访问详情页),https://raw.githubusercontent.com/mlresearch/v235/main/assets/tajwar24a/tajwar24a.pdf,https://proceedings.mlr.press/v235/tajwar24a.html,tajwar24a,2024,ICML
Mean-field Analysis on Two-layer Neural Networks from a Kernel Perspective,"Shokichi Takakura, Taiji Suzuki",N/A (摘要需访问详情页),https://raw.githubusercontent.com/mlresearch/v235/main/assets/takakura24a/takakura24a.pdf,https://proceedings.mlr.press/v235/takakura24a.html,takakura24a,2024,ICML
Posterior Sampling-Based Bayesian Optimization with Tighter Bayesian Regret Bounds,"Shion Takeno, Yu Inatsu, Masayuki Karasuyama, Ichiro Takeuchi",N/A (摘要需访问详情页),https://raw.githubusercontent.com/mlresearch/v235/main/assets/takeno24a/takeno24a.pdf,https://proceedings.mlr.press/v235/takeno24a.html,takeno24a,2024,ICML
Codebook Features: Sparse and Discrete Interpretability for Neural Networks,"Alex Tamkin, Mohammad Taufeeque, Noah Goodman",N/A (摘要需访问详情页),https://raw.githubusercontent.com/mlresearch/v235/main/assets/tamkin24a/tamkin24a.pdf,https://proceedings.mlr.press/v235/tamkin24a.html,tamkin24a,2024,ICML
Deciphering RNA Secondary Structure Prediction: A Probabilistic K-Rook Matching Perspective,"Cheng Tan, Zhangyang Gao, Hanqun Cao, Xingran Chen, Ge Wang, Lirong Wu, Jun Xia, Jiangbin Zheng, Stan Z. Li",N/A (摘要需访问详情页),https://raw.githubusercontent.com/mlresearch/v235/main/assets/tan24a/tan24a.pdf,https://proceedings.mlr.press/v235/tan24a.html,tan24a,2024,ICML
Community-Invariant Graph Contrastive Learning,"Shiyin Tan, Dongyuan Li, Renhe Jiang, Ying Zhang, Manabu Okumura",N/A (摘要需访问详情页),https://raw.githubusercontent.com/mlresearch/v235/main/assets/tan24b/tan24b.pdf,https://proceedings.mlr.press/v235/tan24b.html,tan24b,2024,ICML
Fourier Controller Networks for Real-Time Decision-Making in Embodied Learning,"Hengkai Tan, Songming Liu, Kai Ma, Chengyang Ying, Xingxing Zhang, Hang Su, Jun Zhu",N/A (摘要需访问详情页),https://raw.githubusercontent.com/mlresearch/v235/main/assets/tan24c/tan24c.pdf,https://proceedings.mlr.press/v235/tan24c.html,tan24c,2024,ICML
Learning Solution-Aware Transformers for Efficiently Solving Quadratic Assignment Problem,"Zhentao Tan, Yadong Mu",N/A (摘要需访问详情页),https://raw.githubusercontent.com/mlresearch/v235/main/assets/tan24d/tan24d.pdf,https://proceedings.mlr.press/v235/tan24d.html,tan24d,2024,ICML
Information Flow in Self-Supervised Learning,"Zhiquan Tan, Jingqin Yang, Weiran Huang, Yang Yuan, Yifan Zhang",N/A (摘要需访问详情页),https://raw.githubusercontent.com/mlresearch/v235/main/assets/tan24e/tan24e.pdf,https://proceedings.mlr.press/v235/tan24e.html,tan24e,2024,ICML
OTMatch: Improving Semi-Supervised Learning with Optimal Transport,"Zhiquan Tan, Kaipeng Zheng, Weiran Huang",N/A (摘要需访问详情页),https://raw.githubusercontent.com/mlresearch/v235/main/assets/tan24f/tan24f.pdf,https://proceedings.mlr.press/v235/tan24f.html,tan24f,2024,ICML
Post-hoc Part-Prototype Networks,"Andong Tan, Fengtao Zhou, Hao Chen",N/A (摘要需访问详情页),https://raw.githubusercontent.com/mlresearch/v235/main/assets/tan24g/tan24g.pdf,https://proceedings.mlr.press/v235/tan24g.html,tan24g,2024,ICML
Causally Motivated Personalized Federated Invariant Learning with Shortcut-Averse Information-Theoretic Regularization,"Xueyang Tang, Song Guo, Jingcai Guo, Jie Zhang, Yue Yu",N/A (摘要需访问详情页),https://raw.githubusercontent.com/mlresearch/v235/main/assets/tang24a/tang24a.pdf,https://proceedings.mlr.press/v235/tang24a.html,tang24a,2024,ICML
Generalized Preference Optimization: A Unified Approach to Offline Alignment,"Yunhao Tang, Zhaohan Daniel Guo, Zeyu Zheng, Daniele Calandriello, Remi Munos, Mark Rowland, Pierre Harvey Richemond, Michal Valko, Bernardo Avila Pires, Bilal Piot",N/A (摘要需访问详情页),https://raw.githubusercontent.com/mlresearch/v235/main/assets/tang24b/tang24b.pdf,https://proceedings.mlr.press/v235/tang24b.html,tang24b,2024,ICML
Rethinking Optimization and Architecture for Tiny Language Models,"Yehui Tang, Kai Han, Fangcheng Liu, Yunsheng Ni, Yuchuan Tian, Zheyuan Bai, Yi-Qi Hu, Sichao Liu, Shangling Jui, Yunhe Wang",N/A (摘要需访问详情页),https://raw.githubusercontent.com/mlresearch/v235/main/assets/tang24c/tang24c.pdf,https://proceedings.mlr.press/v235/tang24c.html,tang24c,2024,ICML
Residual-Conditioned Optimal Transport: Towards Structure-Preserving Unpaired and Paired Image Restoration,"Xiaole Tang, Xin Hu, Xiang Gu, Jian Sun",N/A (摘要需访问详情页),https://raw.githubusercontent.com/mlresearch/v235/main/assets/tang24d/tang24d.pdf,https://proceedings.mlr.press/v235/tang24d.html,tang24d,2024,ICML
Merging Multi-Task Models via Weight-Ensembling Mixture of Experts,"Anke Tang, Li Shen, Yong Luo, Nan Yin, Lefei Zhang, Dacheng Tao",N/A (摘要需访问详情页),https://raw.githubusercontent.com/mlresearch/v235/main/assets/tang24e/tang24e.pdf,https://proceedings.mlr.press/v235/tang24e.html,tang24e,2024,ICML
Accelerating Parallel Sampling of Diffusion Models,"Zhiwei Tang, Jiasheng Tang, Hao Luo, Fan Wang, Tsung-Hui Chang",N/A (摘要需访问详情页),https://raw.githubusercontent.com/mlresearch/v235/main/assets/tang24f/tang24f.pdf,https://proceedings.mlr.press/v235/tang24f.html,tang24f,2024,ICML
Membership Inference Attacks on Diffusion Models via Quantile Regression,"Shuai Tang, Steven Wu, Sergul Aydore, Michael Kearns, Aaron Roth",N/A (摘要需访问详情页),https://raw.githubusercontent.com/mlresearch/v235/main/assets/tang24g/tang24g.pdf,https://proceedings.mlr.press/v235/tang24g.html,tang24g,2024,ICML
StrokeNUWA—Tokenizing Strokes for Vector Graphic Synthesis,"Zecheng Tang, Chenfei Wu, Zekai Zhang, Minheng Ni, Shengming Yin, Yu Liu, Zhengyuan Yang, Lijuan Wang, Zicheng Liu, Juntao Li, Nan Duan",N/A (摘要需访问详情页),https://raw.githubusercontent.com/mlresearch/v235/main/assets/tang24h/tang24h.pdf,https://proceedings.mlr.press/v235/tang24h.html,tang24h,2024,ICML
SSL4Q: Semi-Supervised Learning of Quantum Data with Application to Quantum State Classification,"Yehui Tang, Nianzu Yang, Mabiao Long, Junchi Yan",N/A (摘要需访问详情页),https://raw.githubusercontent.com/mlresearch/v235/main/assets/tang24i/tang24i.pdf,https://proceedings.mlr.press/v235/tang24i.html,tang24i,2024,ICML
Finite Smoothing Algorithm for High-Dimensional Support Vector Machines and Quantile Regression,"Qian Tang, Yikai Zhang, Boxiang Wang",N/A (摘要需访问详情页),https://raw.githubusercontent.com/mlresearch/v235/main/assets/tang24j/tang24j.pdf,https://proceedings.mlr.press/v235/tang24j.html,tang24j,2024,ICML
MathScale: Scaling Instruction Tuning for Mathematical Reasoning,"Zhengyang Tang, Xingxing Zhang, Benyou Wang, Furu Wei",N/A (摘要需访问详情页),https://raw.githubusercontent.com/mlresearch/v235/main/assets/tang24k/tang24k.pdf,https://proceedings.mlr.press/v235/tang24k.html,tang24k,2024,ICML
QUEST: Query-Aware Sparsity for Efficient Long-Context LLM Inference,"Jiaming Tang, Yilong Zhao, Kan Zhu, Guangxuan Xiao, Baris Kasikci, Song Han",N/A (摘要需访问详情页),https://raw.githubusercontent.com/mlresearch/v235/main/assets/tang24l/tang24l.pdf,https://proceedings.mlr.press/v235/tang24l.html,tang24l,2024,ICML
MLI Formula: A Nearly Scale-Invariant Solution with Noise Perturbation,"Bowen Tao, Xin-Chun Li, De-Chuan Zhan",N/A (摘要需访问详情页),https://raw.githubusercontent.com/mlresearch/v235/main/assets/tao24a/tao24a.pdf,https://proceedings.mlr.press/v235/tao24a.html,tao24a,2024,ICML
Learning in Feature Spaces via Coupled Covariances: Asymmetric Kernel SVD and Nyström method,"Qinghua Tao, Francesco Tonin, Alex Lambert, Yingyi Chen, Panagiotis Patrinos, Johan Suykens",N/A (摘要需访问详情页),https://raw.githubusercontent.com/mlresearch/v235/main/assets/tao24b/tao24b.pdf,https://proceedings.mlr.press/v235/tao24b.html,tao24b,2024,ICML
"Selective Mixup Helps with Distribution Shifts, But Not (Only) because of Mixup","Damien Teney, Jindong Wang, Ehsan Abbasnejad",N/A (摘要需访问详情页),https://raw.githubusercontent.com/mlresearch/v235/main/assets/teney24a/teney24a.pdf,https://proceedings.mlr.press/v235/teney24a.html,teney24a,2024,ICML
Quantum Positional Encodings for Graph Neural Networks,"Slimane Thabet, Mehdi Djellabi, Igor Olegovich Sokolov, Sachin Kasture, Louis-Paul Henry, Loic Henriet",N/A (摘要需访问详情页),https://raw.githubusercontent.com/mlresearch/v235/main/assets/thabet24a/thabet24a.pdf,https://proceedings.mlr.press/v235/thabet24a.html,thabet24a,2024,ICML
Sparse-IFT: Sparse Iso-FLOP Transformations for Maximizing Training Efficiency,"Vithursan Thangarasa, Shreyas Saxena, Abhay Gupta, Sean Lie",N/A (摘要需访问详情页),https://raw.githubusercontent.com/mlresearch/v235/main/assets/thangarasa24a/thangarasa24a.pdf,https://proceedings.mlr.press/v235/thangarasa24a.html,thangarasa24a,2024,ICML
"SleepFM: Multi-modal Representation Learning for Sleep Across Brain Activity, ECG and Respiratory Signals","Rahul Thapa, Bryan He, Magnus Ruud Kjaer, Hyatt Moore Iv, Gauri Ganjoo, Emmanuel Mignot, James Zou",N/A (摘要需访问详情页),https://raw.githubusercontent.com/mlresearch/v235/main/assets/thapa24a/thapa24a.pdf,https://proceedings.mlr.press/v235/thapa24a.html,thapa24a,2024,ICML
Bayesian Adaptation of Network Depth and Width for Continual Learning,"Jeevan Thapa, Rui Li",N/A (摘要需访问详情页),https://raw.githubusercontent.com/mlresearch/v235/main/assets/thapa24b/thapa24b.pdf,https://proceedings.mlr.press/v235/thapa24b.html,thapa24b,2024,ICML
Position: What makes an image realistic?,Lucas Theis,N/A (摘要需访问详情页),https://raw.githubusercontent.com/mlresearch/v235/main/assets/theis24a/theis24a.pdf,https://proceedings.mlr.press/v235/theis24a.html,theis24a,2024,ICML
A New Branch-and-Bound Pruning Framework for $\ell_0$-Regularized Problems,"Theo Guyard, Cédric Herzet, Clément Elvira, Ayse-Nur Arslan",N/A (摘要需访问详情页),https://raw.githubusercontent.com/mlresearch/v235/main/assets/guyard24a/guyard24a.pdf,https://proceedings.mlr.press/v235/guyard24a.html,guyard24a,2024,ICML
Beyond Individual Input for Deep Anomaly Detection on Tabular Data,"Hugo Thimonier, Fabrice Popineau, Arpad Rimmel, Bich-Liên Doan",N/A (摘要需访问详情页),https://raw.githubusercontent.com/mlresearch/v235/main/assets/thimonier24a/thimonier24a.pdf,https://proceedings.mlr.press/v235/thimonier24a.html,thimonier24a,2024,ICML
Risk Estimation in a Markov Cost Process: Lower and Upper Bounds,"Gugan Thoppe, Prashanth L A, Sanjay P. Bhat",N/A (摘要需访问详情页),https://raw.githubusercontent.com/mlresearch/v235/main/assets/thoppe24a/thoppe24a.pdf,https://proceedings.mlr.press/v235/thoppe24a.html,thoppe24a,2024,ICML
Collapse-Aware Triplet Decoupling for Adversarially Robust Image Retrieval,"Qiwei Tian, Chenhao Lin, Zhengyu Zhao, Qian Li, Chao Shen",N/A (摘要需访问详情页),https://raw.githubusercontent.com/mlresearch/v235/main/assets/tian24a/tian24a.pdf,https://proceedings.mlr.press/v235/tian24a.html,tian24a,2024,ICML
MOKD: Cross-domain Finetuning for Few-shot Classification via Maximizing Optimized Kernel Dependence,"Hongduan Tian, Feng Liu, Tongliang Liu, Bo Du, Yiu-Ming Cheung, Bo Han",N/A (摘要需访问详情页),https://raw.githubusercontent.com/mlresearch/v235/main/assets/tian24b/tian24b.pdf,https://proceedings.mlr.press/v235/tian24b.html,tian24b,2024,ICML
Liouville Flow Importance Sampler,"Yifeng Tian, Nishant Panda, Yen Ting Lin",N/A (摘要需访问详情页),https://raw.githubusercontent.com/mlresearch/v235/main/assets/tian24c/tian24c.pdf,https://proceedings.mlr.press/v235/tian24c.html,tian24c,2024,ICML
Ranking-based Client Imitation Selection for Efficient Federated Learning,"Chunlin Tian, Zhan Shi, Xinpeng Qin, Li Li, Cheng-Zhong Xu",N/A (摘要需访问详情页),https://raw.githubusercontent.com/mlresearch/v235/main/assets/tian24d/tian24d.pdf,https://proceedings.mlr.press/v235/tian24d.html,tian24d,2024,ICML
Towards the Theory of Unsupervised Federated Learning: Non-asymptotic Analysis of Federated EM Algorithms,"Ye Tian, Haolei Weng, Yang Feng",N/A (摘要需访问详情页),https://raw.githubusercontent.com/mlresearch/v235/main/assets/tian24e/tian24e.pdf,https://proceedings.mlr.press/v235/tian24e.html,tian24e,2024,ICML
Copula-Nested Spectral Kernel Network,"Jinyue Tian, Hui Xue, Yanfang Xue, Pengfei Fang",N/A (摘要需访问详情页),https://raw.githubusercontent.com/mlresearch/v235/main/assets/tian24f/tian24f.pdf,https://proceedings.mlr.press/v235/tian24f.html,tian24f,2024,ICML
Boundary Exploration for Bayesian Optimization With Unknown Physical Constraints,"Yunsheng Tian, Ane Zuniga, Xinwei Zhang, Johannes P. Dürholt, Payel Das, Jie Chen, Wojciech Matusik, Mina Konakovic Lukovic",N/A (摘要需访问详情页),https://raw.githubusercontent.com/mlresearch/v235/main/assets/tian24g/tian24g.pdf,https://proceedings.mlr.press/v235/tian24g.html,tian24g,2024,ICML
FRAPPÉ: A Group Fairness Framework for Post-Processing Everything,"Alexandru Tifrea, Preethi Lahoti, Ben Packer, Yoni Halpern, Ahmad Beirami, Flavien Prost",N/A (摘要需访问详情页),https://raw.githubusercontent.com/mlresearch/v235/main/assets/tifrea24a/tifrea24a.pdf,https://proceedings.mlr.press/v235/tifrea24a.html,tifrea24a,2024,ICML
Faster Maximum Inner Product Search in High Dimensions,"Mo Tiwari, Ryan Kang, Jaeyong Lee, Donghyun Lee, Christopher J Piech, Sebastian Thrun, Ilan Shomorony, Martin Jinye Zhang",N/A (摘要需访问详情页),https://raw.githubusercontent.com/mlresearch/v235/main/assets/tiwari24a/tiwari24a.pdf,https://proceedings.mlr.press/v235/tiwari24a.html,tiwari24a,2024,ICML
Position: Enforced Amnesia as a Way to Mitigate the Potential Risk of Silent Suffering in the Conscious AI,Yegor Tkachenko,N/A (摘要需访问详情页),https://raw.githubusercontent.com/mlresearch/v235/main/assets/tkachenko24a/tkachenko24a.pdf,https://proceedings.mlr.press/v235/tkachenko24a.html,tkachenko24a,2024,ICML
How Deep Networks Learn Sparse and Hierarchical Data: the Sparse Random Hierarchy Model,"Umberto Maria Tomasini, Matthieu Wyart",N/A (摘要需访问详情页),https://raw.githubusercontent.com/mlresearch/v235/main/assets/tomasini24a/tomasini24a.pdf,https://proceedings.mlr.press/v235/tomasini24a.html,tomasini24a,2024,ICML
Position: Do Not Explain Vision Models Without Context,"Paulina Tomaszewska, Przemyslaw Biecek",N/A (摘要需访问详情页),https://raw.githubusercontent.com/mlresearch/v235/main/assets/tomaszewska24a/tomaszewska24a.pdf,https://proceedings.mlr.press/v235/tomaszewska24a.html,tomaszewska24a,2024,ICML
An Analysis of Linear Time Series Forecasting Models,"William Toner, Luke Nicholas Darlow",N/A (摘要需访问详情页),https://raw.githubusercontent.com/mlresearch/v235/main/assets/toner24a/toner24a.pdf,https://proceedings.mlr.press/v235/toner24a.html,toner24a,2024,ICML
Neural SPH: Improved Neural Modeling of Lagrangian Fluid Dynamics,"Artur Toshev, Jonas A. Erbesdobler, Nikolaus A. Adams, Johannes Brandstetter",N/A (摘要需访问详情页),https://raw.githubusercontent.com/mlresearch/v235/main/assets/toshev24a/toshev24a.pdf,https://proceedings.mlr.press/v235/toshev24a.html,toshev24a,2024,ICML
Position: Considerations for Differentially Private Learning with Large-Scale Public Pretraining,"Florian Tramèr, Gautam Kamath, Nicholas Carlini",N/A (摘要需访问详情页),https://raw.githubusercontent.com/mlresearch/v235/main/assets/tramer24a/tramer24a.pdf,https://proceedings.mlr.press/v235/tramer24a.html,tramer24a,2024,ICML
Causal Effect Identification in LiNGAM Models with Latent Confounders,"Daniele Tramontano, Yaroslav Kivva, Saber Salehkaleybar, Mathias Drton, Negar Kiyavash",N/A (摘要需访问详情页),https://raw.githubusercontent.com/mlresearch/v235/main/assets/tramontano24a/tramontano24a.pdf,https://proceedings.mlr.press/v235/tramontano24a.html,tramontano24a,2024,ICML
Stereographic Spherical Sliced Wasserstein Distances,"Huy Tran, Yikun Bai, Abihith Kothapalli, Ashkan Shahbazi, Xinran Liu, Rocio P Diaz Martin, Soheil Kolouri",N/A (摘要需访问详情页),https://raw.githubusercontent.com/mlresearch/v235/main/assets/tran24a/tran24a.pdf,https://proceedings.mlr.press/v235/tran24a.html,tran24a,2024,ICML
Inferring the Long-Term Causal Effects of Long-Term Treatments from Short-Term Experiments,"Allen Tran, Aurelien Bibaut, Nathan Kallus",N/A (摘要需访问详情页),https://raw.githubusercontent.com/mlresearch/v235/main/assets/tran24b/tran24b.pdf,https://proceedings.mlr.press/v235/tran24b.html,tran24b,2024,ICML
Agent-Specific Effects: A Causal Effect Propagation Analysis in Multi-Agent MDPs,"Stelios Triantafyllou, Aleksa Sukovic, Debmalya Mandal, Goran Radanovic",N/A (摘要需访问详情页),https://raw.githubusercontent.com/mlresearch/v235/main/assets/triantafyllou24a/triantafyllou24a.pdf,https://proceedings.mlr.press/v235/triantafyllou24a.html,triantafyllou24a,2024,ICML
Editing Partially Observable Networks via Graph Diffusion Models,"Puja Trivedi, Ryan A. Rossi, David Arbour, Tong Yu, Franck Dernoncourt, Sungchul Kim, Nedim Lipka, Namyong Park, Nesreen K. Ahmed, Danai Koutra",N/A (摘要需访问详情页),https://raw.githubusercontent.com/mlresearch/v235/main/assets/trivedi24a/trivedi24a.pdf,https://proceedings.mlr.press/v235/trivedi24a.html,trivedi24a,2024,ICML
QuIP$#$: Even Better LLM Quantization with Hadamard Incoherence and Lattice Codebooks,"Albert Tseng, Jerry Chee, Qingyao Sun, Volodymyr Kuleshov, Christopher De Sa",N/A (摘要需访问详情页),https://raw.githubusercontent.com/mlresearch/v235/main/assets/tseng24a/tseng24a.pdf,https://proceedings.mlr.press/v235/tseng24a.html,tseng24a,2024,ICML
Predictive Linear Online Tracking for Unknown Targets,"Anastasios Tsiamis, Aren Karapetyan, Yueshan Li, Efe C. Balta, John Lygeros",N/A (摘要需访问详情页),https://raw.githubusercontent.com/mlresearch/v235/main/assets/tsiamis24a/tsiamis24a.pdf,https://proceedings.mlr.press/v235/tsiamis24a.html,tsiamis24a,2024,ICML
Overcoming the Optimizer’s Curse: Obtaining Realistic Prescriptions from Neural Networks,"Asterios Tsiourvas, Georgia Perakis",N/A (摘要需访问详情页),https://raw.githubusercontent.com/mlresearch/v235/main/assets/tsiourvas24a/tsiourvas24a.pdf,https://proceedings.mlr.press/v235/tsiourvas24a.html,tsiourvas24a,2024,ICML
Learning Optimal Projection for Forecast Reconciliation of Hierarchical Time Series,"Asterios Tsiourvas, Wei Sun, Georgia Perakis, Pin-Yu Chen, Yada Zhu",N/A (摘要需访问详情页),https://raw.githubusercontent.com/mlresearch/v235/main/assets/tsiourvas24b/tsiourvas24b.pdf,https://proceedings.mlr.press/v235/tsiourvas24b.html,tsiourvas24b,2024,ICML
Simplicity Bias of Two-Layer Networks beyond Linearly Separable Data,"Nikita Tsoy, Nikola Konstantinov",N/A (摘要需访问详情页),https://raw.githubusercontent.com/mlresearch/v235/main/assets/tsoy24a/tsoy24a.pdf,https://proceedings.mlr.press/v235/tsoy24a.html,tsoy24a,2024,ICML
Exploration by Optimization with Hybrid Regularizers: Logarithmic Regret with Adversarial Robustness in Partial Monitoring,"Taira Tsuchiya, Shinji Ito, Junya Honda",N/A (摘要需访问详情页),https://raw.githubusercontent.com/mlresearch/v235/main/assets/tsuchiya24a/tsuchiya24a.pdf,https://proceedings.mlr.press/v235/tsuchiya24a.html,tsuchiya24a,2024,ICML
An Empirical Study Into What Matters for Calibrating Vision-Language Models,"Weijie Tu, Weijian Deng, Dylan Campbell, Stephen Gould, Tom Gedeon",N/A (摘要需访问详情页),https://raw.githubusercontent.com/mlresearch/v235/main/assets/tu24a/tu24a.pdf,https://proceedings.mlr.press/v235/tu24a.html,tu24a,2024,ICML
Coactive Learning for Large Language Models using Implicit User Feedback,"Aaron David Tucker, Kianté Brantley, Adam Cahall, Thorsten Joachims",N/A (摘要需访问详情页),https://raw.githubusercontent.com/mlresearch/v235/main/assets/tucker24a/tucker24a.pdf,https://proceedings.mlr.press/v235/tucker24a.html,tucker24a,2024,ICML
An Efficient Self-Learning Framework For Interactive Spoken Dialog Systems,"Hitesh Tulsiani, David Chan, Shalini Ghosh, Garima Lalwani, Prabhat Pandey, Ankish Bansal, Sri Garimella, Ariya Rastrow, Björn Hoffmeister",N/A (摘要需访问详情页),https://raw.githubusercontent.com/mlresearch/v235/main/assets/tulsiani24a/tulsiani24a.pdf,https://proceedings.mlr.press/v235/tulsiani24a.html,tulsiani24a,2024,ICML
ALERT-Transformer: Bridging Asynchronous and Synchronous Machine Learning for Real-Time Event-based Spatio-Temporal Data,"Carmen Martin Turrero, Maxence Bouvier, Manuel Breitenstein, Pietro Zanuttigh, Vincent Parret",N/A (摘要需访问详情页),https://raw.githubusercontent.com/mlresearch/v235/main/assets/turrero24a/turrero24a.pdf,https://proceedings.mlr.press/v235/turrero24a.html,turrero24a,2024,ICML
Matroid Semi-Bandits in Sublinear Time,"Ruo-Chun Tzeng, Naoto Ohsaka, Kaito Ariu",N/A (摘要需访问详情页),https://raw.githubusercontent.com/mlresearch/v235/main/assets/tzeng24a/tzeng24a.pdf,https://proceedings.mlr.press/v235/tzeng24a.html,tzeng24a,2024,ICML
Improving Antibody Humanness Prediction using Patent Data,"Talip Ucar, Aubin Ramon, Dino Oglic, Rebecca Croasdale-Wood, Tom Diethe, Pietro Sormanni",N/A (摘要需访问详情页),https://raw.githubusercontent.com/mlresearch/v235/main/assets/ucar24a/ucar24a.pdf,https://proceedings.mlr.press/v235/ucar24a.html,ucar24a,2024,ICML
Feedback Efficient Online Fine-Tuning of Diffusion Models,"Masatoshi Uehara, Yulai Zhao, Kevin Black, Ehsan Hajiramezanali, Gabriele Scalia, Nathaniel Lee Diamant, Alex M Tseng, Sergey Levine, Tommaso Biancalani",N/A (摘要需访问详情页),https://raw.githubusercontent.com/mlresearch/v235/main/assets/uehara24a/uehara24a.pdf,https://proceedings.mlr.press/v235/uehara24a.html,uehara24a,2024,ICML
Do Large Language Models Perform the Way People Expect? Measuring the Human Generalization Function,"Keyon Vafa, Ashesh Rambachan, Sendhil Mullainathan",N/A (摘要需访问详情页),https://raw.githubusercontent.com/mlresearch/v235/main/assets/vafa24a/vafa24a.pdf,https://proceedings.mlr.press/v235/vafa24a.html,vafa24a,2024,ICML
Reward-Free Kernel-Based Reinforcement Learning,"Sattar Vakili, Farhang Nabiei, Da-Shan Shiu, Alberto Bernacchia",N/A (摘要需访问详情页),https://raw.githubusercontent.com/mlresearch/v235/main/assets/vakili24a/vakili24a.pdf,https://proceedings.mlr.press/v235/vakili24a.html,vakili24a,2024,ICML
