title,authors,abstract,pdf_url,source_url,id,year,conference
PAC-Bayesian Bounds on Rate-Efficient Classifiers,"Alhabib Abbas, Yiannis Andreopoulos",N/A (摘要需访问详情页),https://proceedings.mlr.press/v162/abbas22a/abbas22a.pdf,https://proceedings.mlr.press/v162/abbas22a.html,abbas22a,2022,ICML
Sharp-MAML: Sharpness-Aware Model-Agnostic Meta Learning,"Momin Abbas, Quan Xiao, Lisha Chen, Pin-Yu Chen, Tianyi Chen",N/A (摘要需访问详情页),https://proceedings.mlr.press/v162/abbas22b/abbas22b.pdf,https://proceedings.mlr.press/v162/abbas22b.html,abbas22b,2022,ICML
An Initial Alignment between Neural Network and Target is Needed for Gradient Descent to Learn,"Emmanuel Abbe, Elisabetta Cornacchia, Jan Hazla, Christopher Marquis",N/A (摘要需访问详情页),https://proceedings.mlr.press/v162/abbe22a/abbe22a.pdf,https://proceedings.mlr.press/v162/abbe22a.html,abbe22a,2022,ICML
Active Sampling for Min-Max Fairness,"Jacob D Abernethy, Pranjal Awasthi, Matthäus Kleindessner, Jamie Morgenstern, Chris Russell, Jie Zhang",N/A (摘要需访问详情页),https://proceedings.mlr.press/v162/abernethy22a/abernethy22a.pdf,https://proceedings.mlr.press/v162/abernethy22a.html,abernethy22a,2022,ICML
Meaningfully debugging model mistakes using conceptual counterfactual explanations,"Abubakar Abid, Mert Yuksekgonul, James Zou",N/A (摘要需访问详情页),https://proceedings.mlr.press/v162/abid22a/abid22a.pdf,https://proceedings.mlr.press/v162/abid22a.html,abid22a,2022,ICML
Batched Dueling Bandits,"Arpit Agarwal, Rohan Ghuge, Viswanath Nagarajan",N/A (摘要需访问详情页),https://proceedings.mlr.press/v162/agarwal22a/agarwal22a.pdf,https://proceedings.mlr.press/v162/agarwal22a.html,agarwal22a,2022,ICML
Hierarchical Shrinkage: Improving the accuracy and interpretability of tree-based models.,"Abhineet Agarwal, Yan Shuo Tan, Omer Ronen, Chandan Singh, Bin Yu",N/A (摘要需访问详情页),https://proceedings.mlr.press/v162/agarwal22b/agarwal22b.pdf,https://proceedings.mlr.press/v162/agarwal22b.html,agarwal22b,2022,ICML
Deep equilibrium networks are sensitive to initialization statistics,"Atish Agarwala, Samuel S Schoenholz",N/A (摘要需访问详情页),https://proceedings.mlr.press/v162/agarwala22a/agarwala22a.pdf,https://proceedings.mlr.press/v162/agarwala22a.html,agarwala22a,2022,ICML
Learning of Cluster-based Feature Importance for Electronic Health Record Time-series,"Henrique Aguiar, Mauro Santos, Peter Watkinson, Tingting Zhu",N/A (摘要需访问详情页),https://proceedings.mlr.press/v162/aguiar22a/aguiar22a.pdf,https://proceedings.mlr.press/v162/aguiar22a.html,aguiar22a,2022,ICML
On the Convergence of the Shapley Value in Parametric Bayesian Learning Games,"Lucas Agussurja, Xinyi Xu, Bryan Kian Hsiang Low",N/A (摘要需访问详情页),https://proceedings.mlr.press/v162/agussurja22a/agussurja22a.pdf,https://proceedings.mlr.press/v162/agussurja22a.html,agussurja22a,2022,ICML
Individual Preference Stability for Clustering,"Saba Ahmadi, Pranjal Awasthi, Samir Khuller, Matthäus Kleindessner, Jamie Morgenstern, Pattara Sukprasert, Ali Vakilian",N/A (摘要需访问详情页),https://proceedings.mlr.press/v162/ahmadi22a/ahmadi22a.pdf,https://proceedings.mlr.press/v162/ahmadi22a.html,ahmadi22a,2022,ICML
Understanding the unstable convergence of gradient descent,"Kwangjun Ahn, Jingzhao Zhang, Suvrit Sra",N/A (摘要需访问详情页),https://proceedings.mlr.press/v162/ahn22a/ahn22a.pdf,https://proceedings.mlr.press/v162/ahn22a.html,ahn22a,2022,ICML
Minimum Cost Intervention Design for Causal Effect Identification,"Sina Akbari, Jalal Etesami, Negar Kiyavash",N/A (摘要需访问详情页),https://proceedings.mlr.press/v162/akbari22a/akbari22a.pdf,https://proceedings.mlr.press/v162/akbari22a.html,akbari22a,2022,ICML
How Faithful is your Synthetic Data? Sample-level Metrics for Evaluating and Auditing Generative Models,"Ahmed Alaa, Boris Van Breugel, Evgeny S. Saveliev, Mihaela van der Schaar",N/A (摘要需访问详情页),https://proceedings.mlr.press/v162/alaa22a/alaa22a.pdf,https://proceedings.mlr.press/v162/alaa22a.html,alaa22a,2022,ICML
A Natural Actor-Critic Framework for Zero-Sum Markov Games,"Ahmet Alacaoglu, Luca Viano, Niao He, Volkan Cevher",N/A (摘要需访问详情页),https://proceedings.mlr.press/v162/alacaoglu22a/alacaoglu22a.pdf,https://proceedings.mlr.press/v162/alacaoglu22a.html,alacaoglu22a,2022,ICML
Deploying Convolutional Networks on Untrusted Platforms Using 2D Holographic Reduced Representations,"Mohammad Mahmudul Alam, Edward Raff, Tim Oates, James Holt",N/A (摘要需访问详情页),https://proceedings.mlr.press/v162/alam22a/alam22a.pdf,https://proceedings.mlr.press/v162/alam22a.html,alam22a,2022,ICML
Optimistic Linear Support and Successor Features as a Basis for Optimal Policy Transfer,"Lucas Nunes Alegre, Ana Bazzan, Bruno C. Da Silva",N/A (摘要需访问详情页),https://proceedings.mlr.press/v162/alegre22a/alegre22a.pdf,https://proceedings.mlr.press/v162/alegre22a.html,alegre22a,2022,ICML
Structured Stochastic Gradient MCMC,"Antonios Alexos, Alex J Boyd, Stephan Mandt",N/A (摘要需访问详情页),https://proceedings.mlr.press/v162/alexos22a/alexos22a.pdf,https://proceedings.mlr.press/v162/alexos22a.html,alexos22a,2022,ICML
XAI for Transformers: Better Explanations through Conservative Propagation,"Ameen Ali, Thomas Schnake, Oliver Eberle, Grégoire Montavon, Klaus-Robert Müller, Lior Wolf",N/A (摘要需访问详情页),https://proceedings.mlr.press/v162/ali22a/ali22a.pdf,https://proceedings.mlr.press/v162/ali22a.html,ali22a,2022,ICML
RUMs from Head-to-Head Contests,"Matteo Almanza, Flavio Chierichetti, Ravi Kumar, Alessandro Panconesi, Andrew Tomkins",N/A (摘要需访问详情页),https://proceedings.mlr.press/v162/almanza22a/almanza22a.pdf,https://proceedings.mlr.press/v162/almanza22a.html,almanza22a,2022,ICML
Neuro-Symbolic Language Modeling with Automaton-augmented Retrieval,"Uri Alon, Frank Xu, Junxian He, Sudipta Sengupta, Dan Roth, Graham Neubig",N/A (摘要需访问详情页),https://proceedings.mlr.press/v162/alon22a/alon22a.pdf,https://proceedings.mlr.press/v162/alon22a.html,alon22a,2022,ICML
Minimax Classification under Concept Drift with Multidimensional Adaptation and Performance Guarantees,"Verónica Álvarez, Santiago Mazuelas, Jose A Lozano",N/A (摘要需访问详情页),https://proceedings.mlr.press/v162/alvarez22a/alvarez22a.pdf,https://proceedings.mlr.press/v162/alvarez22a.html,alvarez22a,2022,ICML
Scalable First-Order Bayesian Optimization via Structured Automatic Differentiation,"Sebastian E Ament, Carla P Gomes",N/A (摘要需访问详情页),https://proceedings.mlr.press/v162/ament22a/ament22a.pdf,https://proceedings.mlr.press/v162/ament22a.html,ament22a,2022,ICML
Public Data-Assisted Mirror Descent for Private Model Training,"Ehsan Amid, Arun Ganesh, Rajiv Mathews, Swaroop Ramaswamy, Shuang Song, Thomas Steinke, Thomas Steinke, Vinith M Suriyakumar, Om Thakkar, Abhradeep Thakurta",N/A (摘要需访问详情页),https://proceedings.mlr.press/v162/amid22a/amid22a.pdf,https://proceedings.mlr.press/v162/amid22a.html,amid22a,2022,ICML
On Last-Iterate Convergence Beyond Zero-Sum Games,"Ioannis Anagnostides, Ioannis Panageas, Gabriele Farina, Tuomas Sandholm",N/A (摘要需访问详情页),https://proceedings.mlr.press/v162/anagnostides22a/anagnostides22a.pdf,https://proceedings.mlr.press/v162/anagnostides22a.html,anagnostides22a,2022,ICML
Online Algorithms with Multiple Predictions,"Keerti Anand, Rong Ge, Amit Kumar, Debmalya Panigrahi",N/A (摘要需访问详情页),https://proceedings.mlr.press/v162/anand22a/anand22a.pdf,https://proceedings.mlr.press/v162/anand22a.html,anand22a,2022,ICML
"Learning to Hash Robustly, Guaranteed","Alexandr Andoni, Daniel Beaglehole",N/A (摘要需访问详情页),https://proceedings.mlr.press/v162/andoni22a/andoni22a.pdf,https://proceedings.mlr.press/v162/andoni22a.html,andoni22a,2022,ICML
Set Based Stochastic Subsampling,"Bruno Andreis, Seanie Lee, A. Tuan Nguyen, Juho Lee, Eunho Yang, Sung Ju Hwang",N/A (摘要需访问详情页),https://proceedings.mlr.press/v162/andreis22a/andreis22a.pdf,https://proceedings.mlr.press/v162/andreis22a.html,andreis22a,2022,ICML
Towards Understanding Sharpness-Aware Minimization,"Maksym Andriushchenko, Nicolas Flammarion",N/A (摘要需访问详情页),https://proceedings.mlr.press/v162/andriushchenko22a/andriushchenko22a.pdf,https://proceedings.mlr.press/v162/andriushchenko22a.html,andriushchenko22a,2022,ICML
Fair and Fast k-Center Clustering for Data Summarization,"Haris Angelidakis, Adam Kurpisz, Leon Sering, Rico Zenklusen",N/A (摘要需访问详情页),https://proceedings.mlr.press/v162/angelidakis22a/angelidakis22a.pdf,https://proceedings.mlr.press/v162/angelidakis22a.html,angelidakis22a,2022,ICML
Interactive Correlation Clustering with Existential Cluster Constraints,"Rico Angell, Nicholas Monath, Nishant Yadav, Andrew Mccallum",N/A (摘要需访问详情页),https://proceedings.mlr.press/v162/angell22a/angell22a.pdf,https://proceedings.mlr.press/v162/angell22a.html,angell22a,2022,ICML
Image-to-Image Regression with Distribution-Free Uncertainty Quantification and Applications in Imaging,"Anastasios N Angelopoulos, Amit Pal Kohli, Stephen Bates, Michael Jordan, Jitendra Malik, Thayer Alshaabi, Srigokul Upadhyayula, Yaniv Romano",N/A (摘要需访问详情页),https://proceedings.mlr.press/v162/angelopoulos22a/angelopoulos22a.pdf,https://proceedings.mlr.press/v162/angelopoulos22a.html,angelopoulos22a,2022,ICML
AdaGrad Avoids Saddle Points,"Kimon Antonakopoulos, Panayotis Mertikopoulos, Georgios Piliouras, Xiao Wang",N/A (摘要需访问详情页),https://proceedings.mlr.press/v162/antonakopoulos22a/antonakopoulos22a.pdf,https://proceedings.mlr.press/v162/antonakopoulos22a.html,antonakopoulos22a,2022,ICML
UnderGrad: A Universal Black-Box Optimization Method with Almost Dimension-Free Convergence Rate Guarantees,"Kimon Antonakopoulos, Dong Quan Vu, Volkan Cevher, Kfir Levy, Panayotis Mertikopoulos",N/A (摘要需访问详情页),https://proceedings.mlr.press/v162/antonakopoulos22b/antonakopoulos22b.pdf,https://proceedings.mlr.press/v162/antonakopoulos22b.html,antonakopoulos22b,2022,ICML
Adapting the Linearised Laplace Model Evidence for Modern Deep Learning,"Javier Antoran, David Janz, James U Allingham, Erik Daxberger, Riccardo Rb Barbano, Eric Nalisnick, Jose Miguel Hernandez-Lobato",N/A (摘要需访问详情页),https://proceedings.mlr.press/v162/antoran22a/antoran22a.pdf,https://proceedings.mlr.press/v162/antoran22a.html,antoran22a,2022,ICML
EAT-C: Environment-Adversarial sub-Task Curriculum for Efficient Reinforcement Learning,"Shuang Ao, Tianyi Zhou, Jing Jiang, Guodong Long, Xuan Song, Chengqi Zhang",N/A (摘要需访问详情页),https://proceedings.mlr.press/v162/ao22a/ao22a.pdf,https://proceedings.mlr.press/v162/ao22a.html,ao22a,2022,ICML
Online Balanced Experimental Design,"David Arbour, Drew Dimmery, Tung Mai, Anup Rao",N/A (摘要需访问详情页),https://proceedings.mlr.press/v162/arbour22a/arbour22a.pdf,https://proceedings.mlr.press/v162/arbour22a.html,arbour22a,2022,ICML
VariGrow: Variational Architecture Growing for Task-Agnostic Continual Learning based on Bayesian Novelty,"Randy Ardywibowo, Zepeng Huo, Zhangyang Wang, Bobak J Mortazavi, Shuai Huang, Xiaoning Qian",N/A (摘要需访问详情页),https://proceedings.mlr.press/v162/ardywibowo22a/ardywibowo22a.pdf,https://proceedings.mlr.press/v162/ardywibowo22a.html,ardywibowo22a,2022,ICML
Thresholded Lasso Bandit,"Kaito Ariu, Kenshi Abe, Alexandre Proutiere",N/A (摘要需访问详情页),https://proceedings.mlr.press/v162/ariu22a/ariu22a.pdf,https://proceedings.mlr.press/v162/ariu22a.html,ariu22a,2022,ICML
Gradient Based Clustering,"Aleksandar Armacki, Dragana Bajovic, Dusan Jakovetic, Soummya Kar",N/A (摘要需访问详情页),https://proceedings.mlr.press/v162/armacki22a/armacki22a.pdf,https://proceedings.mlr.press/v162/armacki22a.html,armacki22a,2022,ICML
Understanding Gradient Descent on the Edge of Stability in Deep Learning,"Sanjeev Arora, Zhiyuan Li, Abhishek Panigrahi",N/A (摘要需访问详情页),https://proceedings.mlr.press/v162/arora22a/arora22a.pdf,https://proceedings.mlr.press/v162/arora22a.html,arora22a,2022,ICML
Private optimization in the interpolation regime: faster rates and hardness results,"Hilal Asi, Karan Chadha, Gary Cheng, John Duchi",N/A (摘要需访问详情页),https://proceedings.mlr.press/v162/asi22a/asi22a.pdf,https://proceedings.mlr.press/v162/asi22a.html,asi22a,2022,ICML
Optimal Algorithms for Mean Estimation under Local Differential Privacy,"Hilal Asi, Vitaly Feldman, Kunal Talwar",N/A (摘要需访问详情页),https://proceedings.mlr.press/v162/asi22b/asi22b.pdf,https://proceedings.mlr.press/v162/asi22b.html,asi22b,2022,ICML
Asymptotically-Optimal Gaussian Bandits with Side Observations,"Alexia Atsidakou, Orestis Papadigenopoulos, Constantine Caramanis, Sujay Sanghavi, Sanjay Shakkottai",N/A (摘要需访问详情页),https://proceedings.mlr.press/v162/atsidakou22a/atsidakou22a.pdf,https://proceedings.mlr.press/v162/atsidakou22a.html,atsidakou22a,2022,ICML
Congested Bandits: Optimal Routing via Short-term Resets,"Pranjal Awasthi, Kush Bhatia, Sreenivas Gollapudi, Kostas Kollias",N/A (摘要需访问详情页),https://proceedings.mlr.press/v162/awasthi22a/awasthi22a.pdf,https://proceedings.mlr.press/v162/awasthi22a.html,awasthi22a,2022,ICML
Do More Negative Samples Necessarily Hurt In Contrastive Learning?,"Pranjal Awasthi, Nishanth Dikkala, Pritish Kamath",N/A (摘要需访问详情页),https://proceedings.mlr.press/v162/awasthi22b/awasthi22b.pdf,https://proceedings.mlr.press/v162/awasthi22b.html,awasthi22b,2022,ICML
H-Consistency Bounds for Surrogate Loss Minimizers,"Pranjal Awasthi, Anqi Mao, Mehryar Mohri, Yutao Zhong",N/A (摘要需访问详情页),https://proceedings.mlr.press/v162/awasthi22c/awasthi22c.pdf,https://proceedings.mlr.press/v162/awasthi22c.html,awasthi22c,2022,ICML
Iterative Hard Thresholding with Adaptive Regularization: Sparser Solutions Without Sacrificing Runtime,"Kyriakos Axiotis, Maxim Sviridenko",N/A (摘要需访问详情页),https://proceedings.mlr.press/v162/axiotis22a/axiotis22a.pdf,https://proceedings.mlr.press/v162/axiotis22a.html,axiotis22a,2022,ICML
Proving Theorems using Incremental Learning and Hindsight Experience Replay,"Eser Aygün, Ankit Anand, Laurent Orseau, Xavier Glorot, Stephen M Mcaleer, Vlad Firoiu, Lei M Zhang, Doina Precup, Shibl Mourad",N/A (摘要需访问详情页),https://proceedings.mlr.press/v162/aygun22a/aygun22a.pdf,https://proceedings.mlr.press/v162/aygun22a.html,aygun22a,2022,ICML
Near-optimal rate of consistency for linear models with missing values,"Alexis Ayme, Claire Boyer, Aymeric Dieuleveut, Erwan Scornet",N/A (摘要需访问详情页),https://proceedings.mlr.press/v162/ayme22a/ayme22a.pdf,https://proceedings.mlr.press/v162/ayme22a.html,ayme22a,2022,ICML
How Tempering Fixes Data Augmentation in Bayesian Neural Networks,"Gregor Bachmann, Lorenzo Noci, Thomas Hofmann",N/A (摘要需访问详情页),https://proceedings.mlr.press/v162/bachmann22a/bachmann22a.pdf,https://proceedings.mlr.press/v162/bachmann22a.html,bachmann22a,2022,ICML
ASAP.SGD: Instance-based Adaptiveness to Staleness in Asynchronous SGD,"Karl Bäckström, Marina Papatriantafilou, Philippas Tsigas",N/A (摘要需访问详情页),https://proceedings.mlr.press/v162/backstrom22a/backstrom22a.pdf,https://proceedings.mlr.press/v162/backstrom22a.html,backstrom22a,2022,ICML
From Noisy Prediction to True Label: Noisy Prediction Calibration via Generative Model,"Heesun Bae, Seungjae Shin, Byeonghu Na, Joonho Jang, Kyungwoo Song, Il-Chul Moon",N/A (摘要需访问详情页),https://proceedings.mlr.press/v162/bae22a/bae22a.pdf,https://proceedings.mlr.press/v162/bae22a.html,bae22a,2022,ICML
"data2vec: A General Framework for Self-supervised Learning in Speech, Vision and Language","Alexei Baevski, Wei-Ning Hsu, Qiantong Xu, Arun Babu, Jiatao Gu, Michael Auli",N/A (摘要需访问详情页),https://proceedings.mlr.press/v162/baevski22a/baevski22a.pdf,https://proceedings.mlr.press/v162/baevski22a.html,baevski22a,2022,ICML
End-to-End Balancing for Causal Continuous Treatment-Effect Estimation,"Taha Bahadori, Eric Tchetgen Tchetgen, David Heckerman",N/A (摘要需访问详情页),https://proceedings.mlr.press/v162/bahadori22a/bahadori22a.pdf,https://proceedings.mlr.press/v162/bahadori22a.html,bahadori22a,2022,ICML
A Hierarchical Transitive-Aligned Graph Kernel for Un-attributed Graphs,"Lu Bai, Lixin Cui, Hancock Edwin",N/A (摘要需访问详情页),https://proceedings.mlr.press/v162/bai22a/bai22a.pdf,https://proceedings.mlr.press/v162/bai22a.html,bai22a,2022,ICML
Near-Optimal Learning of Extensive-Form Games with Imperfect Information,"Yu Bai, Chi Jin, Song Mei, Tiancheng Yu",N/A (摘要需访问详情页),https://proceedings.mlr.press/v162/bai22b/bai22b.pdf,https://proceedings.mlr.press/v162/bai22b.html,bai22b,2022,ICML
Gaussian Mixture Variational Autoencoder with Contrastive Learning for Multi-Label Classification,"Junwen Bai, Shufeng Kong, Carla P Gomes",N/A (摘要需访问详情页),https://proceedings.mlr.press/v162/bai22c/bai22c.pdf,https://proceedings.mlr.press/v162/bai22c.html,bai22c,2022,ICML
A$^3$T: Alignment-Aware Acoustic and Text Pretraining for Speech Synthesis and Editing,"He Bai, Renjie Zheng, Junkun Chen, Mingbo Ma, Xintong Li, Liang Huang",N/A (摘要需访问详情页),https://proceedings.mlr.press/v162/bai22d/bai22d.pdf,https://proceedings.mlr.press/v162/bai22d.html,bai22d,2022,ICML
Stability Based Generalization Bounds for Exponential Family Langevin Dynamics,"Arindam Banerjee, Tiancong Chen, Xinyan Li, Yingxue Zhou",N/A (摘要需访问详情页),https://proceedings.mlr.press/v162/banerjee22a/banerjee22a.pdf,https://proceedings.mlr.press/v162/banerjee22a.html,banerjee22a,2022,ICML
Certified Neural Network Watermarks with Randomized Smoothing,"Arpit Bansal, Ping-Yeh Chiang, Michael J Curry, Rajiv Jain, Curtis Wigington, Varun Manjunatha, John P Dickerson, Tom Goldstein",N/A (摘要需访问详情页),https://proceedings.mlr.press/v162/bansal22a/bansal22a.pdf,https://proceedings.mlr.press/v162/bansal22a.html,bansal22a,2022,ICML
Data Scaling Laws in NMT: The Effect of Noise and Architecture,"Yamini Bansal, Behrooz Ghorbani, Ankush Garg, Biao Zhang, Colin Cherry, Behnam Neyshabur, Orhan Firat",N/A (摘要需访问详情页),https://proceedings.mlr.press/v162/bansal22b/bansal22b.pdf,https://proceedings.mlr.press/v162/bansal22b.html,bansal22b,2022,ICML
Learning Stable Classifiers by Transferring Unstable Features,"Yujia Bao, Shiyu Chang, Dr.Regina Barzilay",N/A (摘要需访问详情页),https://proceedings.mlr.press/v162/bao22a/bao22a.pdf,https://proceedings.mlr.press/v162/bao22a.html,bao22a,2022,ICML
Fast Composite Optimization and Statistical Recovery in Federated Learning,"Yajie Bao, Michael Crawshaw, Shan Luo, Mingrui Liu",N/A (摘要需访问详情页),https://proceedings.mlr.press/v162/bao22b/bao22b.pdf,https://proceedings.mlr.press/v162/bao22b.html,bao22b,2022,ICML
Generative Modeling for Multi-task Visual Learning,"Zhipeng Bao, Martial Hebert, Yu-Xiong Wang",N/A (摘要需访问详情页),https://proceedings.mlr.press/v162/bao22c/bao22c.pdf,https://proceedings.mlr.press/v162/bao22c.html,bao22c,2022,ICML
Estimating the Optimal Covariance with Imperfect Mean in Diffusion Probabilistic Models,"Fan Bao, Chongxuan Li, Jiacheng Sun, Jun Zhu, Bo Zhang",N/A (摘要需访问详情页),https://proceedings.mlr.press/v162/bao22d/bao22d.pdf,https://proceedings.mlr.press/v162/bao22d.html,bao22d,2022,ICML
On the Surrogate Gap between Contrastive and Supervised Losses,"Han Bao, Yoshihiro Nagano, Kento Nozawa",N/A (摘要需访问详情页),https://proceedings.mlr.press/v162/bao22e/bao22e.pdf,https://proceedings.mlr.press/v162/bao22e.html,bao22e,2022,ICML
Representation Topology Divergence: A Method for Comparing Neural Network Representations.,"Serguei Barannikov, Ilya Trofimov, Nikita Balabin, Evgeny Burnaev",N/A (摘要需访问详情页),https://proceedings.mlr.press/v162/barannikov22a/barannikov22a.pdf,https://proceedings.mlr.press/v162/barannikov22a.html,barannikov22a,2022,ICML
Sparse Mixed Linear Regression with Guarantees: Taming an Intractable Problem with Invex Relaxation,"Adarsh Barik, Jean Honorio",N/A (摘要需访问详情页),https://proceedings.mlr.press/v162/barik22a/barik22a.pdf,https://proceedings.mlr.press/v162/barik22a.html,barik22a,2022,ICML
Neural Fisher Discriminant Analysis: Optimal Neural Network Embeddings in Polynomial Time,"Burak Bartan, Mert Pilanci",N/A (摘要需访问详情页),https://proceedings.mlr.press/v162/bartan22a/bartan22a.pdf,https://proceedings.mlr.press/v162/bartan22a.html,bartan22a,2022,ICML
Fictitious Play and Best-Response Dynamics in Identical Interest and Zero-Sum Stochastic Games,"Lucas Baudin, Rida Laraki",N/A (摘要需访问详情页),https://proceedings.mlr.press/v162/baudin22a/baudin22a.pdf,https://proceedings.mlr.press/v162/baudin22a.html,baudin22a,2022,ICML
Information Discrepancy in Strategic Learning,"Yahav Bechavod, Chara Podimata, Steven Wu, Juba Ziani",N/A (摘要需访问详情页),https://proceedings.mlr.press/v162/bechavod22a/bechavod22a.pdf,https://proceedings.mlr.press/v162/bechavod22a.html,bechavod22a,2022,ICML
On the Hidden Biases of Policy Mirror Ascent in Continuous Action Spaces,"Amrit Singh Bedi, Souradip Chakraborty, Anjaly Parayil, Brian M Sadler, Pratap Tokekar, Alec Koppel",N/A (摘要需访问详情页),https://proceedings.mlr.press/v162/bedi22a/bedi22a.pdf,https://proceedings.mlr.press/v162/bedi22a.html,bedi22a,2022,ICML
Imitation Learning by Estimating Expertise of Demonstrators,"Mark Beliaev, Andy Shih, Stefano Ermon, Dorsa Sadigh, Ramtin Pedarsani",N/A (摘要需访问详情页),https://proceedings.mlr.press/v162/beliaev22a/beliaev22a.pdf,https://proceedings.mlr.press/v162/beliaev22a.html,beliaev22a,2022,ICML
Matching Normalizing Flows and Probability Paths on Manifolds,"Heli Ben-Hamu, Samuel Cohen, Joey Bose, Brandon Amos, Maximillian Nickel, Aditya Grover, Ricky T. Q. Chen, Yaron Lipman",N/A (摘要需访问详情页),https://proceedings.mlr.press/v162/ben-hamu22a/ben-hamu22a.pdf,https://proceedings.mlr.press/v162/ben-hamu22a.html,ben-hamu22a,2022,ICML
Stochastic Contextual Dueling Bandits under Linear Stochastic Transitivity Models,"Viktor Bengs, Aadirupa Saha, Eyke Hüllermeier",N/A (摘要需访问详情页),https://proceedings.mlr.press/v162/bengs22a/bengs22a.pdf,https://proceedings.mlr.press/v162/bengs22a.html,bengs22a,2022,ICML
Neural Inverse Kinematic,"Raphael Bensadoun, Shir Gur, Nitsan Blau, Lior Wolf",N/A (摘要需访问详情页),https://proceedings.mlr.press/v162/bensadoun22a/bensadoun22a.pdf,https://proceedings.mlr.press/v162/bensadoun22a.html,bensadoun22a,2022,ICML
Volatility Based Kernels and Moving Average Means for Accurate Forecasting with Gaussian Processes,"Gregory Benton, Wesley Maddox, Andrew Gordon Wilson",N/A (摘要需访问详情页),https://proceedings.mlr.press/v162/benton22a/benton22a.pdf,https://proceedings.mlr.press/v162/benton22a.html,benton22a,2022,ICML
Gradient Descent on Neurons and its Link to Approximate Second-order Optimization,Frederik Benzing,N/A (摘要需访问详情页),https://proceedings.mlr.press/v162/benzing22a/benzing22a.pdf,https://proceedings.mlr.press/v162/benzing22a.html,benzing22a,2022,ICML
Safe Learning in Tree-Form Sequential Decision Making: Handling Hard and Soft Constraints,"Martino Bernasconi, Federico Cacciamani, Matteo Castiglioni, Alberto Marchesi, Nicola Gatti, Francesco Trovò",N/A (摘要需访问详情页),https://proceedings.mlr.press/v162/bernasconi22a/bernasconi22a.pdf,https://proceedings.mlr.press/v162/bernasconi22a.html,bernasconi22a,2022,ICML
Skin Deep Unlearning: Artefact and Instrument Debiasing in the Context of Melanoma Classification,"Peter Bevan, Amir Atapour-Abarghouei",N/A (摘要需访问详情页),https://proceedings.mlr.press/v162/bevan22a/bevan22a.pdf,https://proceedings.mlr.press/v162/bevan22a.html,bevan22a,2022,ICML
Approximate Bayesian Computation with Domain Expert in the Loop,"Ayush Bharti, Louis Filstroff, Samuel Kaski",N/A (摘要需访问详情页),https://proceedings.mlr.press/v162/bharti22a/bharti22a.pdf,https://proceedings.mlr.press/v162/bharti22a.html,bharti22a,2022,ICML
Minimax M-estimation under Adversarial Contamination,"Sujay Bhatt, Guanhua Fang, Ping Li, Gennady Samorodnitsky",N/A (摘要需访问详情页),https://proceedings.mlr.press/v162/bhatt22a/bhatt22a.pdf,https://proceedings.mlr.press/v162/bhatt22a.html,bhatt22a,2022,ICML
Nearly Optimal Catoni’s M-estimator for Infinite Variance,"Sujay Bhatt, Guanhua Fang, Ping Li, Gennady Samorodnitsky",N/A (摘要需访问详情页),https://proceedings.mlr.press/v162/bhatt22b/bhatt22b.pdf,https://proceedings.mlr.press/v162/bhatt22b.html,bhatt22b,2022,ICML
Personalization Improves Privacy-Accuracy Tradeoffs in Federated Learning,"Alberto Bietti, Chen-Yu Wei, Miroslav Dudik, John Langford, Steven Wu",N/A (摘要需访问详情页),https://proceedings.mlr.press/v162/bietti22a/bietti22a.pdf,https://proceedings.mlr.press/v162/bietti22a.html,bietti22a,2022,ICML
Non-Vacuous Generalisation Bounds for Shallow Neural Networks,"Felix Biggs, Benjamin Guedj",N/A (摘要需访问详情页),https://proceedings.mlr.press/v162/biggs22a/biggs22a.pdf,https://proceedings.mlr.press/v162/biggs22a.html,biggs22a,2022,ICML
