title,authors,abstract,pdf_url,source_url,id,year,conference
Leveraging Approximate Symbolic Models for Reinforcement Learning via Skill Diversity,"Lin Guan, Sarath Sreedharan, Subbarao Kambhampati",N/A (摘要需访问详情页),https://proceedings.mlr.press/v162/guan22c/guan22c.pdf,https://proceedings.mlr.press/v162/guan22c.html,guan22c,2022,ICML
Large-Scale Graph Neural Architecture Search,"Chaoyu Guan, Xin Wang, Hong Chen, Ziwei Zhang, Wenwu Zhu",N/A (摘要需访问详情页),https://proceedings.mlr.press/v162/guan22d/guan22d.pdf,https://proceedings.mlr.press/v162/guan22d.html,guan22d,2022,ICML
Identifiability Conditions for Domain Adaptation,"Ishaan Gulrajani, Tatsunori Hashimoto",N/A (摘要需访问详情页),https://proceedings.mlr.press/v162/gulrajani22a/gulrajani22a.pdf,https://proceedings.mlr.press/v162/gulrajani22a.html,gulrajani22a,2022,ICML
A Parametric Class of Approximate Gradient Updates for Policy Optimization,"Ramki Gummadi, Saurabh Kumar, Junfeng Wen, Dale Schuurmans",N/A (摘要需访问详情页),https://proceedings.mlr.press/v162/gummadi22a/gummadi22a.pdf,https://proceedings.mlr.press/v162/gummadi22a.html,gummadi22a,2022,ICML
Provably Efficient Offline Reinforcement Learning for Partially Observable Markov Decision Processes,"Hongyi Guo, Qi Cai, Yufeng Zhang, Zhuoran Yang, Zhaoran Wang",N/A (摘要需访问详情页),https://proceedings.mlr.press/v162/guo22a/guo22a.pdf,https://proceedings.mlr.press/v162/guo22a.html,guo22a,2022,ICML
No-Regret Learning in Partially-Informed Auctions,"Wenshuo Guo, Michael Jordan, Ellen Vitercik",N/A (摘要需访问详情页),https://proceedings.mlr.press/v162/guo22b/guo22b.pdf,https://proceedings.mlr.press/v162/guo22b.html,guo22b,2022,ICML
Bounding Training Data Reconstruction in Private (Deep) Learning,"Chuan Guo, Brian Karrer, Kamalika Chaudhuri, Laurens van der Maaten",N/A (摘要需访问详情页),https://proceedings.mlr.press/v162/guo22c/guo22c.pdf,https://proceedings.mlr.press/v162/guo22c.html,guo22c,2022,ICML
Adversarially trained neural representations are already as robust as biological neural representations,"Chong Guo, Michael Lee, Guillaume Leclerc, Joel Dapello, Yug Rao, Aleksander Madry, James Dicarlo",N/A (摘要需访问详情页),https://proceedings.mlr.press/v162/guo22d/guo22d.pdf,https://proceedings.mlr.press/v162/guo22d.html,guo22d,2022,ICML
Class-Imbalanced Semi-Supervised Learning with Adaptive Thresholding,"Lan-Zhe Guo, Yu-Feng Li",N/A (摘要需访问详情页),https://proceedings.mlr.press/v162/guo22e/guo22e.pdf,https://proceedings.mlr.press/v162/guo22e.html,guo22e,2022,ICML
Deep Squared Euclidean Approximation to the Levenshtein Distance for DNA Storage,"Alan J.X. Guo, Cong Liang, Qing-Hu Hou",N/A (摘要需访问详情页),https://proceedings.mlr.press/v162/guo22f/guo22f.pdf,https://proceedings.mlr.press/v162/guo22f.html,guo22f,2022,ICML
Online Continual Learning through Mutual Information Maximization,"Yiduo Guo, Bing Liu, Dongyan Zhao",N/A (摘要需访问详情页),https://proceedings.mlr.press/v162/guo22g/guo22g.pdf,https://proceedings.mlr.press/v162/guo22g.html,guo22g,2022,ICML
Fast Provably Robust Decision Trees and Boosting,"Jun-Qi Guo, Ming-Zhuo Teng, Wei Gao, Zhi-Hua Zhou",N/A (摘要需访问详情页),https://proceedings.mlr.press/v162/guo22h/guo22h.pdf,https://proceedings.mlr.press/v162/guo22h.html,guo22h,2022,ICML
Understanding and Improving Knowledge Graph Embedding for Entity Alignment,"Lingbing Guo, Qiang Zhang, Zequn Sun, Mingyang Chen, Wei Hu, Huajun Chen",N/A (摘要需访问详情页),https://proceedings.mlr.press/v162/guo22i/guo22i.pdf,https://proceedings.mlr.press/v162/guo22i.html,guo22i,2022,ICML
NISPA: Neuro-Inspired Stability-Plasticity Adaptation for Continual Learning in Sparse Networks,"Mustafa B Gurbuz, Constantine Dovrolis",N/A (摘要需访问详情页),https://proceedings.mlr.press/v162/gurbuz22a/gurbuz22a.pdf,https://proceedings.mlr.press/v162/gurbuz22a.html,gurbuz22a,2022,ICML
Active Learning on a Budget: Opposite Strategies Suit High and Low Budgets,"Guy Hacohen, Avihu Dekel, Daphna Weinshall",N/A (摘要需访问详情页),https://proceedings.mlr.press/v162/hacohen22a/hacohen22a.pdf,https://proceedings.mlr.press/v162/hacohen22a.html,hacohen22a,2022,ICML
You Only Cut Once: Boosting Data Augmentation with a Single Cut,"Junlin Han, Pengfei Fang, Weihao Li, Jie Hong, Mohammad Ali Armin, Ian Reid, Lars Petersson, Hongdong Li",N/A (摘要需访问详情页),https://proceedings.mlr.press/v162/han22a/han22a.pdf,https://proceedings.mlr.press/v162/han22a.html,han22a,2022,ICML
Scalable MCMC Sampling for Nonsymmetric Determinantal Point Processes,"Insu Han, Mike Gartrell, Elvis Dohmatob, Amin Karbasi",N/A (摘要需访问详情页),https://proceedings.mlr.press/v162/han22b/han22b.pdf,https://proceedings.mlr.press/v162/han22b.html,han22b,2022,ICML
G-Mixup: Graph Data Augmentation for Graph Classification,"Xiaotian Han, Zhimeng Jiang, Ninghao Liu, Xia Hu",N/A (摘要需访问详情页),https://proceedings.mlr.press/v162/han22c/han22c.pdf,https://proceedings.mlr.press/v162/han22c.html,han22c,2022,ICML
Private Streaming SCO in $\ell_p$ geometry with Applications in High Dimensional Online Decision Making,"Yuxuan Han, Zhicong Liang, Zhipeng Liang, Yang Wang, Yuan Yao, Jiheng Zhang",N/A (摘要需访问详情页),https://proceedings.mlr.press/v162/han22d/han22d.pdf,https://proceedings.mlr.press/v162/han22d.html,han22d,2022,ICML
Off-Policy Reinforcement Learning with Delayed Rewards,"Beining Han, Zhizhou Ren, Zuofan Wu, Yuan Zhou, Jian Peng",N/A (摘要需访问详情页),https://proceedings.mlr.press/v162/han22e/han22e.pdf,https://proceedings.mlr.press/v162/han22e.html,han22e,2022,ICML
Adversarial Attacks on Gaussian Process Bandits,"Eric Han, Jonathan Scarlett",N/A (摘要需访问详情页),https://proceedings.mlr.press/v162/han22f/han22f.pdf,https://proceedings.mlr.press/v162/han22f.html,han22f,2022,ICML
Random Gegenbauer Features for Scalable Kernel Methods,"Insu Han, Amir Zandieh, Haim Avron",N/A (摘要需访问详情页),https://proceedings.mlr.press/v162/han22g/han22g.pdf,https://proceedings.mlr.press/v162/han22g.html,han22g,2022,ICML
Stochastic Reweighted Gradient Descent,"Ayoub El Hanchi, David Stephens, Chris Maddison",N/A (摘要需访问详情页),https://proceedings.mlr.press/v162/hanchi22a/hanchi22a.pdf,https://proceedings.mlr.press/v162/hanchi22a.html,hanchi22a,2022,ICML
Dual Perspective of Label-Specific Feature Learning for Multi-Label Classification,"Jun-Yi Hang, Min-Ling Zhang",N/A (摘要需访问详情页),https://proceedings.mlr.press/v162/hang22a/hang22a.pdf,https://proceedings.mlr.press/v162/hang22a.html,hang22a,2022,ICML
Temporal Difference Learning for Model Predictive Control,"Nicklas A Hansen, Hao Su, Xiaolong Wang",N/A (摘要需访问详情页),https://proceedings.mlr.press/v162/hansen22a/hansen22a.pdf,https://proceedings.mlr.press/v162/hansen22a.html,hansen22a,2022,ICML
Bisimulation Makes Analogies in Goal-Conditioned Reinforcement Learning,"Philippe Hansen-Estruch, Amy Zhang, Ashvin Nair, Patrick Yin, Sergey Levine",N/A (摘要需访问详情页),https://proceedings.mlr.press/v162/hansen-estruch22a/hansen-estruch22a.pdf,https://proceedings.mlr.press/v162/hansen-estruch22a.html,hansen-estruch22a,2022,ICML
"TURF: Two-Factor, Universal, Robust, Fast Distribution Learning Algorithm","Yi Hao, Ayush Jain, Alon Orlitsky, Vaishakh Ravindrakumar",N/A (摘要需访问详情页),https://proceedings.mlr.press/v162/hao22a/hao22a.pdf,https://proceedings.mlr.press/v162/hao22a.html,hao22a,2022,ICML
Contextual Information-Directed Sampling,"Botao Hao, Tor Lattimore, Chao Qin",N/A (摘要需访问详情页),https://proceedings.mlr.press/v162/hao22b/hao22b.pdf,https://proceedings.mlr.press/v162/hao22b.html,hao22b,2022,ICML
GSmooth: Certified Robustness against Semantic Transformations via Generalized Randomized Smoothing,"Zhongkai Hao, Chengyang Ying, Yinpeng Dong, Hang Su, Jian Song, Jun Zhu",N/A (摘要需访问详情页),https://proceedings.mlr.press/v162/hao22c/hao22c.pdf,https://proceedings.mlr.press/v162/hao22c.html,hao22c,2022,ICML
Implicit Regularization with Polynomial Growth in Deep Tensor Factorization,"Kais Hariz, Hachem Kadri, Stephane Ayache, Maher Moakher, Thierry Artieres",N/A (摘要需访问详情页),https://proceedings.mlr.press/v162/hariz22a/hariz22a.pdf,https://proceedings.mlr.press/v162/hariz22a.html,hariz22a,2022,ICML
Strategic Instrumental Variable Regression: Recovering Causal Relationships From Strategic Responses,"Keegan Harris, Dung Daniel T Ngo, Logan Stapleton, Hoda Heidari, Steven Wu",N/A (摘要需访问详情页),https://proceedings.mlr.press/v162/harris22a/harris22a.pdf,https://proceedings.mlr.press/v162/harris22a.html,harris22a,2022,ICML
C*-algebra Net: A New Approach Generalizing Neural Network Parameters to C*-algebra,"Yuka Hashimoto, Zhao Wang, Tomoko Matsui",N/A (摘要需访问详情页),https://proceedings.mlr.press/v162/hashimoto22a/hashimoto22a.pdf,https://proceedings.mlr.press/v162/hashimoto22a.html,hashimoto22a,2022,ICML
"General-purpose, long-context autoregressive modeling with Perceiver AR","Curtis Hawthorne, Andrew Jaegle, Cătălina Cangea, Sebastian Borgeaud, Charlie Nash, Mateusz Malinowski, Sander Dieleman, Oriol Vinyals, Matthew Botvinick, Ian Simon, Hannah Sheahan, Neil Zeghidour, Jean-Baptiste Alayrac, Joao Carreira, Jesse Engel",N/A (摘要需访问详情页),https://proceedings.mlr.press/v162/hawthorne22a/hawthorne22a.pdf,https://proceedings.mlr.press/v162/hawthorne22a.html,hawthorne22a,2022,ICML
On Distribution Shift in Learning-based Bug Detectors,"Jingxuan He, Luca Beurer-Kellner, Martin Vechev",N/A (摘要需访问详情页),https://proceedings.mlr.press/v162/he22a/he22a.pdf,https://proceedings.mlr.press/v162/he22a.html,he22a,2022,ICML
GNNRank: Learning Global Rankings from Pairwise Comparisons via Directed Graph Neural Networks,"Yixuan He, Quan Gan, David Wipf, Gesine D Reinert, Junchi Yan, Mihai Cucuringu",N/A (摘要需访问详情页),https://proceedings.mlr.press/v162/he22b/he22b.pdf,https://proceedings.mlr.press/v162/he22b.html,he22b,2022,ICML
Exploring the Gap between Collapsed & Whitened Features in Self-Supervised Learning,"Bobby He, Mete Ozay",N/A (摘要需访问详情页),https://proceedings.mlr.press/v162/he22c/he22c.pdf,https://proceedings.mlr.press/v162/he22c.html,he22c,2022,ICML
Sparse Double Descent: Where Network Pruning Aggravates Overfitting,"Zheng He, Zeke Xie, Quanzhi Zhu, Zengchang Qin",N/A (摘要需访问详情页),https://proceedings.mlr.press/v162/he22d/he22d.pdf,https://proceedings.mlr.press/v162/he22d.html,he22d,2022,ICML
A Reduction from Linear Contextual Bandits Lower Bounds to Estimations Lower Bounds,"Jiahao He, Jiheng Zhang, Rachel Q. Zhang",N/A (摘要需访问详情页),https://proceedings.mlr.press/v162/he22e/he22e.pdf,https://proceedings.mlr.press/v162/he22e.html,he22e,2022,ICML
HyperPrompt: Prompt-based Task-Conditioning of Transformers,"Yun He, Steven Zheng, Yi Tay, Jai Gupta, Yu Du, Vamsi Aribandi, Zhe Zhao, Yaguang Li, Zhao Chen, Donald Metzler, Heng-Tze Cheng, Ed H. Chi",N/A (摘要需访问详情页),https://proceedings.mlr.press/v162/he22f/he22f.pdf,https://proceedings.mlr.press/v162/he22f.html,he22f,2022,ICML
Label-Descriptive Patterns and Their Application to Characterizing Classification Errors,"Michael A. Hedderich, Jonas Fischer, Dietrich Klakow, Jilles Vreeken",N/A (摘要需访问详情页),https://proceedings.mlr.press/v162/hedderich22a/hedderich22a.pdf,https://proceedings.mlr.press/v162/hedderich22a.html,hedderich22a,2022,ICML
NOMU: Neural Optimization-based Model Uncertainty,"Jakob M Heiss, Jakob Weissteiner, Hanna S Wutte, Sven Seuken, Josef Teichmann",N/A (摘要需访问详情页),https://proceedings.mlr.press/v162/heiss22a/heiss22a.pdf,https://proceedings.mlr.press/v162/heiss22a.html,heiss22a,2022,ICML
Scaling Out-of-Distribution Detection for Real-World Settings,"Dan Hendrycks, Steven Basart, Mantas Mazeika, Andy Zou, Joseph Kwon, Mohammadreza Mostajabi, Jacob Steinhardt, Dawn Song",N/A (摘要需访问详情页),https://proceedings.mlr.press/v162/hendrycks22a/hendrycks22a.pdf,https://proceedings.mlr.press/v162/hendrycks22a.html,hendrycks22a,2022,ICML
Generalization Bounds using Lower Tail Exponents in Stochastic Optimizers,"Liam Hodgkinson, Umut Simsekli, Rajiv Khanna, Michael Mahoney",N/A (摘要需访问详情页),https://proceedings.mlr.press/v162/hodgkinson22a/hodgkinson22a.pdf,https://proceedings.mlr.press/v162/hodgkinson22a.html,hodgkinson22a,2022,ICML
Unsupervised Detection of Contextualized Embedding Bias with Application to Ideology,"Valentin Hofmann, Janet Pierrehumbert, Hinrich Schütze",N/A (摘要需访问详情页),https://proceedings.mlr.press/v162/hofmann22a/hofmann22a.pdf,https://proceedings.mlr.press/v162/hofmann22a.html,hofmann22a,2022,ICML
Neural Laplace: Learning diverse classes of differential equations in the Laplace domain,"Samuel I Holt, Zhaozhi Qian, Mihaela van der Schaar",N/A (摘要需访问详情页),https://proceedings.mlr.press/v162/holt22a/holt22a.pdf,https://proceedings.mlr.press/v162/holt22a.html,holt22a,2022,ICML
Deep Hierarchy in Bandits,"Joey Hong, Branislav Kveton, Sumeet Katariya, Manzil Zaheer, Mohammad Ghavamzadeh",N/A (摘要需访问详情页),https://proceedings.mlr.press/v162/hong22a/hong22a.pdf,https://proceedings.mlr.press/v162/hong22a.html,hong22a,2022,ICML
DAdaQuant: Doubly-adaptive quantization for communication-efficient Federated Learning,"Robert Hönig, Yiren Zhao, Robert Mullins",N/A (摘要需访问详情页),https://proceedings.mlr.press/v162/honig22a/honig22a.pdf,https://proceedings.mlr.press/v162/honig22a.html,honig22a,2022,ICML
Equivariant Diffusion for Molecule Generation in 3D,"Emiel Hoogeboom, Vı́ctor Garcia Satorras, Clément Vignac, Max Welling",N/A (摘要需访问详情页),https://proceedings.mlr.press/v162/hoogeboom22a/hoogeboom22a.pdf,https://proceedings.mlr.press/v162/hoogeboom22a.html,hoogeboom22a,2022,ICML
Conditional GANs with Auxiliary Discriminative Classifier,"Liang Hou, Qi Cao, Huawei Shen, Siyuan Pan, Xiaoshuang Li, Xueqi Cheng",N/A (摘要需访问详情页),https://proceedings.mlr.press/v162/hou22a/hou22a.pdf,https://proceedings.mlr.press/v162/hou22a.html,hou22a,2022,ICML
AdAUC: End-to-end Adversarial AUC Optimization Against Long-tail Problems,"Wenzheng Hou, Qianqian Xu, Zhiyong Yang, Shilong Bao, Yuan He, Qingming Huang",N/A (摘要需访问详情页),https://proceedings.mlr.press/v162/hou22b/hou22b.pdf,https://proceedings.mlr.press/v162/hou22b.html,hou22b,2022,ICML
Wide Bayesian neural networks have a simple weight posterior: theory and accelerated sampling,"Jiri Hron, Roman Novak, Jeffrey Pennington, Jascha Sohl-Dickstein",N/A (摘要需访问详情页),https://proceedings.mlr.press/v162/hron22a/hron22a.pdf,https://proceedings.mlr.press/v162/hron22a.html,hron22a,2022,ICML
Learning inverse folding from millions of predicted structures,"Chloe Hsu, Robert Verkuil, Jason Liu, Zeming Lin, Brian Hie, Tom Sercu, Adam Lerer, Alexander Rives",N/A (摘要需访问详情页),https://proceedings.mlr.press/v162/hsu22a/hsu22a.pdf,https://proceedings.mlr.press/v162/hsu22a.html,hsu22a,2022,ICML
Nearly Minimax Optimal Reinforcement Learning with Linear Function Approximation,"Pihe Hu, Yu Chen, Longbo Huang",N/A (摘要需访问详情页),https://proceedings.mlr.press/v162/hu22a/hu22a.pdf,https://proceedings.mlr.press/v162/hu22a.html,hu22a,2022,ICML
Neuron Dependency Graphs: A Causal Abstraction of Neural Networks,"Yaojie Hu, Jin Tian",N/A (摘要需访问详情页),https://proceedings.mlr.press/v162/hu22b/hu22b.pdf,https://proceedings.mlr.press/v162/hu22b.html,hu22b,2022,ICML
Policy Diagnosis via Measuring Role Diversity in Cooperative Multi-agent RL,"Siyi Hu, Chuanlong Xie, Xiaodan Liang, Xiaojun Chang",N/A (摘要需访问详情页),https://proceedings.mlr.press/v162/hu22c/hu22c.pdf,https://proceedings.mlr.press/v162/hu22c.html,hu22c,2022,ICML
On the Role of Discount Factor in Offline Reinforcement Learning,"Hao Hu, Yiqin Yang, Qianchuan Zhao, Chongjie Zhang",N/A (摘要需访问详情页),https://proceedings.mlr.press/v162/hu22d/hu22d.pdf,https://proceedings.mlr.press/v162/hu22d.html,hu22d,2022,ICML
Transformer Quality in Linear Time,"Weizhe Hua, Zihang Dai, Hanxiao Liu, Quoc Le",N/A (摘要需访问详情页),https://proceedings.mlr.press/v162/hua22a/hua22a.pdf,https://proceedings.mlr.press/v162/hua22a.html,hua22a,2022,ICML
Language Models as Zero-Shot Planners: Extracting Actionable Knowledge for Embodied Agents,"Wenlong Huang, Pieter Abbeel, Deepak Pathak, Igor Mordatch",N/A (摘要需访问详情页),https://proceedings.mlr.press/v162/huang22a/huang22a.pdf,https://proceedings.mlr.press/v162/huang22a.html,huang22a,2022,ICML
Forward Operator Estimation in Generative Models with Kernel Transfer Operators,"Zhichun Huang, Rudrasis Chakraborty, Vikas Singh",N/A (摘要需访问详情页),https://proceedings.mlr.press/v162/huang22b/huang22b.pdf,https://proceedings.mlr.press/v162/huang22b.html,huang22b,2022,ICML
Adaptive Best-of-Both-Worlds Algorithm for Heavy-Tailed Multi-Armed Bandits,"Jiatai Huang, Yan Dai, Longbo Huang",N/A (摘要需访问详情页),https://proceedings.mlr.press/v162/huang22c/huang22c.pdf,https://proceedings.mlr.press/v162/huang22c.html,huang22c,2022,ICML
Frustratingly Easy Transferability Estimation,"Long-Kai Huang, Junzhou Huang, Yu Rong, Qiang Yang, Ying Wei",N/A (摘要需访问详情页),https://proceedings.mlr.press/v162/huang22d/huang22d.pdf,https://proceedings.mlr.press/v162/huang22d.html,huang22d,2022,ICML
Modality Competition: What Makes Joint Training of Multi-modal Network Fail in Deep Learning? (Provably),"Yu Huang, Junyang Lin, Chang Zhou, Hongxia Yang, Longbo Huang",N/A (摘要需访问详情页),https://proceedings.mlr.press/v162/huang22e/huang22e.pdf,https://proceedings.mlr.press/v162/huang22e.html,huang22e,2022,ICML
Action-Sufficient State Representation Learning for Control with Structural Constraints,"Biwei Huang, Chaochao Lu, Liu Leqi, Jose Miguel Hernandez-Lobato, Clark Glymour, Bernhard Schölkopf, Kun Zhang",N/A (摘要需访问详情页),https://proceedings.mlr.press/v162/huang22f/huang22f.pdf,https://proceedings.mlr.press/v162/huang22f.html,huang22f,2022,ICML
3DLinker: An E(3) Equivariant Variational Autoencoder for Molecular Linker Design,"Yinan Huang, Xingang Peng, Jianzhu Ma, Muhan Zhang",N/A (摘要需访问详情页),https://proceedings.mlr.press/v162/huang22g/huang22g.pdf,https://proceedings.mlr.press/v162/huang22g.html,huang22g,2022,ICML
SDQ: Stochastic Differentiable Quantization with Mixed Precision,"Xijie Huang, Zhiqiang Shen, Shichao Li, Zechun Liu, Hu Xianghong, Jeffry Wicaksana, Eric Xing, Kwang-Ting Cheng",N/A (摘要需访问详情页),https://proceedings.mlr.press/v162/huang22h/huang22h.pdf,https://proceedings.mlr.press/v162/huang22h.html,huang22h,2022,ICML
Tackling Data Heterogeneity: A New Unified Framework for Decentralized SGD with Sample-induced Topology,"Yan Huang, Ying Sun, Zehan Zhu, Changzhi Yan, Jinming Xu",N/A (摘要需访问详情页),https://proceedings.mlr.press/v162/huang22i/huang22i.pdf,https://proceedings.mlr.press/v162/huang22i.html,huang22i,2022,ICML
Efficient Representation Learning via Adaptive Context Pooling,"Chen Huang, Walter Talbott, Navdeep Jaitly, Joshua M Susskind",N/A (摘要需访问详情页),https://proceedings.mlr.press/v162/huang22j/huang22j.pdf,https://proceedings.mlr.press/v162/huang22j.html,huang22j,2022,ICML
On the Learning of Non-Autoregressive Transformers,"Fei Huang, Tianhua Tao, Hao Zhou, Lei Li, Minlie Huang",N/A (摘要需访问详情页),https://proceedings.mlr.press/v162/huang22k/huang22k.pdf,https://proceedings.mlr.press/v162/huang22k.html,huang22k,2022,ICML
Going Deeper into Permutation-Sensitive Graph Neural Networks,"Zhongyu Huang, Yingheng Wang, Chaozhuo Li, Huiguang He",N/A (摘要需访问详情页),https://proceedings.mlr.press/v162/huang22l/huang22l.pdf,https://proceedings.mlr.press/v162/huang22l.html,huang22l,2022,ICML
Directed Acyclic Transformer for Non-Autoregressive Machine Translation,"Fei Huang, Hao Zhou, Yang Liu, Hang Li, Minlie Huang",N/A (摘要需访问详情页),https://proceedings.mlr.press/v162/huang22m/huang22m.pdf,https://proceedings.mlr.press/v162/huang22m.html,huang22m,2022,ICML
Unsupervised Ground Metric Learning Using Wasserstein Singular Vectors,"Geert-Jan Huizing, Laura Cantini, Gabriel Peyré",N/A (摘要需访问详情页),https://proceedings.mlr.press/v162/huizing22a/huizing22a.pdf,https://proceedings.mlr.press/v162/huizing22a.html,huizing22a,2022,ICML
Robust Kernel Density Estimation with Median-of-Means principle,"Pierre Humbert, Batiste Le Bars, Ludovic Minvielle",N/A (摘要需访问详情页),https://proceedings.mlr.press/v162/humbert22a/humbert22a.pdf,https://proceedings.mlr.press/v162/humbert22a.html,humbert22a,2022,ICML
A data-driven approach for learning to control computers,"Peter C Humphreys, David Raposo, Tobias Pohlen, Gregory Thornton, Rachita Chhaparia, Alistair Muldal, Josh Abramson, Petko Georgiev, Adam Santoro, Timothy Lillicrap",N/A (摘要需访问详情页),https://proceedings.mlr.press/v162/humphreys22a/humphreys22a.pdf,https://proceedings.mlr.press/v162/humphreys22a.html,humphreys22a,2022,ICML
Proximal Denoiser for Convergent Plug-and-Play Optimization with Nonconvex Regularization,"Samuel Hurault, Arthur Leclaire, Nicolas Papadakis",N/A (摘要需访问详情页),https://proceedings.mlr.press/v162/hurault22a/hurault22a.pdf,https://proceedings.mlr.press/v162/hurault22a.html,hurault22a,2022,ICML
Inverse Contextual Bandits: Learning How Behavior Evolves over Time,"Alihan Hüyük, Daniel Jarrett, Mihaela van der Schaar",N/A (摘要需访问详情页),https://proceedings.mlr.press/v162/huyuk22a/huyuk22a.pdf,https://proceedings.mlr.press/v162/huyuk22a.html,huyuk22a,2022,ICML
Datamodels: Understanding Predictions with Data and Data with Predictions,"Andrew Ilyas, Sung Min Park, Logan Engstrom, Guillaume Leclerc, Aleksander Madry",N/A (摘要需访问详情页),https://proceedings.mlr.press/v162/ilyas22a/ilyas22a.pdf,https://proceedings.mlr.press/v162/ilyas22a.html,ilyas22a,2022,ICML
Parsimonious Learning-Augmented Caching,"Sungjin Im, Ravi Kumar, Aditya Petety, Manish Purohit",N/A (摘要需访问详情页),https://proceedings.mlr.press/v162/im22a/im22a.pdf,https://proceedings.mlr.press/v162/im22a.html,im22a,2022,ICML
Bayesian Optimization for Distributionally Robust Chance-constrained Problem,"Yu Inatsu, Shion Takeno, Masayuki Karasuyama, Ichiro Takeuchi",N/A (摘要需访问详情页),https://proceedings.mlr.press/v162/inatsu22a/inatsu22a.pdf,https://proceedings.mlr.press/v162/inatsu22a.html,inatsu22a,2022,ICML
LeNSE: Learning To Navigate Subgraph Embeddings for Large-Scale Combinatorial Optimisation,"David Ireland, Giovanni Montana",N/A (摘要需访问详情页),https://proceedings.mlr.press/v162/ireland22a/ireland22a.pdf,https://proceedings.mlr.press/v162/ireland22a.html,ireland22a,2022,ICML
The Dual Form of Neural Networks Revisited: Connecting Test Time Predictions to Training Patterns via Spotlights of Attention,"Kazuki Irie, Róbert Csordás, Jürgen Schmidhuber",N/A (摘要需访问详情页),https://proceedings.mlr.press/v162/irie22a/irie22a.pdf,https://proceedings.mlr.press/v162/irie22a.html,irie22a,2022,ICML
A Modern Self-Referential Weight Matrix That Learns to Modify Itself,"Kazuki Irie, Imanol Schlag, Róbert Csordás, Jürgen Schmidhuber",N/A (摘要需访问详情页),https://proceedings.mlr.press/v162/irie22b/irie22b.pdf,https://proceedings.mlr.press/v162/irie22b.html,irie22b,2022,ICML
"Revisiting Online Submodular Minimization: Gap-Dependent Regret Bounds, Best of Both Worlds and Adversarial Robustness",Shinji Ito,N/A (摘要需访问详情页),https://proceedings.mlr.press/v162/ito22a/ito22a.pdf,https://proceedings.mlr.press/v162/ito22a.html,ito22a,2022,ICML
Modeling Strong and Human-Like Gameplay with KL-Regularized Search,"Athul Paul Jacob, David J Wu, Gabriele Farina, Adam Lerer, Hengyuan Hu, Anton Bakhtin, Jacob Andreas, Noam Brown",N/A (摘要需访问详情页),https://proceedings.mlr.press/v162/jacob22a/jacob22a.pdf,https://proceedings.mlr.press/v162/jacob22a.html,jacob22a,2022,ICML
A deep convolutional neural network that is invariant to time rescaling,"Brandon G Jacques, Zoran Tiganj, Aakash Sarkar, Marc Howard, Per Sederberg",N/A (摘要需访问详情页),https://proceedings.mlr.press/v162/jacques22a/jacques22a.pdf,https://proceedings.mlr.press/v162/jacques22a.html,jacques22a,2022,ICML
Input Dependent Sparse Gaussian Processes,"Bahram Jafrasteh, Carlos Villacampa-Calvo, Daniel Hernandez-Lobato",N/A (摘要需访问详情页),https://proceedings.mlr.press/v162/jafrasteh22a/jafrasteh22a.pdf,https://proceedings.mlr.press/v162/jafrasteh22a.html,jafrasteh22a,2022,ICML
Regret Minimization with Performative Feedback,"Meena Jagadeesan, Tijana Zrnic, Celestine Mendler-Dünner",N/A (摘要需访问详情页),https://proceedings.mlr.press/v162/jagadeesan22a/jagadeesan22a.pdf,https://proceedings.mlr.press/v162/jagadeesan22a.html,jagadeesan22a,2022,ICML
Biological Sequence Design with GFlowNets,"Moksh Jain, Emmanuel Bengio, Alex Hernandez-Garcia, Jarrid Rector-Brooks, Bonaventure F. P. Dossou, Chanakya Ajit Ekbote, Jie Fu, Tianyu Zhang, Michael Kilgour, Dinghuai Zhang, Lena Simine, Payel Das, Yoshua Bengio",N/A (摘要需访问详情页),https://proceedings.mlr.press/v162/jain22a/jain22a.pdf,https://proceedings.mlr.press/v162/jain22a.html,jain22a,2022,ICML
