title,authors,abstract,pdf_url,source_url,id,year,conference
Constrained Optimization with Dynamic Bound-scaling for Effective NLP Backdoor Defense,"Guangyu Shen, Yingqi Liu, Guanhong Tao, Qiuling Xu, Zhuo Zhang, Shengwei An, Shiqing Ma, Xiangyu Zhang",N/A (摘要需访问详情页),https://proceedings.mlr.press/v162/shen22e/shen22e.pdf,https://proceedings.mlr.press/v162/shen22e.html,shen22e,2022,ICML
Staged Training for Transformer Language Models,"Sheng Shen, Pete Walsh, Kurt Keutzer, Jesse Dodge, Matthew Peters, Iz Beltagy",N/A (摘要需访问详情页),https://proceedings.mlr.press/v162/shen22f/shen22f.pdf,https://proceedings.mlr.press/v162/shen22f.html,shen22f,2022,ICML
Deep Network Approximation in Terms of Intrinsic Parameters,"Zuowei Shen, Haizhao Yang, Shijun Zhang",N/A (摘要需访问详情页),https://proceedings.mlr.press/v162/shen22g/shen22g.pdf,https://proceedings.mlr.press/v162/shen22g.html,shen22g,2022,ICML
Gradient-Free Method for Heavily Constrained Nonconvex Optimization,"Wanli Shi, Hongchang Gao, Bin Gu",N/A (摘要需访问详情页),https://proceedings.mlr.press/v162/shi22a/shi22a.pdf,https://proceedings.mlr.press/v162/shi22a.html,shi22a,2022,ICML
Global Optimization of K-Center Clustering,"Mingfei Shi, Kaixun Hua, Jiayang Ren, Yankai Cao",N/A (摘要需访问详情页),https://proceedings.mlr.press/v162/shi22b/shi22b.pdf,https://proceedings.mlr.press/v162/shi22b.html,shi22b,2022,ICML
Pessimistic Q-Learning for Offline Reinforcement Learning: Towards Optimal Sample Complexity,"Laixi Shi, Gen Li, Yuting Wei, Yuxin Chen, Yuejie Chi",N/A (摘要需访问详情页),https://proceedings.mlr.press/v162/shi22c/shi22c.pdf,https://proceedings.mlr.press/v162/shi22c.html,shi22c,2022,ICML
Adversarial Masking for Self-Supervised Learning,"Yuge Shi, N Siddharth, Philip Torr, Adam R Kosiorek",N/A (摘要需访问详情页),https://proceedings.mlr.press/v162/shi22d/shi22d.pdf,https://proceedings.mlr.press/v162/shi22d.html,shi22d,2022,ICML
Visual Attention Emerges from Recurrent Sparse Reconstruction,"Baifeng Shi, Yale Song, Neel Joshi, Trevor Darrell, Xin Wang",N/A (摘要需访问详情页),https://proceedings.mlr.press/v162/shi22e/shi22e.pdf,https://proceedings.mlr.press/v162/shi22e.html,shi22e,2022,ICML
A Minimax Learning Approach to Off-Policy Evaluation in Confounded Partially Observable Markov Decision Processes,"Chengchun Shi, Masatoshi Uehara, Jiawei Huang, Nan Jiang",N/A (摘要需访问详情页),https://proceedings.mlr.press/v162/shi22f/shi22f.pdf,https://proceedings.mlr.press/v162/shi22f.html,shi22f,2022,ICML
Robust Group Synchronization via Quadratic Programming,"Yunpeng Shi, Cole M Wyeth, Gilad Lerman",N/A (摘要需访问详情页),https://proceedings.mlr.press/v162/shi22g/shi22g.pdf,https://proceedings.mlr.press/v162/shi22g.html,shi22g,2022,ICML
Log-Euclidean Signatures for Intrinsic Distances Between Unaligned Datasets,"Tal Shnitzer, Mikhail Yurochkin, Kristjan Greenewald, Justin M Solomon",N/A (摘要需访问详情页),https://proceedings.mlr.press/v162/shnitzer22a/shnitzer22a.pdf,https://proceedings.mlr.press/v162/shnitzer22a.html,shnitzer22a,2022,ICML
Scalable Computation of Causal Bounds,"Madhumitha Shridharan, Garud Iyengar",N/A (摘要需访问详情页),https://proceedings.mlr.press/v162/shridharan22a/shridharan22a.pdf,https://proceedings.mlr.press/v162/shridharan22a.html,shridharan22a,2022,ICML
Bit Prioritization in Variational Autoencoders via Progressive Coding,"Rui Shu, Stefano Ermon",N/A (摘要需访问详情页),https://proceedings.mlr.press/v162/shu22a/shu22a.pdf,https://proceedings.mlr.press/v162/shu22a.html,shu22a,2022,ICML
Fair Representation Learning through Implicit Path Alignment,"Changjian Shui, Qi Chen, Jiaqi Li, Boyu Wang, Christian Gagné",N/A (摘要需访问详情页),https://proceedings.mlr.press/v162/shui22a/shui22a.pdf,https://proceedings.mlr.press/v162/shui22a.html,shui22a,2022,ICML
Faster Algorithms for Learning Convex Functions,"Ali Siahkamari, Durmus Alp Emre Acar, Christopher Liao, Kelly L Geyer, Venkatesh Saligrama, Brian Kulis",N/A (摘要需访问详情页),https://proceedings.mlr.press/v162/siahkamari22a/siahkamari22a.pdf,https://proceedings.mlr.press/v162/siahkamari22a.html,siahkamari22a,2022,ICML
Coin Flipping Neural Networks,"Yuval Sieradzki, Nitzan Hodos, Gal Yehuda, Assaf Schuster",N/A (摘要需访问详情页),https://proceedings.mlr.press/v162/sieradzki22a/sieradzki22a.pdf,https://proceedings.mlr.press/v162/sieradzki22a.html,sieradzki22a,2022,ICML
Reverse Engineering the Neural Tangent Kernel,"James Benjamin Simon, Sajant Anand, Mike Deweese",N/A (摘要需访问详情页),https://proceedings.mlr.press/v162/simon22a/simon22a.pdf,https://proceedings.mlr.press/v162/simon22a.html,simon22a,2022,ICML
Demystifying the Adversarial Robustness of Random Transformation Defenses,"Chawin Sitawarin, Zachary J Golan-Strieb, David Wagner",N/A (摘要需访问详情页),https://proceedings.mlr.press/v162/sitawarin22a/sitawarin22a.pdf,https://proceedings.mlr.press/v162/sitawarin22a.html,sitawarin22a,2022,ICML
Smoothed Adversarial Linear Contextual Bandits with Knapsacks,"Vidyashankar Sivakumar, Shiliang Zuo, Arindam Banerjee",N/A (摘要需访问详情页),https://proceedings.mlr.press/v162/sivakumar22a/sivakumar22a.pdf,https://proceedings.mlr.press/v162/sivakumar22a.html,sivakumar22a,2022,ICML
GenLabel: Mixup Relabeling using Generative Models,"Jy-Yong Sohn, Liang Shang, Hongxu Chen, Jaekyun Moon, Dimitris Papailiopoulos, Kangwook Lee",N/A (摘要需访问详情页),https://proceedings.mlr.press/v162/sohn22a/sohn22a.pdf,https://proceedings.mlr.press/v162/sohn22a.html,sohn22a,2022,ICML
Communicating via Markov Decision Processes,"Samuel Sokota, Christian A Schroeder De Witt, Maximilian Igl, Luisa M Zintgraf, Philip Torr, Martin Strohmeier, Zico Kolter, Shimon Whiteson, Jakob Foerster",N/A (摘要需访问详情页),https://proceedings.mlr.press/v162/sokota22a/sokota22a.pdf,https://proceedings.mlr.press/v162/sokota22a.html,sokota22a,2022,ICML
The Multivariate Community Hawkes Model for Dependent Relational Events in Continuous-time Networks,"Hadeel Soliman, Lingfei Zhao, Zhipeng Huang, Subhadeep Paul, Kevin S Xu",N/A (摘要需访问详情页),https://proceedings.mlr.press/v162/soliman22a/soliman22a.pdf,https://proceedings.mlr.press/v162/soliman22a.html,soliman22a,2022,ICML
Disentangling Sources of Risk for Distributional Multi-Agent Reinforcement Learning,"Kyunghwan Son, Junsu Kim, Sungsoo Ahn, Roben D Delos Reyes, Yung Yi, Jinwoo Shin",N/A (摘要需访问详情页),https://proceedings.mlr.press/v162/son22a/son22a.pdf,https://proceedings.mlr.press/v162/son22a.html,son22a,2022,ICML
TAM: Topology-Aware Margin Loss for Class-Imbalanced Node Classification,"Jaeyun Song, Joonhyung Park, Eunho Yang",N/A (摘要需访问详情页),https://proceedings.mlr.press/v162/song22a/song22a.pdf,https://proceedings.mlr.press/v162/song22a.html,song22a,2022,ICML
A General Recipe for Likelihood-free Bayesian Optimization,"Jiaming Song, Lantao Yu, Willie Neiswanger, Stefano Ermon",N/A (摘要需访问详情页),https://proceedings.mlr.press/v162/song22b/song22b.pdf,https://proceedings.mlr.press/v162/song22b.html,song22b,2022,ICML
Fully-Connected Network on Noncompact Symmetric Space and Ridgelet Transform based on Helgason-Fourier Analysis,"Sho Sonoda, Isao Ishikawa, Masahiro Ikeda",N/A (摘要需访问详情页),https://proceedings.mlr.press/v162/sonoda22a/sonoda22a.pdf,https://proceedings.mlr.press/v162/sonoda22a.html,sonoda22a,2022,ICML
Saute RL: Almost Surely Safe Reinforcement Learning Using State Augmentation,"Aivar Sootla, Alexander I Cowen-Rivers, Taher Jafferjee, Ziyan Wang, David H Mguni, Jun Wang, Haitham Ammar",N/A (摘要需访问详情页),https://proceedings.mlr.press/v162/sootla22a/sootla22a.pdf,https://proceedings.mlr.press/v162/sootla22a.html,sootla22a,2022,ICML
Lightweight Projective Derivative Codes for Compressed Asynchronous Gradient Descent,"Pedro J Soto, Ilia Ilmer, Haibin Guan, Jun Li",N/A (摘要需访问详情页),https://proceedings.mlr.press/v162/soto22a/soto22a.pdf,https://proceedings.mlr.press/v162/soto22a.html,soto22a,2022,ICML
Accelerating Bayesian Optimization for Biological Sequence Design with Denoising Autoencoders,"Samuel Stanton, Wesley Maddox, Nate Gruver, Phillip Maffettone, Emily Delaney, Peyton Greenside, Andrew Gordon Wilson",N/A (摘要需访问详情页),https://proceedings.mlr.press/v162/stanton22a/stanton22a.pdf,https://proceedings.mlr.press/v162/stanton22a.html,stanton22a,2022,ICML
3D Infomax improves GNNs for Molecular Property Prediction,"Hannes Stärk, Dominique Beaini, Gabriele Corso, Prudencio Tossou, Christian Dallago, Stephan Günnemann, Pietro Lió",N/A (摘要需访问详情页),https://proceedings.mlr.press/v162/stark22a/stark22a.pdf,https://proceedings.mlr.press/v162/stark22a.html,stark22a,2022,ICML
EquiBind: Geometric Deep Learning for Drug Binding Structure Prediction,"Hannes Stärk, Octavian Ganea, Lagnajit Pattanaik, Dr.Regina Barzilay, Tommi Jaakkola",N/A (摘要需访问详情页),https://proceedings.mlr.press/v162/stark22b/stark22b.pdf,https://proceedings.mlr.press/v162/stark22b.html,stark22b,2022,ICML
Plug & Play Attacks: Towards Robust and Flexible Model Inversion Attacks,"Lukas Struppek, Dominik Hintersdorf, Antonio De Almeida Correira, Antonia Adler, Kristian Kersting",N/A (摘要需访问详情页),https://proceedings.mlr.press/v162/struppek22a/struppek22a.pdf,https://proceedings.mlr.press/v162/struppek22a.html,struppek22a,2022,ICML
Scaling-up Diverse Orthogonal Convolutional Networks by a Paraunitary Framework,"Jiahao Su, Wonmin Byeon, Furong Huang",N/A (摘要需访问详情页),https://proceedings.mlr.press/v162/su22a/su22a.pdf,https://proceedings.mlr.press/v162/su22a.html,su22a,2022,ICML
Divergence-Regularized Multi-Agent Actor-Critic,"Kefan Su, Zongqing Lu",N/A (摘要需访问详情页),https://proceedings.mlr.press/v162/su22b/su22b.pdf,https://proceedings.mlr.press/v162/su22b.html,su22b,2022,ICML
Influence-Augmented Local Simulators: a Scalable Solution for Fast Deep RL in Large Networked Systems,"Miguel Suau, Jinke He, Matthijs T. J. Spaan, Frans Oliehoek",N/A (摘要需访问详情页),https://proceedings.mlr.press/v162/suau22a/suau22a.pdf,https://proceedings.mlr.press/v162/suau22a.html,suau22a,2022,ICML
Improved StyleGAN-v2 based Inversion for Out-of-Distribution Images,"Rakshith Subramanyam, Vivek Narayanaswamy, Mark Naufel, Andreas Spanias, Jayaraman J. Thiagarajan",N/A (摘要需访问详情页),https://proceedings.mlr.press/v162/subramanyam22a/subramanyam22a.pdf,https://proceedings.mlr.press/v162/subramanyam22a.html,subramanyam22a,2022,ICML
Continuous-Time Analysis of Accelerated Gradient Methods via Conservation Laws in Dilated Coordinate Systems,"Jaewook J Suh, Gyumin Roh, Ernest K Ryu",N/A (摘要需访问详情页),https://proceedings.mlr.press/v162/suh22a/suh22a.pdf,https://proceedings.mlr.press/v162/suh22a.html,suh22a,2022,ICML
Do Differentiable Simulators Give Better Policy Gradients?,"Hyung Ju Suh, Max Simchowitz, Kaiqing Zhang, Russ Tedrake",N/A (摘要需访问详情页),https://proceedings.mlr.press/v162/suh22b/suh22b.pdf,https://proceedings.mlr.press/v162/suh22b.html,suh22b,2022,ICML
Intriguing Properties of Input-Dependent Randomized Smoothing,"Peter Súkenı́k, Aleksei Kuvshinov, Stephan Günnemann",N/A (摘要需访问详情页),https://proceedings.mlr.press/v162/sukeni-k22a/sukeni-k22a.pdf,https://proceedings.mlr.press/v162/sukeni-k22a.html,sukeni-k22a,2022,ICML
Cliff Diving: Exploring Reward Surfaces in Reinforcement Learning Environments,"Ryan Sullivan, Jordan K Terry, Benjamin Black, John P Dickerson",N/A (摘要需访问详情页),https://proceedings.mlr.press/v162/sullivan22a/sullivan22a.pdf,https://proceedings.mlr.press/v162/sullivan22a.html,sullivan22a,2022,ICML
AGNAS: Attention-Guided Micro and Macro-Architecture Search,"Zihao Sun, Yu Hu, Shun Lu, Longxing Yang, Jilin Mei, Yinhe Han, Xiaowei Li",N/A (摘要需访问详情页),https://proceedings.mlr.press/v162/sun22a/sun22a.pdf,https://proceedings.mlr.press/v162/sun22a.html,sun22a,2022,ICML
Adaptive Random Walk Gradient Descent for Decentralized Optimization,"Tao Sun, Dongsheng Li, Bao Wang",N/A (摘要需访问详情页),https://proceedings.mlr.press/v162/sun22b/sun22b.pdf,https://proceedings.mlr.press/v162/sun22b.html,sun22b,2022,ICML
MAE-DET: Revisiting Maximum Entropy Principle in Zero-Shot NAS for Efficient Object Detection,"Zhenhong Sun, Ming Lin, Xiuyu Sun, Zhiyu Tan, Hao Li, Rong Jin",N/A (摘要需访问详情页),https://proceedings.mlr.press/v162/sun22c/sun22c.pdf,https://proceedings.mlr.press/v162/sun22c.html,sun22c,2022,ICML
Out-of-Distribution Detection with Deep Nearest Neighbors,"Yiyou Sun, Yifei Ming, Xiaojin Zhu, Yixuan Li",N/A (摘要需访问详情页),https://proceedings.mlr.press/v162/sun22d/sun22d.pdf,https://proceedings.mlr.press/v162/sun22d.html,sun22d,2022,ICML
Black-Box Tuning for Language-Model-as-a-Service,"Tianxiang Sun, Yunfan Shao, Hong Qian, Xuanjing Huang, Xipeng Qiu",N/A (摘要需访问详情页),https://proceedings.mlr.press/v162/sun22e/sun22e.pdf,https://proceedings.mlr.press/v162/sun22e.html,sun22e,2022,ICML
Correlated Quantization for Distributed Mean Estimation and Optimization,"Ananda Theertha Suresh, Ziteng Sun, Jae Ro, Felix Yu",N/A (摘要需访问详情页),https://proceedings.mlr.press/v162/suresh22a/suresh22a.pdf,https://proceedings.mlr.press/v162/suresh22a.html,suresh22a,2022,ICML
Causal Imitation Learning under Temporally Correlated Noise,"Gokul Swamy, Sanjiban Choudhury, Drew Bagnell, Steven Wu",N/A (摘要需访问详情页),https://proceedings.mlr.press/v162/swamy22a/swamy22a.pdf,https://proceedings.mlr.press/v162/swamy22a.html,swamy22a,2022,ICML
Being Properly Improper,"Tyler Sypherd, Richard Nock, Lalitha Sankar",N/A (摘要需访问详情页),https://proceedings.mlr.press/v162/sypherd22a/sypherd22a.pdf,https://proceedings.mlr.press/v162/sypherd22a.html,sypherd22a,2022,ICML
Distributionally-Aware Kernelized Bandit Problems for Risk Aversion,Sho Takemori,N/A (摘要需访问详情页),https://proceedings.mlr.press/v162/takemori22a/takemori22a.pdf,https://proceedings.mlr.press/v162/takemori22a.html,takemori22a,2022,ICML
Sequential and Parallel Constrained Max-value Entropy Search via Information Lower Bound,"Shion Takeno, Tomoyuki Tamura, Kazuki Shitara, Masayuki Karasuyama",N/A (摘要需访问详情页),https://proceedings.mlr.press/v162/takeno22a/takeno22a.pdf,https://proceedings.mlr.press/v162/takeno22a.html,takeno22a,2022,ICML
SQ-VAE: Variational Bayes on Discrete Representation with Self-annealed Stochastic Quantization,"Yuhta Takida, Takashi Shibuya, Weihsiang Liao, Chieh-Hsin Lai, Junki Ohmura, Toshimitsu Uesaka, Naoki Murata, Shusuke Takahashi, Toshiyuki Kumakura, Yuki Mitsufuji",N/A (摘要需访问详情页),https://proceedings.mlr.press/v162/takida22a/takida22a.pdf,https://proceedings.mlr.press/v162/takida22a.html,takida22a,2022,ICML
A Tree-based Model Averaging Approach for Personalized Treatment Effect Estimation from Heterogeneous Data Sources,"Xiaoqing Tan, Chung-Chou H. Chang, Ling Zhou, Lu Tang",N/A (摘要需访问详情页),https://proceedings.mlr.press/v162/tan22a/tan22a.pdf,https://proceedings.mlr.press/v162/tan22a.html,tan22a,2022,ICML
N-Penetrate: Active Learning of Neural Collision Handler for Complex 3D Mesh Deformations,"Qingyang Tan, Zherong Pan, Breannan Smith, Takaaki Shiratori, Dinesh Manocha",N/A (摘要需访问详情页),https://proceedings.mlr.press/v162/tan22b/tan22b.pdf,https://proceedings.mlr.press/v162/tan22b.html,tan22b,2022,ICML
Biased Gradient Estimate with Drastic Variance Reduction for Meta Reinforcement Learning,Yunhao Tang,N/A (摘要需访问详情页),https://proceedings.mlr.press/v162/tang22a/tang22a.pdf,https://proceedings.mlr.press/v162/tang22a.html,tang22a,2022,ICML
Rethinking Graph Neural Networks for Anomaly Detection,"Jianheng Tang, Jiajin Li, Ziqi Gao, Jia Li",N/A (摘要需访问详情页),https://proceedings.mlr.press/v162/tang22b/tang22b.pdf,https://proceedings.mlr.press/v162/tang22b.html,tang22b,2022,ICML
Deep Safe Incomplete Multi-view Clustering: Theorem and Algorithm,"Huayi Tang, Yong Liu",N/A (摘要需访问详情页),https://proceedings.mlr.press/v162/tang22c/tang22c.pdf,https://proceedings.mlr.press/v162/tang22c.html,tang22c,2022,ICML
Virtual Homogeneity Learning: Defending against Data Heterogeneity in Federated Learning,"Zhenheng Tang, Yonggang Zhang, Shaohuai Shi, Xin He, Bo Han, Xiaowen Chu",N/A (摘要需访问详情页),https://proceedings.mlr.press/v162/tang22d/tang22d.pdf,https://proceedings.mlr.press/v162/tang22d.html,tang22d,2022,ICML
Cross-Space Active Learning on Graph Convolutional Networks,"Yufei Tao, Hao Wu, Shiyuan Deng",N/A (摘要需访问详情页),https://proceedings.mlr.press/v162/tao22a/tao22a.pdf,https://proceedings.mlr.press/v162/tao22a.html,tao22a,2022,ICML
"FedNest: Federated Bilevel, Minimax, and Compositional Optimization","Davoud Ataee Tarzanagh, Mingchen Li, Christos Thrampoulidis, Samet Oymak",N/A (摘要需访问详情页),https://proceedings.mlr.press/v162/tarzanagh22a/tarzanagh22a.pdf,https://proceedings.mlr.press/v162/tarzanagh22a.html,tarzanagh22a,2022,ICML
Efficient Distributionally Robust Bayesian Optimization with Worst-case Sensitivity,"Sebastian Shenghong Tay, Chuan Sheng Foo, Urano Daisuke, Richalynn Leong, Bryan Kian Hsiang Low",N/A (摘要需访问详情页),https://proceedings.mlr.press/v162/tay22a/tay22a.pdf,https://proceedings.mlr.press/v162/tay22a.html,tay22a,2022,ICML
LIDL: Local Intrinsic Dimension Estimation Using Approximate Likelihood,"Piotr Tempczyk, Rafał Michaluk, Lukasz Garncarek, Przemysław Spurek, Jacek Tabor, Adam Golinski",N/A (摘要需访问详情页),https://proceedings.mlr.press/v162/tempczyk22a/tempczyk22a.pdf,https://proceedings.mlr.press/v162/tempczyk22a.html,tempczyk22a,2022,ICML
LCANets: Lateral Competition Improves Robustness Against Corruption and Attack,"Michael Teti, Garrett Kenyon, Ben Migliori, Juston Moore",N/A (摘要需访问详情页),https://proceedings.mlr.press/v162/teti22a/teti22a.pdf,https://proceedings.mlr.press/v162/teti22a.html,teti22a,2022,ICML
Reverse Engineering $\ell_p$ attacks: A block-sparse optimization approach with recovery guarantees,"Darshan Thaker, Paris Giampouras, Rene Vidal",N/A (摘要需访问详情页),https://proceedings.mlr.press/v162/thaker22a/thaker22a.pdf,https://proceedings.mlr.press/v162/thaker22a.html,thaker22a,2022,ICML
Generalised Policy Improvement with Geometric Policy Composition,"Shantanu Thakoor, Mark Rowland, Diana Borsa, Will Dabney, Remi Munos, Andre Barreto",N/A (摘要需访问详情页),https://proceedings.mlr.press/v162/thakoor22a/thakoor22a.pdf,https://proceedings.mlr.press/v162/thakoor22a.html,thakoor22a,2022,ICML
Algorithms for the Communication of Samples,"Lucas Theis, Noureldin Y Ahmed",N/A (摘要需访问详情页),https://proceedings.mlr.press/v162/theis22a/theis22a.pdf,https://proceedings.mlr.press/v162/theis22a.html,theis22a,2022,ICML
Consistent Polyhedral Surrogates for Top-k Classification and Variants,"Anish Thilagar, Rafael Frongillo, Jessica J Finocchiaro, Emma Goodwill",N/A (摘要需访问详情页),https://proceedings.mlr.press/v162/thilagar22a/thilagar22a.pdf,https://proceedings.mlr.press/v162/thilagar22a.html,thilagar22a,2022,ICML
On the Finite-Time Complexity and Practical Computation of Approximate Stationarity Concepts of Lipschitz Functions,"Lai Tian, Kaiwen Zhou, Anthony Man-Cho So",N/A (摘要需访问详情页),https://proceedings.mlr.press/v162/tian22a/tian22a.pdf,https://proceedings.mlr.press/v162/tian22a.html,tian22a,2022,ICML
From Dirichlet to Rubin: Optimistic Exploration in RL without Bonuses,"Daniil Tiapkin, Denis Belomestny, Eric Moulines, Alexey Naumov, Sergey Samsonov, Yunhao Tang, Michal Valko, Pierre Menard",N/A (摘要需访问详情页),https://proceedings.mlr.press/v162/tiapkin22a/tiapkin22a.pdf,https://proceedings.mlr.press/v162/tiapkin22a.html,tiapkin22a,2022,ICML
Nonparametric Sparse Tensor Factorization with Hierarchical Gamma Processes,"Conor Tillinghast, Zheng Wang, Shandian Zhe",N/A (摘要需访问详情页),https://proceedings.mlr.press/v162/tillinghast22a/tillinghast22a.pdf,https://proceedings.mlr.press/v162/tillinghast22a.html,tillinghast22a,2022,ICML
Deciphering Lasso-based Classification Through a Large Dimensional Analysis of the Iterative Soft-Thresholding Algorithm,"Malik Tiomoko, Ekkehard Schnoor, Mohamed El Amine Seddik, Igor Colin, Aladin Virmaux",N/A (摘要需访问详情页),https://proceedings.mlr.press/v162/tiomoko22a/tiomoko22a.pdf,https://proceedings.mlr.press/v162/tiomoko22a.html,tiomoko22a,2022,ICML
Extended Unconstrained Features Model for Exploring Deep Neural Collapse,"Tom Tirer, Joan Bruna",N/A (摘要需访问详情页),https://proceedings.mlr.press/v162/tirer22a/tirer22a.pdf,https://proceedings.mlr.press/v162/tirer22a.html,tirer22a,2022,ICML
Object Permanence Emerges in a Random Walk along Memory,"Pavel Tokmakov, Allan Jabri, Jie Li, Adrien Gaidon",N/A (摘要需访问详情页),https://proceedings.mlr.press/v162/tokmakov22a/tokmakov22a.pdf,https://proceedings.mlr.press/v162/tokmakov22a.html,tokmakov22a,2022,ICML
"Generic Coreset for Scalable Learning of Monotonic Kernels: Logistic Regression, Sigmoid and more","Elad Tolochinksy, Ibrahim Jubran, Dan Feldman",N/A (摘要需访问详情页),https://proceedings.mlr.press/v162/tolochinksy22a/tolochinksy22a.pdf,https://proceedings.mlr.press/v162/tolochinksy22a.html,tolochinksy22a,2022,ICML
Failure and success of the spectral bias prediction for Laplace Kernel Ridge Regression: the case of low-dimensional data,"Umberto M Tomasini, Antonio Sclocchi, Matthieu Wyart",N/A (摘要需访问详情页),https://proceedings.mlr.press/v162/tomasini22a/tomasini22a.pdf,https://proceedings.mlr.press/v162/tomasini22a.html,tomasini22a,2022,ICML
Quantifying and Learning Linear Symmetry-Based Disentanglement,"Loek Tonnaer, Luis Armando Perez Rey, Vlado Menkovski, Mike Holenderski, Jim Portegies",N/A (摘要需访问详情页),https://proceedings.mlr.press/v162/tonnaer22a/tonnaer22a.pdf,https://proceedings.mlr.press/v162/tonnaer22a.html,tonnaer22a,2022,ICML
A Temporal-Difference Approach to Policy Gradient Estimation,"Samuele Tosatto, Andrew Patterson, Martha White, Rupam Mahmood",N/A (摘要需访问详情页),https://proceedings.mlr.press/v162/tosatto22a/tosatto22a.pdf,https://proceedings.mlr.press/v162/tosatto22a.html,tosatto22a,2022,ICML
Simple and near-optimal algorithms for hidden stratification and multi-group learning,"Christopher J Tosh, Daniel Hsu",N/A (摘要需访问详情页),https://proceedings.mlr.press/v162/tosh22a/tosh22a.pdf,https://proceedings.mlr.press/v162/tosh22a.html,tosh22a,2022,ICML
Design-Bench: Benchmarks for Data-Driven Offline Model-Based Optimization,"Brandon Trabucco, Xinyang Geng, Aviral Kumar, Sergey Levine",N/A (摘要需访问详情页),https://proceedings.mlr.press/v162/trabucco22a/trabucco22a.pdf,https://proceedings.mlr.press/v162/trabucco22a.html,trabucco22a,2022,ICML
AnyMorph: Learning Transferable Polices By Inferring Agent Morphology,"Brandon Trabucco, Mariano Phielipp, Glen Berseth",N/A (摘要需访问详情页),https://proceedings.mlr.press/v162/trabucco22b/trabucco22b.pdf,https://proceedings.mlr.press/v162/trabucco22b.html,trabucco22b,2022,ICML
Detecting Adversarial Examples Is (Nearly) As Hard As Classifying Them,Florian Tramer,N/A (摘要需访问详情页),https://proceedings.mlr.press/v162/tramer22a/tramer22a.pdf,https://proceedings.mlr.press/v162/tramer22a.html,tramer22a,2022,ICML
Nesterov Accelerated Shuffling Gradient Method for Convex Optimization,"Trang H Tran, Katya Scheinberg, Lam M Nguyen",N/A (摘要需访问详情页),https://proceedings.mlr.press/v162/tran22a/tran22a.pdf,https://proceedings.mlr.press/v162/tran22a.html,tran22a,2022,ICML
A Completely Tuning-Free and Robust Approach to Sparse Precision Matrix Estimation,"Chau Tran, Guo Yu",N/A (摘要需访问详情页),https://proceedings.mlr.press/v162/tran22b/tran22b.pdf,https://proceedings.mlr.press/v162/tran22b.html,tran22b,2022,ICML
Tackling covariate shift with node-based Bayesian neural networks,"Trung Q Trinh, Markus Heinonen, Luigi Acerbi, Samuel Kaski",N/A (摘要需访问详情页),https://proceedings.mlr.press/v162/trinh22a/trinh22a.pdf,https://proceedings.mlr.press/v162/trinh22a.html,trinh22a,2022,ICML
Fenrir: Physics-Enhanced Regression for Initial Value Problems,"Filip Tronarp, Nathanael Bosch, Philipp Hennig",N/A (摘要需访问详情页),https://proceedings.mlr.press/v162/tronarp22a/tronarp22a.pdf,https://proceedings.mlr.press/v162/tronarp22a.html,tronarp22a,2022,ICML
Interpretable Off-Policy Learning via Hyperbox Search,"Daniel Tschernutter, Tobias Hatt, Stefan Feuerriegel",N/A (摘要需访问详情页),https://proceedings.mlr.press/v162/tschernutter22a/tschernutter22a.pdf,https://proceedings.mlr.press/v162/tschernutter22a.html,tschernutter22a,2022,ICML
FriendlyCore: Practical Differentially Private Aggregation,"Eliad Tsfadia, Edith Cohen, Haim Kaplan, Yishay Mansour, Uri Stemmer",N/A (摘要需访问详情页),https://proceedings.mlr.press/v162/tsfadia22a/tsfadia22a.pdf,https://proceedings.mlr.press/v162/tsfadia22a.html,tsfadia22a,2022,ICML
Pairwise Conditional Gradients without Swap Steps and Sparser Kernel Herding,"Kazuma K Tsuji, Ken’Ichiro Tanaka, Sebastian Pokutta",N/A (摘要需访问详情页),https://proceedings.mlr.press/v162/tsuji22a/tsuji22a.pdf,https://proceedings.mlr.press/v162/tsuji22a.html,tsuji22a,2022,ICML
