title,authors,abstract,pdf_url,source_url,id,year,conference
Rethinking Attention-Model Explainability through Faithfulness Violation Test,"Yibing Liu, Haoliang Li, Yangyang Guo, Chenqi Kong, Jing Li, Shiqi Wang",N/A (摘要需访问详情页),https://proceedings.mlr.press/v162/liu22i/liu22i.pdf,https://proceedings.mlr.press/v162/liu22i.html,liu22i,2022,ICML
Optimization-Derived Learning with Essential Convergence Analysis of Training and Hyper-training,"Risheng Liu, Xuan Liu, Shangzhi Zeng, Jin Zhang, Yixuan Zhang",N/A (摘要需访问详情页),https://proceedings.mlr.press/v162/liu22j/liu22j.pdf,https://proceedings.mlr.press/v162/liu22j.html,liu22j,2022,ICML
Deep Neural Network Fusion via Graph Matching with Applications to Model Ensemble and Federated Learning,"Chang Liu, Chenfei Lou, Runzhong Wang, Alan Yuhan Xi, Li Shen, Junchi Yan",N/A (摘要需访问详情页),https://proceedings.mlr.press/v162/liu22k/liu22k.pdf,https://proceedings.mlr.press/v162/liu22k.html,liu22k,2022,ICML
Welfare Maximization in Competitive Equilibrium: Reinforcement Learning for Markov Exchange Economy,"Zhihan Liu, Miao Lu, Zhaoran Wang, Michael Jordan, Zhuoran Yang",N/A (摘要需访问详情页),https://proceedings.mlr.press/v162/liu22l/liu22l.pdf,https://proceedings.mlr.press/v162/liu22l.html,liu22l,2022,ICML
Generating 3D Molecules for Target Protein Binding,"Meng Liu, Youzhi Luo, Kanji Uchino, Koji Maruhashi, Shuiwang Ji",N/A (摘要需访问详情页),https://proceedings.mlr.press/v162/liu22m/liu22m.pdf,https://proceedings.mlr.press/v162/liu22m.html,liu22m,2022,ICML
Communication-efficient Distributed Learning for Large Batch Optimization,"Rui Liu, Barzan Mozafari",N/A (摘要需访问详情页),https://proceedings.mlr.press/v162/liu22n/liu22n.pdf,https://proceedings.mlr.press/v162/liu22n.html,liu22n,2022,ICML
Adaptive Accelerated (Extra-)Gradient Methods with Variance Reduction,"Zijian Liu, Ta Duy Nguyen, Alina Ene, Huy Nguyen",N/A (摘要需访问详情页),https://proceedings.mlr.press/v162/liu22o/liu22o.pdf,https://proceedings.mlr.press/v162/liu22o.html,liu22o,2022,ICML
REvolveR: Continuous Evolutionary Models for Robot-to-robot Policy Transfer,"Xingyu Liu, Deepak Pathak, Kris Kitani",N/A (摘要需访问详情页),https://proceedings.mlr.press/v162/liu22p/liu22p.pdf,https://proceedings.mlr.press/v162/liu22p.html,liu22p,2022,ICML
Kill a Bird with Two Stones: Closing the Convergence Gaps in Non-Strongly Convex Optimization by Directly Accelerated SVRG with Double Compensation and Snapshots,"Yuanyuan Liu, Fanhua Shang, Weixin An, Hongying Liu, Zhouchen Lin",N/A (摘要需访问详情页),https://proceedings.mlr.press/v162/liu22q/liu22q.pdf,https://proceedings.mlr.press/v162/liu22q.html,liu22q,2022,ICML
Learning Markov Games with Adversarial Opponents: Efficient Algorithms and Fundamental Limits,"Qinghua Liu, Yuanhao Wang, Chi Jin",N/A (摘要需访问详情页),https://proceedings.mlr.press/v162/liu22r/liu22r.pdf,https://proceedings.mlr.press/v162/liu22r.html,liu22r,2022,ICML
Local Augmentation for Graph Neural Networks,"Songtao Liu, Rex Ying, Hanze Dong, Lanqing Li, Tingyang Xu, Yu Rong, Peilin Zhao, Junzhou Huang, Dinghao Wu",N/A (摘要需访问详情页),https://proceedings.mlr.press/v162/liu22s/liu22s.pdf,https://proceedings.mlr.press/v162/liu22s.html,liu22s,2022,ICML
Asking for Knowledge (AFK): Training RL Agents to Query External Knowledge Using Language,"Iou-Jen Liu, Xingdi Yuan, Marc-Alexandre Côté, Pierre-Yves Oudeyer, Alexander Schwing",N/A (摘要需访问详情页),https://proceedings.mlr.press/v162/liu22t/liu22t.pdf,https://proceedings.mlr.press/v162/liu22t.html,liu22t,2022,ICML
Learning from Demonstration: Provably Efficient Adversarial Policy Imitation with Linear Function Approximation,"Zhihan Liu, Yufeng Zhang, Zuyue Fu, Zhuoran Yang, Zhaoran Wang",N/A (摘要需访问详情页),https://proceedings.mlr.press/v162/liu22u/liu22u.pdf,https://proceedings.mlr.press/v162/liu22u.html,liu22u,2022,ICML
GACT: Activation Compressed Training for Generic Network Architectures,"Xiaoxuan Liu, Lianmin Zheng, Dequan Wang, Yukuo Cen, Weize Chen, Xu Han, Jianfei Chen, Zhiyuan Liu, Jie Tang, Joey Gonzalez, Michael Mahoney, Alvin Cheung",N/A (摘要需访问详情页),https://proceedings.mlr.press/v162/liu22v/liu22v.pdf,https://proceedings.mlr.press/v162/liu22v.html,liu22v,2022,ICML
Robust Training under Label Noise by Over-parameterization,"Sheng Liu, Zhihui Zhu, Qing Qu, Chong You",N/A (摘要需访问详情页),https://proceedings.mlr.press/v162/liu22w/liu22w.pdf,https://proceedings.mlr.press/v162/liu22w.html,liu22w,2022,ICML
Plan Your Target and Learn Your Skills: Transferable State-Only Imitation Learning via Decoupled Policy Optimization,"Minghuan Liu, Zhengbang Zhu, Yuzheng Zhuang, Weinan Zhang, Jianye Hao, Yong Yu, Jun Wang",N/A (摘要需访问详情页),https://proceedings.mlr.press/v162/liu22x/liu22x.pdf,https://proceedings.mlr.press/v162/liu22x.html,liu22x,2022,ICML
On the Impossibility of Learning to Cooperate with Adaptive Partner Strategies in Repeated Games,"Robert Loftin, Frans A Oliehoek",N/A (摘要需访问详情页),https://proceedings.mlr.press/v162/loftin22a/loftin22a.pdf,https://proceedings.mlr.press/v162/loftin22a.html,loftin22a,2022,ICML
AutoIP: A United Framework to Integrate Physics into Gaussian Processes,"Da Long, Zheng Wang, Aditi Krishnapriyan, Robert Kirby, Shandian Zhe, Michael Mahoney",N/A (摘要需访问详情页),https://proceedings.mlr.press/v162/long22a/long22a.pdf,https://proceedings.mlr.press/v162/long22a.html,long22a,2022,ICML
"Bayesian Model Selection, the Marginal Likelihood, and Generalization","Sanae Lotfi, Pavel Izmailov, Gregory Benton, Micah Goldblum, Andrew Gordon Wilson",N/A (摘要需访问详情页),https://proceedings.mlr.press/v162/lotfi22a/lotfi22a.pdf,https://proceedings.mlr.press/v162/lotfi22a.html,lotfi22a,2022,ICML
Feature Learning and Signal Propagation in Deep Neural Networks,"Yizhang Lou, Chris E Mingard, Soufiane Hayou",N/A (摘要需访问详情页),https://proceedings.mlr.press/v162/lou22a/lou22a.pdf,https://proceedings.mlr.press/v162/lou22a.html,lou22a,2022,ICML
"Fluctuations, Bias, Variance & Ensemble of Learners: Exact Asymptotics for Convex Losses in High-Dimension","Bruno Loureiro, Cedric Gerbelot, Maria Refinetti, Gabriele Sicuro, Florent Krzakala",N/A (摘要需访问详情页),https://proceedings.mlr.press/v162/loureiro22a/loureiro22a.pdf,https://proceedings.mlr.press/v162/loureiro22a.html,loureiro22a,2022,ICML
A Single-Loop Gradient Descent and Perturbed Ascent Algorithm for Nonconvex Functional Constrained Optimization,Songtao Lu,N/A (摘要需访问详情页),https://proceedings.mlr.press/v162/lu22a/lu22a.pdf,https://proceedings.mlr.press/v162/lu22a.html,lu22a,2022,ICML
Additive Gaussian Processes Revisited,"Xiaoyu Lu, Alexis Boukouvalas, James Hensman",N/A (摘要需访问详情页),https://proceedings.mlr.press/v162/lu22b/lu22b.pdf,https://proceedings.mlr.press/v162/lu22b.html,lu22b,2022,ICML
ModLaNets: Learning Generalisable Dynamics via Modularity and Physical Inductive Bias,"Yupu Lu, Shijie Lin, Guanqi Chen, Jia Pan",N/A (摘要需访问详情页),https://proceedings.mlr.press/v162/lu22c/lu22c.pdf,https://proceedings.mlr.press/v162/lu22c.html,lu22c,2022,ICML
Model-Free Opponent Shaping,"Christopher Lu, Timon Willi, Christian A Schroeder De Witt, Jakob Foerster",N/A (摘要需访问详情页),https://proceedings.mlr.press/v162/lu22d/lu22d.pdf,https://proceedings.mlr.press/v162/lu22d.html,lu22d,2022,ICML
Multi-slots Online Matching with High Entropy,"Xingyu Lu, Qintong Wu, Wenliang Zhong",N/A (摘要需访问详情页),https://proceedings.mlr.press/v162/lu22e/lu22e.pdf,https://proceedings.mlr.press/v162/lu22e.html,lu22e,2022,ICML
Maximum Likelihood Training for Score-based Diffusion ODEs by High Order Denoising Score Matching,"Cheng Lu, Kaiwen Zheng, Fan Bao, Jianfei Chen, Chongxuan Li, Jun Zhu",N/A (摘要需访问详情页),https://proceedings.mlr.press/v162/lu22f/lu22f.pdf,https://proceedings.mlr.press/v162/lu22f.html,lu22f,2022,ICML
Orchestra: Unsupervised Federated Learning via Globally Consistent Clustering,"Ekdeep Lubana, Chi Ian Tang, Fahim Kawsar, Robert Dick, Akhil Mathur",N/A (摘要需访问详情页),https://proceedings.mlr.press/v162/lubana22a/lubana22a.pdf,https://proceedings.mlr.press/v162/lubana22a.html,lubana22a,2022,ICML
A Rigorous Study of Integrated Gradients Method and Extensions to Internal Neuron Attributions,"Daniel D Lundstrom, Tianjian Huang, Meisam Razaviyayn",N/A (摘要需访问详情页),https://proceedings.mlr.press/v162/lundstrom22a/lundstrom22a.pdf,https://proceedings.mlr.press/v162/lundstrom22a.html,lundstrom22a,2022,ICML
BAMDT: Bayesian Additive Semi-Multivariate Decision Trees for Nonparametric Regression,"Zhao Tang Luo, Huiyan Sang, Bani Mallick",N/A (摘要需访问详情页),https://proceedings.mlr.press/v162/luo22a/luo22a.pdf,https://proceedings.mlr.press/v162/luo22a.html,luo22a,2022,ICML
Disentangled Federated Learning for Tackling Attributes Skew via Invariant Aggregation and Diversity Transferring,"Zhengquan Luo, Yunlong Wang, Zilei Wang, Zhenan Sun, Tieniu Tan",N/A (摘要需访问详情页),https://proceedings.mlr.press/v162/luo22b/luo22b.pdf,https://proceedings.mlr.press/v162/luo22b.html,luo22b,2022,ICML
Channel Importance Matters in Few-Shot Image Classification,"Xu Luo, Jing Xu, Zenglin Xu",N/A (摘要需访问详情页),https://proceedings.mlr.press/v162/luo22c/luo22c.pdf,https://proceedings.mlr.press/v162/luo22c.html,luo22c,2022,ICML
Learning Dynamics and Generalization in Deep Reinforcement Learning,"Clare Lyle, Mark Rowland, Will Dabney, Marta Kwiatkowska, Yarin Gal",N/A (摘要需访问详情页),https://proceedings.mlr.press/v162/lyle22a/lyle22a.pdf,https://proceedings.mlr.press/v162/lyle22a.html,lyle22a,2022,ICML
On Finite-Sample Identifiability of Contrastive Learning-Based Nonlinear Independent Component Analysis,"Qi Lyu, Xiao Fu",N/A (摘要需访问详情页),https://proceedings.mlr.press/v162/lyu22a/lyu22a.pdf,https://proceedings.mlr.press/v162/lyu22a.html,lyu22a,2022,ICML
Pessimism meets VCG: Learning Dynamic Mechanism Design via Offline Reinforcement Learning,"Boxiang Lyu, Zhaoran Wang, Mladen Kolar, Zhuoran Yang",N/A (摘要需访问详情页),https://proceedings.mlr.press/v162/lyu22b/lyu22b.pdf,https://proceedings.mlr.press/v162/lyu22b.html,lyu22b,2022,ICML
Versatile Offline Imitation from Observations and Examples via Regularized State-Occupancy Matching,"Yecheng Ma, Andrew Shen, Dinesh Jayaraman, Osbert Bastani",N/A (摘要需访问详情页),https://proceedings.mlr.press/v162/ma22a/ma22a.pdf,https://proceedings.mlr.press/v162/ma22a.html,ma22a,2022,ICML
Quantification and Analysis of Layer-wise and Pixel-wise Information Discarding,"Haotian Ma, Hao Zhang, Fan Zhou, Yinqing Zhang, Quanshi Zhang",N/A (摘要需访问详情页),https://proceedings.mlr.press/v162/ma22b/ma22b.pdf,https://proceedings.mlr.press/v162/ma22b.html,ma22b,2022,ICML
Interpretable Neural Networks with Frank-Wolfe: Sparse Relevance Maps and Relevance Orderings,"Jan Macdonald, Mathieu E. Besançon, Sebastian Pokutta",N/A (摘要需访问详情页),https://proceedings.mlr.press/v162/macdonald22a/macdonald22a.pdf,https://proceedings.mlr.press/v162/macdonald22a.html,macdonald22a,2022,ICML
"A Tighter Analysis of Spectral Clustering, and Beyond","Peter Macgregor, He Sun",N/A (摘要需访问详情页),https://proceedings.mlr.press/v162/macgregor22a/macgregor22a.pdf,https://proceedings.mlr.press/v162/macgregor22a.html,macgregor22a,2022,ICML
Zero-Shot Reward Specification via Grounded Natural Language,"Parsa Mahmoudieh, Deepak Pathak, Trevor Darrell",N/A (摘要需访问详情页),https://proceedings.mlr.press/v162/mahmoudieh22a/mahmoudieh22a.pdf,https://proceedings.mlr.press/v162/mahmoudieh22a.html,mahmoudieh22a,2022,ICML
Feature selection using e-values,"Subhabrata Majumdar, Snigdhansu Chatterjee",N/A (摘要需访问详情页),https://proceedings.mlr.press/v162/majumdar22a/majumdar22a.pdf,https://proceedings.mlr.press/v162/majumdar22a.html,majumdar22a,2022,ICML
Knowledge-Grounded Self-Rationalization via Extractive and Natural Language Explanations,"Bodhisattwa Prasad Majumder, Oana Camburu, Thomas Lukasiewicz, Julian Mcauley",N/A (摘要需访问详情页),https://proceedings.mlr.press/v162/majumder22a/majumder22a.pdf,https://proceedings.mlr.press/v162/majumder22a.html,majumder22a,2022,ICML
Nonparametric Involutive Markov Chain Monte Carlo,"Carol Mak, Fabian Zaiser, Luke Ong",N/A (摘要需访问详情页),https://proceedings.mlr.press/v162/mak22a/mak22a.pdf,https://proceedings.mlr.press/v162/mak22a.html,mak22a,2022,ICML
Architecture Agnostic Federated Learning for Neural Networks,"Disha Makhija, Xing Han, Nhat Ho, Joydeep Ghosh",N/A (摘要需访问详情页),https://proceedings.mlr.press/v162/makhija22a/makhija22a.pdf,https://proceedings.mlr.press/v162/makhija22a.html,makhija22a,2022,ICML
Robustness in Multi-Objective Submodular Optimization: a Quantile Approach,"Cedric Malherbe, Kevin Scaman",N/A (摘要需访问详情页),https://proceedings.mlr.press/v162/malherbe22a/malherbe22a.pdf,https://proceedings.mlr.press/v162/malherbe22a.html,malherbe22a,2022,ICML
More Efficient Sampling for Tensor Decomposition With Worst-Case Guarantees,Osman Asif Malik,N/A (摘要需访问详情页),https://proceedings.mlr.press/v162/malik22a/malik22a.pdf,https://proceedings.mlr.press/v162/malik22a.html,malik22a,2022,ICML
Unaligned Supervision for Automatic Music Transcription in The Wild,"Ben Maman, Amit H Bermano",N/A (摘要需访问详情页),https://proceedings.mlr.press/v162/maman22a/maman22a.pdf,https://proceedings.mlr.press/v162/maman22a.html,maman22a,2022,ICML
Decision-Focused Learning: Through the Lens of Learning to Rank,"Jayanta Mandi, Vı́ctor Bucarey, Maxime Mulamba Ke Tchomba, Tias Guns",N/A (摘要需访问详情页),https://proceedings.mlr.press/v162/mandi22a/mandi22a.pdf,https://proceedings.mlr.press/v162/mandi22a.html,mandi22a,2022,ICML
Differentially Private Coordinate Descent for Composite Empirical Risk Minimization,"Paul Mangold, Aurélien Bellet, Joseph Salmon, Marc Tommasi",N/A (摘要需访问详情页),https://proceedings.mlr.press/v162/mangold22a/mangold22a.pdf,https://proceedings.mlr.press/v162/mangold22a.html,mangold22a,2022,ICML
Refined Convergence Rates for Maximum Likelihood Estimation under Finite Mixture Models,"Tudor Manole, Nhat Ho",N/A (摘要需访问详情页),https://proceedings.mlr.press/v162/manole22a/manole22a.pdf,https://proceedings.mlr.press/v162/manole22a.html,manole22a,2022,ICML
On Improving Model-Free Algorithms for Decentralized Multi-Agent Reinforcement Learning,"Weichao Mao, Lin Yang, Kaiqing Zhang, Tamer Basar",N/A (摘要需访问详情页),https://proceedings.mlr.press/v162/mao22a/mao22a.pdf,https://proceedings.mlr.press/v162/mao22a.html,mao22a,2022,ICML
On the Effects of Artificial Data Modification,"Antonia Marcu, Adam Prugel-Bennett",N/A (摘要需访问详情页),https://proceedings.mlr.press/v162/marcu22a/marcu22a.pdf,https://proceedings.mlr.press/v162/marcu22a.html,marcu22a,2022,ICML
Personalized Federated Learning through Local Memorization,"Othmane Marfoq, Giovanni Neglia, Richard Vidal, Laetitia Kameni",N/A (摘要需访问详情页),https://proceedings.mlr.press/v162/marfoq22a/marfoq22a.pdf,https://proceedings.mlr.press/v162/marfoq22a.html,marfoq22a,2022,ICML
Nested Bandits,"Matthieu Martin, Panayotis Mertikopoulos, Thibaud Rahier, Houssam Zenati",N/A (摘要需访问详情页),https://proceedings.mlr.press/v162/martin22a/martin22a.pdf,https://proceedings.mlr.press/v162/martin22a.html,martin22a,2022,ICML
Closed-Form Diffeomorphic Transformations for Time Series Alignment,"Iñigo Martinez, Elisabeth Viles, Igor G. Olaizola",N/A (摘要需访问详情页),https://proceedings.mlr.press/v162/martinez22a/martinez22a.pdf,https://proceedings.mlr.press/v162/martinez22a.html,martinez22a,2022,ICML
SPECTRE: Spectral Conditioning Helps to Overcome the Expressivity Limits of One-shot Graph Generators,"Karolis Martinkus, Andreas Loukas, Nathanaël Perraudin, Roger Wattenhofer",N/A (摘要需访问详情页),https://proceedings.mlr.press/v162/martinkus22a/martinkus22a.pdf,https://proceedings.mlr.press/v162/martinkus22a.html,martinkus22a,2022,ICML
Modular Conformal Calibration,"Charles Marx, Shengjia Zhao, Willie Neiswanger, Stefano Ermon",N/A (摘要需访问详情页),https://proceedings.mlr.press/v162/marx22a/marx22a.pdf,https://proceedings.mlr.press/v162/marx22a.html,marx22a,2022,ICML
Continual Repeated Annealed Flow Transport Monte Carlo,"Alex Matthews, Michael Arbel, Danilo Jimenez Rezende, Arnaud Doucet",N/A (摘要需访问详情页),https://proceedings.mlr.press/v162/matthews22a/matthews22a.pdf,https://proceedings.mlr.press/v162/matthews22a.html,matthews22a,2022,ICML
How to Stay Curious while avoiding Noisy TVs using Aleatoric Uncertainty Estimation,"Augustine Mavor-Parker, Kimberly Young, Caswell Barry, Lewis Griffin",N/A (摘要需访问详情页),https://proceedings.mlr.press/v162/mavor-parker22a/mavor-parker22a.pdf,https://proceedings.mlr.press/v162/mavor-parker22a.html,mavor-parker22a,2022,ICML
How to Steer Your Adversary: Targeted and Efficient Model Stealing Defenses with Gradient Redirection,"Mantas Mazeika, Bo Li, David Forsyth",N/A (摘要需访问详情页),https://proceedings.mlr.press/v162/mazeika22a/mazeika22a.pdf,https://proceedings.mlr.press/v162/mazeika22a.html,mazeika22a,2022,ICML
Quant-BnB: A Scalable Branch-and-Bound Method for Optimal Decision Trees with Continuous Features,"Rahul Mazumder, Xiang Meng, Haoyue Wang",N/A (摘要需访问详情页),https://proceedings.mlr.press/v162/mazumder22a/mazumder22a.pdf,https://proceedings.mlr.press/v162/mazumder22a.html,mazumder22a,2022,ICML
Optimizing Tensor Network Contraction Using Reinforcement Learning,"Eli Meirom, Haggai Maron, Shie Mannor, Gal Chechik",N/A (摘要需访问详情页),https://proceedings.mlr.press/v162/meirom22a/meirom22a.pdf,https://proceedings.mlr.press/v162/meirom22a.html,meirom22a,2022,ICML
Causal Transformer for Estimating Counterfactual Outcomes,"Valentyn Melnychuk, Dennis Frauen, Stefan Feuerriegel",N/A (摘要需访问详情页),https://proceedings.mlr.press/v162/melnychuk22a/melnychuk22a.pdf,https://proceedings.mlr.press/v162/melnychuk22a.html,melnychuk22a,2022,ICML
Steerable 3D Spherical Neurons,"Pavlo Melnyk, Michael Felsberg, Mårten Wadenbäck",N/A (摘要需访问详情页),https://proceedings.mlr.press/v162/melnyk22a/melnyk22a.pdf,https://proceedings.mlr.press/v162/melnyk22a.html,melnyk22a,2022,ICML
Transformers are Meta-Reinforcement Learners,Luckeciano C Melo,N/A (摘要需访问详情页),https://proceedings.mlr.press/v162/melo22a/melo22a.pdf,https://proceedings.mlr.press/v162/melo22a.html,melo22a,2022,ICML
ButterflyFlow: Building Invertible Layers with Butterfly Matrices,"Chenlin Meng, Linqi Zhou, Kristy Choi, Tri Dao, Stefano Ermon",N/A (摘要需访问详情页),https://proceedings.mlr.press/v162/meng22a/meng22a.pdf,https://proceedings.mlr.press/v162/meng22a.html,meng22a,2022,ICML
In defense of dual-encoders for neural ranking,"Aditya Menon, Sadeep Jayasumana, Ankit Singh Rawat, Seungyeon Kim, Sashank Reddi, Sanjiv Kumar",N/A (摘要需访问详情页),https://proceedings.mlr.press/v162/menon22a/menon22a.pdf,https://proceedings.mlr.press/v162/menon22a.html,menon22a,2022,ICML
Equivariant Quantum Graph Circuits,"Peter Mernyei, Konstantinos Meichanetzidis, Ismail Ilkan Ceylan",N/A (摘要需访问详情页),https://proceedings.mlr.press/v162/mernyei22a/mernyei22a.pdf,https://proceedings.mlr.press/v162/mernyei22a.html,mernyei22a,2022,ICML
Stochastic Rising Bandits,"Alberto Maria Metelli, Francesco Trovò, Matteo Pirola, Marcello Restelli",N/A (摘要需访问详情页),https://proceedings.mlr.press/v162/metelli22a/metelli22a.pdf,https://proceedings.mlr.press/v162/metelli22a.html,metelli22a,2022,ICML
Minimizing Control for Credit Assignment with Strong Feedback,"Alexander Meulemans, Matilde Tristany Farinha, Maria R. Cervera, João Sacramento, Benjamin F. Grewe",N/A (摘要需访问详情页),https://proceedings.mlr.press/v162/meulemans22a/meulemans22a.pdf,https://proceedings.mlr.press/v162/meulemans22a.html,meulemans22a,2022,ICML
A Dynamical System Perspective for Lipschitz Neural Networks,"Laurent Meunier, Blaise J Delattre, Alexandre Araujo, Alexandre Allauzen",N/A (摘要需访问详情页),https://proceedings.mlr.press/v162/meunier22a/meunier22a.pdf,https://proceedings.mlr.press/v162/meunier22a.html,meunier22a,2022,ICML
Distribution Regression with Sliced Wasserstein Kernels,"Dimitri Meunier, Massimiliano Pontil, Carlo Ciliberto",N/A (摘要需访问详情页),https://proceedings.mlr.press/v162/meunier22b/meunier22b.pdf,https://proceedings.mlr.press/v162/meunier22b.html,meunier22b,2022,ICML
Interpretable and Generalizable Graph Learning via Stochastic Attention Mechanism,"Siqi Miao, Mia Liu, Pan Li",N/A (摘要需访问详情页),https://proceedings.mlr.press/v162/miao22a/miao22a.pdf,https://proceedings.mlr.press/v162/miao22a.html,miao22a,2022,ICML
Modeling Structure with Undirected Neural Networks,"Tsvetomila Mihaylova, Vlad Niculae, Andre Martins",N/A (摘要需访问详情页),https://proceedings.mlr.press/v162/mihaylova22a/mihaylova22a.pdf,https://proceedings.mlr.press/v162/mihaylova22a.html,mihaylova22a,2022,ICML
Universal Hopfield Networks: A General Framework for Single-Shot Associative Memory Models,"Beren Millidge, Tommaso Salvatori, Yuhang Song, Thomas Lukasiewicz, Rafal Bogacz",N/A (摘要需访问详情页),https://proceedings.mlr.press/v162/millidge22a/millidge22a.pdf,https://proceedings.mlr.press/v162/millidge22a.html,millidge22a,2022,ICML
Learning Stochastic Shortest Path with Linear Function Approximation,"Yifei Min, Jiafan He, Tianhao Wang, Quanquan Gu",N/A (摘要需访问详情页),https://proceedings.mlr.press/v162/min22a/min22a.pdf,https://proceedings.mlr.press/v162/min22a.html,min22a,2022,ICML
"Prioritized Training on Points that are Learnable, Worth Learning, and not yet Learnt","Sören Mindermann, Jan M Brauner, Muhammed T Razzak, Mrinank Sharma, Andreas Kirsch, Winnie Xu, Benedikt Höltgen, Aidan N Gomez, Adrien Morisot, Sebastian Farquhar, Yarin Gal",N/A (摘要需访问详情页),https://proceedings.mlr.press/v162/mindermann22a/mindermann22a.pdf,https://proceedings.mlr.press/v162/mindermann22a.html,mindermann22a,2022,ICML
POEM: Out-of-Distribution Detection with Posterior Sampling,"Yifei Ming, Ying Fan, Yixuan Li",N/A (摘要需访问详情页),https://proceedings.mlr.press/v162/ming22a/ming22a.pdf,https://proceedings.mlr.press/v162/ming22a.html,ming22a,2022,ICML
A Simple Reward-free Approach to Constrained Reinforcement Learning,"Sobhan Miryoosefi, Chi Jin",N/A (摘要需访问详情页),https://proceedings.mlr.press/v162/miryoosefi22a/miryoosefi22a.pdf,https://proceedings.mlr.press/v162/miryoosefi22a.html,miryoosefi22a,2022,ICML
Wide Neural Networks Forget Less Catastrophically,"Seyed Iman Mirzadeh, Arslan Chaudhry, Dong Yin, Huiyi Hu, Razvan Pascanu, Dilan Gorur, Mehrdad Farajtabar",N/A (摘要需访问详情页),https://proceedings.mlr.press/v162/mirzadeh22a/mirzadeh22a.pdf,https://proceedings.mlr.press/v162/mirzadeh22a.html,mirzadeh22a,2022,ICML
Proximal and Federated Random Reshuffling,"Konstantin Mishchenko, Ahmed Khaled, Peter Richtarik",N/A (摘要需访问详情页),https://proceedings.mlr.press/v162/mishchenko22a/mishchenko22a.pdf,https://proceedings.mlr.press/v162/mishchenko22a.html,mishchenko22a,2022,ICML
ProxSkip: Yes! Local Gradient Steps Provably Lead to Communication Acceleration! Finally!,"Konstantin Mishchenko, Grigory Malinovsky, Sebastian Stich, Peter Richtarik",N/A (摘要需访问详情页),https://proceedings.mlr.press/v162/mishchenko22b/mishchenko22b.pdf,https://proceedings.mlr.press/v162/mishchenko22b.html,mishchenko22b,2022,ICML
Fast Convex Optimization for Two-Layer ReLU Networks: Equivalent Model Classes and Cone Decompositions,"Aaron Mishkin, Arda Sahiner, Mert Pilanci",N/A (摘要需访问详情页),https://proceedings.mlr.press/v162/mishkin22a/mishkin22a.pdf,https://proceedings.mlr.press/v162/mishkin22a.html,mishkin22a,2022,ICML
Memory-Based Model Editing at Scale,"Eric Mitchell, Charles Lin, Antoine Bosselut, Christopher D Manning, Chelsea Finn",N/A (摘要需访问详情页),https://proceedings.mlr.press/v162/mitchell22a/mitchell22a.pdf,https://proceedings.mlr.press/v162/mitchell22a.html,mitchell22a,2022,ICML
Invariant Ancestry Search,"Phillip B Mogensen, Nikolaj Thams, Jonas Peters",N/A (摘要需访问详情页),https://proceedings.mlr.press/v162/mogensen22a/mogensen22a.pdf,https://proceedings.mlr.press/v162/mogensen22a.html,mogensen22a,2022,ICML
Differentially Private Community Detection for Stochastic Block Models,"Mohamed S Mohamed, Dung Nguyen, Anil Vullikanti, Ravi Tandon",N/A (摘要需访问详情页),https://proceedings.mlr.press/v162/mohamed22a/mohamed22a.pdf,https://proceedings.mlr.press/v162/mohamed22a.html,mohamed22a,2022,ICML
A Multi-objective / Multi-task Learning Framework Induced by Pareto Stationarity,"Michinari Momma, Chaosheng Dong, Jia Liu",N/A (摘要需访问详情页),https://proceedings.mlr.press/v162/momma22a/momma22a.pdf,https://proceedings.mlr.press/v162/momma22a.html,momma22a,2022,ICML
EqR: Equivariant Representations for Data-Efficient Reinforcement Learning,"Arnab Kumar Mondal, Vineet Jain, Kaleem Siddiqi, Siamak Ravanbakhsh",N/A (摘要需访问详情页),https://proceedings.mlr.press/v162/mondal22a/mondal22a.pdf,https://proceedings.mlr.press/v162/mondal22a.html,mondal22a,2022,ICML
